,character,quote,episode
0,PICARD ,"   Captain's Log, Stardate 47423.9.   We have arrived at Boraal Two in   response to an emergency distress   call from Lieutenant Worf's foster   brother, Nikolai Rozhenko. He has   been stationed on the planet as a   cultural observer.","""Homeward"""
1,PICARD,"   Mister Data, analysis.","""Homeward"""
2,DATA,"       It appears the planet's atmosphere   is dissipating, sir. Intense   plasmonic reactions are destroying   it.","""Homeward"""
3,PICARD,   How far has it progressed?,"""Homeward"""
4,DATA,"   The stratosphere is already   breaking down, and there are   turbulent radiation storms across   much of the surface.       I estimate the planet will be   uninhabitable in less than thirty-eight   hours.","""Homeward"""
5,RIKER,   The distress call was only four   days ago. Why would Doctor   Rozhenko have waited so long   before sending it?,"""Homeward"""
6,DATA,"   Atmospheric dissipation is a rare   and essentially unpredictable   event. When it occurs, it   proceeds rapidly. Doctor Rozhenko   would not have had much warning.","""Homeward"""
7,PICARD,   What was that?,"""Homeward"""
8,DATA,       The dissipation effect is   generating plasmonic energy   bursts...,"""Homeward"""
9,RIKER,   Are they any danger to the ship?,"""Homeward"""
10,DATA,"   I do not believe so. However, we   may experience intermittent system   failures and power surges as a   result.","""Homeward"""
11,PICARD,   Keep an eye on it.,"""Homeward"""
12,PICARD,       Mister Worf. Any luck?,"""Homeward"""
13,WORF,"   There is still no response to our   hails, sir... I am attempting to   scan the observation post...","""Homeward"""
14,RIKER,       He could be hurt... maybe he can't   respond...,"""Homeward"""
15,WORF,"   Sensor interference is   significant, but the post appears   to be intact... its power grid is   still functioning...","""Homeward"""
16,WORF,"       However, I am reading no life   forms within the structure.","""Homeward"""
17,RIKER,       It's hard to believe he would have   left the post...,"""Homeward"""
18,PICARD,   Especially under these   circumstances...,"""Homeward"""
19,WORF,"       Sir, I am detecting faint power   emissions from a system of caverns   near the post. It could be a   deflector shield.","""Homeward"""
20,RIKER,   It can't be native to the planet.   The Boraalans don't have anything   close to that level of technology.,"""Homeward"""
21,WORF,   Captain. Request permission to   lead an Away Team.,"""Homeward"""
22,PICARD,"   Very well. But regardless of this   planet's immediate situation, we   must still observe the Prime   Directive.     ","""Homeward"""
23,,,"""Homeward"""
24,PICARD ,"       I'd like to minimize the risk of   contact with the inhabitants.   You're to go alone, Mister Worf --   and I want you surgically altered   to pass as a Boraalan.","""Homeward"""
25,WORF,"   Yes, sir.","""Homeward"""
26,BEVERLY,"   Worf, you have to try to keep   still. I need an accurate scan of   your cranial anatomy...","""Homeward"""
27,WORF,"   I'm sorry, Doctor. Please   continue.","""Homeward"""
28,BEVERLY,"   You're worried about Nikolai,   aren't you?","""Homeward"""
29,WORF,       Yes.,"""Homeward"""
30,BEVERLY,   Are the two of you close?,"""Homeward"""
31,WORF,   We are... brothers.,"""Homeward"""
32,BEVERLY,   You've never talked much about   him. What's he like?,"""Homeward"""
33,WORF,       Nikolai is older than I... and we   are not -- alike. We had many   disagreements as we were growing   up.,"""Homeward"""
34,BEVERLY,   That's not unusual.,"""Homeward"""
35,WORF,"   Nikolai... has a mind of his own.   He attended Starfleet Academy --   but he was unable to follow the   rules. He left after one year.       However, he has many fine   qualities. He is... brilliant.   Persuasive. A natural leader...","""Homeward"""
36,BEVERLY,   Sounds intriguing... I look   forward to meeting him.,"""Homeward"""
37,WORF,       Worf to Enterprise...,"""Homeward"""
38,RIKER,       Go ahead...,"""Homeward"""
39,WORF,   I am picking up faint life signs   approximately two-hundred meters   from my position. I am heading   toward them.,"""Homeward"""
40,RIKER,       Understood. The plasmonic   interference is getting worse...   start checking in every thirty   minutes to make sure we have a fix   on you.,"""Homeward"""
41,WORF,"   Aye, sir.","""Homeward"""
42,VORIN ,   What are you doing here... ?,"""Homeward"""
43,VORIN,   You're not from our village. Who   are you?,"""Homeward"""
44,KATERAS,   Who is this... ?,"""Homeward"""
45,WORF,   My name is Worf. I am a...   traveller...,"""Homeward"""
46,VORIN,   How did you survive the storms?,"""Homeward"""
47,NIKOLAI ,"   I'd recognize that voice anywhere.   Is it really you, Worf?","""Homeward"""
48,NIKOLAI,   It's good to see you...       You've changed a lot in four   years...,"""Homeward"""
49,WORF,   Nikolai... ?,"""Homeward"""
50,NIKOLAI,"   This is my brother, Worf...       He's come to help us.","""Homeward"""
51,VORIN,"       If you were able to get here, the   storms must have subsided... Do   you think it's safe enough to   return to the surface?","""Homeward"""
52,WORF,   Please... I must speak with my   brother for a moment...,"""Homeward"""
53,WORF,"       Nikolai, what have you done?","""Homeward"""
54,NIKOLAI,   They were dying.     ,"""Homeward"""
55,,,"""Homeward"""
56,NIKOLAI ,   I refused to sit there... safe in   that observation post... and watch   it happen.       I set up a deflector shield to   screen these caves from the   radiation and then I brought them   here.,"""Homeward"""
57,WORF,   What have you told them?,"""Homeward"""
58,NIKOLAI,   They think I'm a Boraalan. I told   them I'm from another village far   from here.,"""Homeward"""
59,WORF,   At least you had that much   sense...,"""Homeward"""
60,NIKOLAI,   I knew the Enterprise was in this   sector when I sent my distress   call... but I wasn't sure you'd be   the one to come.,"""Homeward"""
61,NIKOLAI,"       I'm truly glad you're here, Worf.","""Homeward"""
62,WORF,   There is nothing we can do for   these people. You have only   postponed their deaths.,"""Homeward"""
63,NIKOLAI,   I'd like to discuss that with your   Captain.,"""Homeward"""
64,WORF,   I am certain he will want to speak   with you.,"""Homeward"""
65,NIKOLAI,   Friends... Worf and I must return   to the surface...,"""Homeward"""
66,NIKOLAI,       He has equipment and provisions   and needs help to bring them here.   We'll return shortly.,"""Homeward"""
67,DOBARA,   It's too dangerous. The storms   can occur without warning. If   you're caught in one...,"""Homeward"""
68,NIKOLAI,   Don't worry...       My brother is a seer. He   understands the nature of the   storms. He'll know when it's safe   to travel.,"""Homeward"""
69,WORF,       That is correct.,"""Homeward"""
70,KATERAS,       Our Seer died when the storms   first came. We have been without   his guidance for many weeks.,"""Homeward"""
71,VORIN,"       Let me go with you. I know the   terrain better than anyone, and I   can help--","""Homeward"""
72,NIKOLAI,"   No, Vorin. Worf and I will be   fine. We'll be back soon.","""Homeward"""
73,PICARD,"   Doctor, you were fully aware that   the atmospheric dissipation could   not be stopped. What were you   hoping to accomplish by assisting   these people?","""Homeward"""
74,NIKOLAI,   I was trying to give them a   future.       I propose we create an atmospheric   shield on the planet. We can   camouflage the equipment just like   my observation post. No one will   ever know it's there.,"""Homeward"""
75,RIKER,   You can't be serious.,"""Homeward"""
76,NIKOLAI,   I realize it would only provide   atmosphere for a limited area of   the surface. But it would be   enough to save one village.,"""Homeward"""
77,PICARD,   I have no intention of compounding   what you've already done by   committing another gross violation   of the Prime Directive.,"""Homeward"""
78,NIKOLAI,   The Boraalans have a rich and   beautiful culture... a deep   spiritual life. They deserve the   chance to survive.,"""Homeward"""
79,NIKOLAI,   Isn't that what the Prime   Directive was truly intended to   do... allow cultures to survive   and grow naturally?,"""Homeward"""
80,TROI,   Not entirely. The Prime Directive   was designed to ensure non-interference.,"""Homeward"""
81,BEVERLY,"   But aren't we intefering either   way? If we take no action, it's   a conscious decision to let the   Boraalans die.","""Homeward"""
82,NIKOLAI,   Exactly.       We have the power to save some of   them... all we have to do is   exercise it.,"""Homeward"""
83,PICARD,"   The Prime Directive is a principle   we've all sworn to uphold. Until   that is changed, we cannot follow   any other course of action. Is   that understood?","""Homeward"""
84,NIKOLAI,"   There are several log recorders in   my observation post... They   contain most of my research.   Since it appears that the only way   I'll be able to preserve Boraalan   culture is in a museum, I would   like permission to return to the   surface and retrieve them.","""Homeward"""
85,PICARD,   I'm afraid that won't be possible.   You may have full use of the   ship's computers to set up a com   link and upload your data from   here.,"""Homeward"""
86,PICARD,"       If there's nothing further, you're   dismissed.","""Homeward"""
87,WORF,       Nikolai... I am sorry. I wish   there were another way.,"""Homeward"""
88,WORF,"       I am quite familiar with our   communications systems. If you   wish, I will help you set up your   com link.","""Homeward"""
89,NIKOLAI,   No. I'll do it myself.,"""Homeward"""
90,DATA,"       Captain, the atmospheric   dissipation has accelerated over   the past several hours. I   estimate the planet's atmosphere   will be completely gone within   four minutes.","""Homeward"""
91,NIKOLAI,"   I've completed my data uplink,   Captain.     ","""Homeward"""
92,,,"""Homeward"""
93,NIKOLAI ,"   With your permission, I'd like to   integrate my research logs into   the ship's library computer.","""Homeward"""
94,PICARD,   Of course.,"""Homeward"""
95,DATA,       The mesosphere is gone. Ionic   reactions are now beginning to   break down the troposphere.,"""Homeward"""
96,PICARD,   Put it on-screen...,"""Homeward"""
97,PICARD,   What's going on?,"""Homeward"""
98,DATA,   It appears that the plasmonic   reactions are continuing to   interfere with our sensors.,"""Homeward"""
99,RIKER,   I thought you'd already   compensated for that.,"""Homeward"""
100,DATA,"       I had, sir...       I will attempt to engage   additional filtering elements...","""Homeward"""
101,DATA,       Visual re-established.,"""Homeward"""
102,PICARD,   This is one of the times when we   must face the ramifications of the   Prime Directive... and honor the   lives we cannot save.,"""Homeward"""
103,NIKOLAI,"   I find no honor in this   whatsoever, Captain. You'll   excuse me if I don't stay.","""Homeward"""
104,PICARD,"   Number One, I'll be in my Ready   Room. You have the Bridge.","""Homeward"""
105,RIKER,"   Helm, take us out of orbit. Set   course for Starbase eighty-seven,   warp five.","""Homeward"""
106,HELMSMAN  ,"   Aye, sir.","""Homeward"""
107,RIKER,   What happened?,"""Homeward"""
108,DATA,   There appears to be an unusual   power drain in the EPS   distribution net...,"""Homeward"""
109,RIKER,   What's the source?,"""Homeward"""
110,DATA,"   Unknown, sir... it is difficult to   localize.","""Homeward"""
111,WORF,"   The power drain has registered on   my security grid as well, sir...   it appears to be coming from deck   ten.","""Homeward"""
112,RIKER,"       All right, Worf. Get a security   team on it.","""Homeward"""
113,WORF,       Concentrate your scans on the EPS   transfer links...,"""Homeward"""
114,WORF,   Computer. Open Holodeck Five.,"""Homeward"""
115,COMPUTER,   Unable to comply. Holodeck Five   is in use.,"""Homeward"""
116,WORF,"   Override. Authorization, Worf   Theta-six-one-nine.","""Homeward"""
117,COMPUTER,   Unable to comply. Holodeck   control systems have been   bypassed.,"""Homeward"""
118,NIKOLAI ,   Worf... Come in...,"""Homeward"""
119,WORF,   What are you doing here?,"""Homeward"""
120,NIKOLAI,   I have to show you something.   Follow me...,"""Homeward"""
121,NIKOLAI,"       Whatever you do, stay quiet.","""Homeward"""
122,NIKOLAI,   Look.,"""Homeward"""
123,NIKOLAI,   I've done what you refused to do.   I've saved them.,"""Homeward"""
124,NIKOLAI,"   I started thinking about this days   ago... when it became clear the   planet was doomed. I knew if I   could get access to your ship's   computer, I'd be able to generate   a replica of the caves...","""Homeward"""
125,NIKOLAI,   The hard part was transporting the   Boraalans into the Holodeck   without anyone on the Enterprise   noticing. But I was able to blank   out the sensors and make it look   like interference from the   plasmonic .,"""Homeward"""
126,NIKOLAI,   And it worked. Perfectly. The   Boraalans were transported while   they were sleeping -- they didn't   even know anything had happened.,"""Homeward"""
127,WORF,   Bridge.,"""Homeward"""
128,NIKOLAI,"   It's a simple plan, really...   that's the beauty of it.       Trust me, Worf -- this is going to   work.","""Homeward"""
129,WORF,       Trust you? You never had any   intention of obeying the Captain!,"""Homeward"""
130,NIKOLAI,   I wasn't going to let those people   die just because your Captain   started quoting Federation dogma   to me.,"""Homeward"""
131,WORF,   Your duty was to respect the   Captain's orders and uphold the   Prime Directive.,"""Homeward"""
132,NIKOLAI,"   Duty. That's all that really   matters to you, isn't it?       Well, I refuse to be bound by an   abstraction. The lives of the   people of Boraal are far more   important to me.","""Homeward"""
133,NIKOLAI,   Worf... you worry too much. You   always did. Everything will work   out.,"""Homeward"""
134,WORF,   You have disgraced yourself... and   you have disgraced me. I want   nothing more to do with you.,"""Homeward"""
135,PICARD,   You realize your career is   finished.,"""Homeward"""
136,NIKOLAI,"   I know that, Captain. And I would   do it all again.","""Homeward"""
137,PICARD,   What do you expect us to do now?   You've left us with a colony of   Boraalans who think they're still   on their planet.,"""Homeward"""
138,NIKOLAI,   I didn't beam them up here without   a plan. I've given this a lot of   thought.,"""Homeward"""
139,NIKOLAI,   I believe we can find a new   planet... an M-class world...   which can become their new home.,"""Homeward"""
140,PICARD,   A home which would look very   different from Boraal... you can't   really believe they'd be fooled...,"""Homeward"""
141,NIKOLAI,"   That's where the Holodeck comes   in. I'll go back and tell the   Boraalans we're going on a   journey... to a different place,   where they'll be safe from the   storms. The Holodeck can change   the terrain gradually as we   travel... so that at the end, the   Holodeck simulation will match the   conditions on the new planet.     ","""Homeward"""
142,,,"""Homeward"""
143,NIKOLAI ,"       And then, we'll beam them down.","""Homeward"""
144,PICARD,   What if it doesn't work? What if   they become aware that something   strange is going on?,"""Homeward"""
145,NIKOLAI,   I can't prepare for every   contingency. But I assure you --   I'm used to thinking on my feet.   I'll deal with the situation as it   evolves.,"""Homeward"""
146,PICARD,   I'm not enthusiastic about this   plan... but I don't see another   option. We'll give it a try.,"""Homeward"""
147,BEVERLY,   There are countless M-class   planets in Federation space which   could support the Boraalans.   We'll have to narrow the   parameters.,"""Homeward"""
148,DATA,   I estimate it will take   approximately nine and one half   hours to complete the analysis.,"""Homeward"""
149,PICARD,   And even then there's no guarantee   we'll be able to find a suitable   planet...,"""Homeward"""
150,DATA,   That is correct.,"""Homeward"""
151,GEORDI ,"   Excuse me, Captain... but I think   you better take a look at this...","""Homeward"""
152,PICARD,   What is it?,"""Homeward"""
153,GEORDI,"   We've got a problem, sir. I don't   think it's going to be possible to   keep this Holodeck simulation   stable.","""Homeward"""
154,PICARD,       Why not?,"""Homeward"""
155,GEORDI,   The plasmonic energy surges from   the planet have affected some of   the ship's systems. We're having   problems with the EPS subsystems   and the power distribution matrix.,"""Homeward"""
156,NIKOLAI,"   As a result, the Holodeck imaging   processor has been severely   destabilized.","""Homeward"""
157,GEORDI,   It's not a question of whether the   simulation is going to break   down... it's a question of when.,"""Homeward"""
158,PICARD,   There's no way around it?,"""Homeward"""
159,GEORDI,"   Not while it's running. To fix   it, I'd have to shut down all of   the Holodecks and re-initialize   the entire system.","""Homeward"""
160,PICARD,   That would take hours...,"""Homeward"""
161,NIKOLAI,   We'll just have to hope the   simulation holds long enough.,"""Homeward"""
162,PICARD,"   Very well. Let's try it.       Monitor the situation closely,   Mister La Forge.     ","""Homeward"""
163,,,"""Homeward"""
164,PICARD ,   Keep an open com link with the   Holodeck so you can be apprised of   any problems.,"""Homeward"""
165,GEORDI,"   Aye, sir.","""Homeward"""
166,NIKOLAI,"   I'll go back to the Holodeck as   soon as my surgical alterations   are complete. I'll prepare the   Boraalans for their ""journey.""","""Homeward"""
167,PICARD,"   Considering the situation you've   put us in, I don't think it's wise   to leave you alone with those   people. Mister Worf will   accompany you.","""Homeward"""
168,WORF,   Sir. Perhaps someone else would   be a better choice. Counselor   Troi is familiar with --,"""Homeward"""
169,PICARD,"   No, the Boraalans already know   you. There's no need to introduce   anyone new.","""Homeward"""
170,WORF,"       Yes, sir.","""Homeward"""
171,PICARD,   Keep a close eye on your brother.   I don't want him making the   situation any worse than it is.,"""Homeward"""
172,NIKOLAI,   Here... we have food...,"""Homeward"""
173,NIKOLAI,"       My friends, this is difficult to   say... but you have the right to   know.       By the time Worf and I reached the   surface, the village was gone.     ","""Homeward"""
174,,,"""Homeward"""
175,NIKOLAI ,   The storms had destroyed   everything. There is nothing for   us to return to.,"""Homeward"""
176,DOBARA,   We can't survive in here... our   supplies won't last forever.,"""Homeward"""
177,NIKOLAI,"   That is why we must leave. There   is a place far from here where   there are no storms. It will be   a difficult journey, but in the   end, we will have a new home...","""Homeward"""
178,WORF,   I know a way through the caves.   We can travel safely until we   return to the surface.,"""Homeward"""
179,VORIN,   Where is this new land?,"""Homeward"""
180,WORF,"   As we said, it is far from here.   It will not be like the home you   knew... even the stars may be   different.","""Homeward"""
181,VORIN,   Why would they be different? And   how do you know we'll be safe   there?,"""Homeward"""
182,NIKOLAI,       Vorin. Remember -- my brother is   a Seer. If he says we'll be   safe... you can trust that we   will be.,"""Homeward"""
183,KATERAS,   What's wrong?,"""Homeward"""
184,TARRANA,   Look...,"""Homeward"""
185,WORF,   Do not worry... it is an omen...,"""Homeward"""
186,DOBARA,   What does it mean?,"""Homeward"""
187,WORF,   This is the sign of... La Forge.   It is a message to travellers...,"""Homeward"""
188,WORF,       It is said that when these lines   appear and disappear in a pool of   water...,"""Homeward"""
189,WORF,       The road ahead will be filled with   good fortune...,"""Homeward"""
190,GEORDI,"       Hang in there, Worf... just give   me a second...       There, that should do it...","""Homeward"""
191,NIKOLAI,"       You see? Our journey is already   blessed. We have a long road   ahead. Let's have a meal, and   then we can make preparations to   leave.","""Homeward"""
192,NIKOLAI,"    (continuing, quieter to     Worf)   Good work...       It seems we're not such a bad team   after all.","""Homeward"""
193,WORF,"       We are not a ""team."" I am here   because Captain Picard ordered me   here.","""Homeward"""
194,NIKOLAI,   Worf -- don't we share the same   goal? Aren't we both trying to   make this plan work?,"""Homeward"""
195,WORF,   Only because you forced us into   it.,"""Homeward"""
196,NIKOLAI,   I'm not ashamed of what I did.   I'm not sorry I saved their   lives...,"""Homeward"""
197,WORF,   You have not changed. You still   expect others to solve the   problems you create.,"""Homeward"""
198,NIKOLAI,   I'm not here to work out the   issues of our childhood. I'm   trying to save a people I care   about. And if that upsets you --   so be it.,"""Homeward"""
199,DATA,   These are the two planets which   best match our search criteria...,"""Homeward"""
200,DATA,"   Draygo Four features an unusually   large temperate zone. However, it   is within three light-years of   Cardassian space.","""Homeward"""
201,BEVERLY,   There are constant border disputes   in that sector...,"""Homeward"""
202,DATA,   The alternative is Vacca Six. It   is located in the Cabral sector...,"""Homeward"""
203,BEVERLY,       That's pretty isolated...,"""Homeward"""
204,DATA,"   It offers a less hospitable   climate than the Boraalans are   accustomed to. However, it would   still appear to be the better   choice.","""Homeward"""
205,DATA,"   Do you disagree, Doctor?","""Homeward"""
206,BEVERLY,"   No, Data... you're right. It's   just that... the enormity of what   we're doing is overwhelming.   We're deciding the future of a   species.","""Homeward"""
207,DATA,   It is a formidable responsibility.,"""Homeward"""
208,BEVERLY,"   There are so many questions we   can't answer... what if the   climate is so different that it   affects them in some way we can't   anticipate? Can we even be sure   they'll survive? And if they do,   how will their society evolve   here... and what impact will it   have on the Vaccan system?       We have no idea what this decision   will mean for their future.","""Homeward"""
209,DATA,"   I do not believe we can offer any   guarantees, Doctor. We can simply   make the best choice we have at   the moment.","""Homeward"""
210,BEVERLY,"   Right.       Well, Vacca Six it is, then.","""Homeward"""
211,DATA,       Data to Bridge...,"""Homeward"""
212,PICARD,   Picard here...,"""Homeward"""
213,DATA,"   We have located a new home for the   Boraalans, sir. It is Vacca Six   in the Cabral sector.","""Homeward"""
214,RIKER,"       At maximum warp, we could be there   in less than forty-two hours, sir.","""Homeward"""
215,PICARD,   Very well.       Helm. Set course for Vacca Six.,"""Homeward"""
216,WORF,   What is this?,"""Homeward"""
217,VORIN,       Our chronicle.,"""Homeward"""
218,VORIN,       The history of our village.   Doesn't your village keep a   chronicle?,"""Homeward"""
219,WORF,       Not in this manner.,"""Homeward"""
220,VORIN,   Then how do you teach your   children their history... who   their ancestors were... and where   they come from?,"""Homeward"""
221,,,"""Homeward"""
222,WORF,   We tell each other stories... make   up songs...,"""Homeward"""
223,VORIN,   Stories change with each person   who tells them. This...       ... will always be the same.       Our chronicle has been maintained   for seventeen generations. I was   only able to save the last six.,"""Homeward"""
224,VORIN,       This shows the destruction of our   village... and this is you and   Nikolai leading us to safety.,"""Homeward"""
225,WORF,       We must leave. Gather your   belongings.,"""Homeward"""
226,VORIN,       One of the scrolls is gone...       I must have dropped it in the   passageway... I'll go look...,"""Homeward"""
227,WORF,   We must stay together. You will   have to leave it behind.,"""Homeward"""
228,VORIN,"    (shocked by the     suggestion)   Worf. The chronicle is the life   of our village. Without that   past, our future means nothing.   I must find it.","""Homeward"""
229,WORF,   Go... and return quickly.,"""Homeward"""
230,KATERAS ,   Seer!,"""Homeward"""
231,KATERAS,       I'm an old man... would you help   me with my gear?,"""Homeward"""
232,KATERAS,       That is Tarrana... my daughter.   I am fortunate that she was old   enough to survive the storms.,"""Homeward"""
233,WORF,   She is a... fine girl.,"""Homeward"""
234,KATERAS,   She is a beautiful girl.,"""Homeward"""
235,KATERAS,       She hasn't been promised to   anyone. If I don't reach our new   home -- I would like her to become   your wife.,"""Homeward"""
236,WORF,   You will reach your new home... I   promise.,"""Homeward"""
237,RIKER,"   All right, everybody... back   off...","""Homeward"""
238,TROI,   I know things must look very   strange to you... but everything's   going to be fine. No one is going   to hurt you...,"""Homeward"""
239,TROI,       We're friends of Nikolai and   Worf... Don't be afraid...,"""Homeward"""
240,VORIN,   Nikolai... ?,"""Homeward"""
241,TROI,"   Yes, he is my friend... and that   means you are, too. I promise I   won't hurt you...","""Homeward"""
242,VORIN,   Please... help me...,"""Homeward"""
243,VORIN,   Where am I?,"""Homeward"""
244,BEVERLY,"   I'm sorry, there's nothing I can   do... his neural physiology is   unusual. I can't wipe his memory.","""Homeward"""
245,PICARD,   I see...       How is he?,"""Homeward"""
246,BEVERLY,"   As well as can be expected. I   gave him a mild sedative, and   Deanna's been talking to him the   whole time. He's calmed down a   lot.","""Homeward"""
247,PICARD,   Does he understand the situation?,"""Homeward"""
248,BEVERLY,   I think so.,"""Homeward"""
