,character,quote,episode
249,PICARD,   All right. Get in touch with   Mister Worf... make sure he knows   what's happened.,"""Homeward"""
250,TROI,   This is Captain Picard.,"""Homeward"""
251,PICARD,"   Vorin, isn't it?","""Homeward"""
252,VORIN,   Why did you bring us here?,"""Homeward"""
253,PICARD,   Your planet was dying... it could   no longer support life. So we   took you away from it.,"""Homeward"""
254,VORIN,   But... we never left the caves...,"""Homeward"""
255,PICARD,"   We have the ability to create   the... illusion of other places,   like the caves on your planet.   You have actually been on this   starship for the last two days...   not on Boraal.","""Homeward"""
256,VORIN,   Then our home... is gone?,"""Homeward"""
257,TROI,       Yes.,"""Homeward"""
258,PICARD,   Vorin. Listen to me. We can   travel to many worlds. We will   take you to one where your people   can build a new life...,"""Homeward"""
259,VORIN,   A new life... ?,"""Homeward"""
260,PICARD,   A chance... for your people...   your culture... to survive and   grow.,"""Homeward"""
261,VORIN,   How can we grow when everything   that made us who we are... is   gone?,"""Homeward"""
262,WORF,   I will carry this. Go join the   others...,"""Homeward"""
263,KATERAS,"   Thank you, Seer...","""Homeward"""
264,NIKOLAI,   It'll be dark in a few hours...   Can you tell Mister La Forge to   create a suitable campsite for us   a few kilometers from here?,"""Homeward"""
265,NIKOLAI,       What's the matter?,"""Homeward"""
266,WORF,   Vorin has left the Holodeck.,"""Homeward"""
267,NIKOLAI,       How did he get out?,"""Homeward"""
268,WORF,   I don't know. But Doctor Crusher   cannot erase his memory.,"""Homeward"""
269,NIKOLAI,   What will they do with him?,"""Homeward"""
270,WORF,   They have explained the situation   to him... he must make his own   decision.,"""Homeward"""
271,NIKOLAI,   Are you saying that if Vorin wants   to come back in here... they'll   let him?,"""Homeward"""
272,WORF,   That is his right. He's not a   prisoner.,"""Homeward"""
273,NIKOLAI,"   If he comes back and tells the   others what he's seen on the   Enterprise, everything we've done   will be for nothing...","""Homeward"""
274,WORF,   You should've considered that   before you beamed them aboard!,"""Homeward"""
275,WORF,   But you never think about the   consequences of your acts.,"""Homeward"""
276,NIKOLAI,   If you mean I'm willing to do   something -- while others hesitate --   that's true.,"""Homeward"""
277,WORF,"   Wherever you go, you create chaos.   How many times did our parents lie   awake at night, wondering what   kind of trouble you were in?","""Homeward"""
278,NIKOLAI,"   If only I could have been more   like you -- Worf, the perfect son.","""Homeward"""
279,WORF,   I was not perfect -- but I was not   wild and disobedient.,"""Homeward"""
280,NIKOLAI,   Of course not. You were too busy   doing your duty.,"""Homeward"""
281,WORF,   I would rather be accused of that --   than of making our mother weep.,"""Homeward"""
282,WORF,       But it is clear you have no   intention of changing. I see no   reason to discuss it further.,"""Homeward"""
283,WORF,"   Commander, the Holodeck   malfunctions are increasing...","""Homeward"""
284,GEORDI,   I'm running every stabilization   routine I know...,"""Homeward"""
285,WORF,   How much longer until we reach the   new planet?,"""Homeward"""
286,GEORDI,   We'll be there in less than eight   hours... You just have to hold   things together a little while   longer...,"""Homeward"""
287,WORF,       Someone is coming...,"""Homeward"""
288,DOBARA,   May I speak with you?,"""Homeward"""
289,WORF,   Of course.,"""Homeward"""
290,DOBARA,"   I don't know what Nikolai said to   you, but please... forgive him.","""Homeward"""
291,WORF,   It is an... old argument.,"""Homeward"""
292,DOBARA,"   I've never seen him like this.   He's usually so confident, so sure   of himself... But now he seems...   different. Do you know why?","""Homeward"""
293,WORF,   No. I do not.,"""Homeward"""
294,DOBARA,"   Ever since Vorin was lost, people   have been afraid... worried that   we won't reach our new home.       We need Nikolai's strength now...   more than ever.","""Homeward"""
295,DOBARA,"       When the storms first came to our   village, many of us were ready to   die... but Nikolai refused to let   us. He gathered us together and   led us into the caves. He saved   us.       He's a brave and compassionate   man... and I love him. Please go   to him... make things right   between you. I want us to be a   family.","""Homeward"""
296,WORF,   Us?,"""Homeward"""
297,DOBARA,   Yes. I want you to consider   yourself my brother.,"""Homeward"""
298,DOBARA,       After all -- you're going to be   the uncle of my child.,"""Homeward"""
299,DATA,"   We are in synchronous orbit above   the beam-down site, sir.","""Homeward"""
300,PICARD,   Good.       Mister La Forge. How much longer   before we can transport the   Boraalans?,"""Homeward"""
301,GEORDI,"       A few more hours, sir... but we've   got some problems here.","""Homeward"""
302,GEORDI,       I don't think the Holodeck's going   to last that long. We've had   materialization errors and   resolution failures all over the   place -- and it's getting worse.   The simulation could fall apart   any minute.,"""Homeward"""
303,PICARD,       We'll have the Transporter room   standing by...     ,"""Homeward"""
304,,,"""Homeward"""
305,PICARD ,   We may need to transport the   Boraalans whether you're ready or   not. Keep Mister Worf apprised of   the situation.,"""Homeward"""
306,GEORDI,"   Aye, sir.","""Homeward"""
307,PICARD,"       Commander, you have the Bridge...   We still have one more problem to   worry about...","""Homeward"""
308,VORIN,   Yes...,"""Homeward"""
309,PICARD,   Vorin. We've arrived at the   planet I told you about...       Have you made a decision?,"""Homeward"""
310,VORIN,   I believe I would like to go back   to my people.,"""Homeward"""
311,PICARD,   I see.       And what do you intend to tell   them?,"""Homeward"""
312,VORIN,   I don't know...,"""Homeward"""
313,PICARD,   If you tell them the truth -- what   will happen? Will they believe   you?,"""Homeward"""
314,VORIN,   I'm not sure. It is a fantastic   story.,"""Homeward"""
315,PICARD,   It's possible they'll think you   had an hallucination... or even   that you're insane...,"""Homeward"""
316,VORIN,   I don't think I'd like to live my   life knowing what I know -- and   being thought of as a madman...,"""Homeward"""
317,PICARD,"   On the other hand, they may   believe your fantastic story.   They would learn about alien   worlds and starships...","""Homeward"""
318,VORIN,   That would be disastrous. It   would destroy everything they   believed in...,"""Homeward"""
319,VORIN,   I can't tell them the truth... but   I don't think I can live with a   secret.,"""Homeward"""
320,PICARD,   You can stay here. Make a future   for yourself... with us.,"""Homeward"""
321,VORIN,   I need some time... please...,"""Homeward"""
322,WORF,   How could you have mated with a   Boraalan? What were you thinking?,"""Homeward"""
323,NIKOLAI,   I don't owe you an explanation.   It's a matter between Dobara and   me.,"""Homeward"""
324,WORF,"   As usual, you are thinking only of   yourself.","""Homeward"""
325,NIKOLAI,"   And as usual, you're here to point   out the error of my ways.","""Homeward"""
326,WORF,   You have treated Dobara with   dishonor.,"""Homeward"""
327,NIKOLAI,   No -- I love her and I intend to   raise our child together.,"""Homeward"""
328,WORF,   That is impossible -- I cannot   allow you to stay here.,"""Homeward"""
329,NIKOLAI,   You will have to kill me first --,"""Homeward"""
330,DOBARA,       What does it mean... ?,"""Homeward"""
331,NIKOLAI,       The storms have returned.,"""Homeward"""
332,KATERAS,   We will be killed...,"""Homeward"""
333,NIKOLAI,   No! Worf has the power to end the   storms once and for all...,"""Homeward"""
334,WORF,   Yes. But everyone must take   shelter in the tents.,"""Homeward"""
335,KATERAS,   The tents won't protect us...,"""Homeward"""
336,NIKOLAI,   Worf will protect you. You must   trust him.,"""Homeward"""
337,WORF,   Commander... it might help if you   could produce a storm...,"""Homeward"""
338,WORF,"   ... wind, lightning and thunder.","""Homeward"""
339,GEORDI,   I'll see what I can do...,"""Homeward"""
340,NIKOLAI,   The storm is getting worse! You   must go to your tents -- now!,"""Homeward"""
341,WORF,       Commander... Energize...,"""Homeward"""
342,WORF,   The storms will not return.,"""Homeward"""
343,NIKOLAI,   What did I tell you? My brother   has saved us.,"""Homeward"""
344,PICARD ,"   Captain's Log, Stardate 47427.2.   The Boraalans have safely reached   the site of what will eventually   become their new village. None of   them suspects they ever left their   planet. However, our success has   come at a high price...","""Homeward"""
345,BEVERLY,   I think it was some form of ritual   suicide...,"""Homeward"""
346,PICARD,   He said he had nowhere to go...,"""Homeward"""
347,BEVERLY,   He'd have died even if we hadn't   interfered...,"""Homeward"""
348,PICARD,   But he wouldn't have died alone...   and afraid...,"""Homeward"""
349,BEVERLY,   Are you saying you're sorry we   saved the Boraalans?,"""Homeward"""
350,PICARD,"   No, of course not. Our plan   worked out well for them...","""Homeward"""
351,PICARD,       But I wish Vorin could have   bridged the gap between our   cultures. I would have liked the   chance to know him better.,"""Homeward"""
352,NIKOLAI,   Dobara... go inside.,"""Homeward"""
353,DOBARA,   Nikolai -- don't...,"""Homeward"""
354,NIKOLAI,   Please.,"""Homeward"""
355,NIKOLAI,   I told you -- you'll have to kill   me to get me away from here.,"""Homeward"""
356,WORF,"   I don't want to fight you,   Nikolai.","""Homeward"""
357,NIKOLAI,"   Nothing was ever easy between us,   was it?","""Homeward"""
358,WORF,   No.,"""Homeward"""
359,NIKOLAI,"   It's my fault. If I'd been more   like you, we wouldn't have had so   many problems.","""Homeward"""
360,WORF,   If you'd been more like me --   those people would not be here   now. You gave them a chance at a   new life.,"""Homeward"""
361,NIKOLAI,   Worf... I intend to share that   life with them. The village will   need someone to begin a new   chronicle... and my child will   need a father. My place is here.       Don't you see? I'm finally taking   responsibility.,"""Homeward"""
362,WORF,   You were never good at drawing...   how will you keep a chronicle?,"""Homeward"""
363,NIKOLAI,   I learn quickly.,"""Homeward"""
364,WORF,   Then perhaps there is hope...,"""Homeward"""
365,WORF,       May I take this with me?,"""Homeward"""
366,NIKOLAI,   It's yours.,"""Homeward"""
367,WORF,   I will attempt to explain all this   to mother and father.,"""Homeward"""
368,NIKOLAI,   They won't understand.,"""Homeward"""
369,WORF,   They may. I will tell them... you   are happy.,"""Homeward"""
