,character,quote,scene,location,view,episode,date,series,file
131,LUTAN,"   You will display your image,   please.",23   INT. MAIN BRIDGE - WIDE ANGLE,MAIN BRIDG,INT.,Code of Honor,1987-07-02,The Next Generation,104.txt
132,PICARD,"   What is required is an image of   Lieutenant Yar, well and...",23   INT. MAIN BRIDGE - WIDE ANGLE,MAIN BRIDG,INT.,Code of Honor,1987-07-02,The Next Generation,104.txt
133,LUTAN,"       Are you making demands, Captain?",23   INT. MAIN BRIDGE - WIDE ANGLE,MAIN BRIDG,INT.,Code of Honor,1987-07-02,The Next Generation,104.txt
134,TROI,   Sir...,23   INT. MAIN BRIDGE - WIDE ANGLE,MAIN BRIDG,INT.,Code of Honor,1987-07-02,The Next Generation,104.txt
135,TROI,"       According to the Ligon Code of   Honor, Lutan has done what he set   out to do -- achieve recognition   for being daring and bold.",23   INT. MAIN BRIDGE - WIDE ANGLE,MAIN BRIDG,INT.,Code of Honor,1987-07-02,The Next Generation,104.txt
136,RIKER,"   We've studied this in some depth   now, sir. The proper thing for   you to do now is to ask to get   Tasha back.",23   INT. MAIN BRIDGE - WIDE ANGLE,MAIN BRIDG,INT.,Code of Honor,1987-07-02,The Next Generation,104.txt
137,PICARD,       Ask for her?,23   INT. MAIN BRIDGE - WIDE ANGLE,MAIN BRIDG,INT.,Code of Honor,1987-07-02,The Next Generation,104.txt
138,DATA,"   Politely, Captain.",23   INT. MAIN BRIDGE - WIDE ANGLE,MAIN BRIDG,INT.,Code of Honor,1987-07-02,The Next Generation,104.txt
139,PICARD,"       And now, Lutan...       You have boldly taken the   lieutenant from us and I ask that   you... now please return her.",23   INT. MAIN BRIDGE - WIDE ANGLE,MAIN BRIDG,INT.,Code of Honor,1987-07-02,The Next Generation,104.txt
140,LUTAN,"   Then come visit us, Captain, and   we will return her to you.",23   INT. MAIN BRIDGE - WIDE ANGLE,MAIN BRIDG,INT.,Code of Honor,1987-07-02,The Next Generation,104.txt
141,RIKER,   First Officer to Transporter   Chief...,31   INT. MAIN BRIDGE - EMPHASIZING RIKER,MAIN BRIDG,INT.,Code of Honor,1987-07-02,The Next Generation,104.txt
142,TROI,       Forgive me but can you delay   calling him?,31   INT. MAIN BRIDGE - EMPHASIZING RIKER,MAIN BRIDG,INT.,Code of Honor,1987-07-02,The Next Generation,104.txt
143,DATA,       Please. We must discuss the away   party.,31   INT. MAIN BRIDGE - EMPHASIZING RIKER,MAIN BRIDG,INT.,Code of Honor,1987-07-02,The Next Generation,104.txt
144,PICARD,   Am I included?,31   INT. MAIN BRIDGE - EMPHASIZING RIKER,MAIN BRIDG,INT.,Code of Honor,1987-07-02,The Next Generation,104.txt
145,DATA ,"   It concerns you directly, Captain.",31   INT. MAIN BRIDGE - EMPHASIZING RIKER,MAIN BRIDG,INT.,Code of Honor,1987-07-02,The Next Generation,104.txt
146,BEVERLY ,   Wesley. It's time we left.,31   INT. MAIN BRIDGE - EMPHASIZING RIKER,MAIN BRIDG,INT.,Code of Honor,1987-07-02,The Next Generation,104.txt
147,PICARD,   Wesley... thanks for taking a turn   at the controls.,31   INT. MAIN BRIDGE - EMPHASIZING RIKER,MAIN BRIDG,INT.,Code of Honor,1987-07-02,The Next Generation,104.txt
148,WESLEY,   Yes sir.,31   INT. MAIN BRIDGE - EMPHASIZING RIKER,MAIN BRIDG,INT.,Code of Honor,1987-07-02,The Next Generation,104.txt
149,TROI,   Commander....,31   INT. MAIN BRIDGE - EMPHASIZING RIKER,MAIN BRIDG,INT.,Code of Honor,1987-07-02,The Next Generation,104.txt
150,RIKER,"   ""Commander?"" That's quite   formal...",31   INT. MAIN BRIDGE - EMPHASIZING RIKER,MAIN BRIDG,INT.,Code of Honor,1987-07-02,The Next Generation,104.txt
151,TROI,"   So is this request, sir. We   believe it would be preferable   if the captain led this away   party.",31   INT. MAIN BRIDGE - EMPHASIZING RIKER,MAIN BRIDG,INT.,Code of Honor,1987-07-02,The Next Generation,104.txt
152,DATA,"   Agreed, sir. Their customs   concerning guests make it much   preferable.",31   INT. MAIN BRIDGE - EMPHASIZING RIKER,MAIN BRIDG,INT.,Code of Honor,1987-07-02,The Next Generation,104.txt
153,RIKER,"       And I'm very much against it.   Lutan is clearly a liar, and   devious. Counselor Troi has   admitted she believes him capable   of killing. It is my duty to keep   the captain out of danger, sir.",31   INT. MAIN BRIDGE - EMPHASIZING RIKER,MAIN BRIDG,INT.,Code of Honor,1987-07-02,The Next Generation,104.txt
154,DATA,"   Except that Ligonian custom makes   it clear that a visiting leader   becomes an honored guest.       Not us, not second in command...   him.",31   INT. MAIN BRIDGE - EMPHASIZING RIKER,MAIN BRIDG,INT.,Code of Honor,1987-07-02,The Next Generation,104.txt
155,TROI,   And the custom requires Lutan to   die rather than violate that.,31   INT. MAIN BRIDGE - EMPHASIZING RIKER,MAIN BRIDG,INT.,Code of Honor,1987-07-02,The Next Generation,104.txt
156,RIKER,"   Yes... it does sound reasonable   put that way.       I warn you, Captain... if you get   hurt, I'll put you on report!",31   INT. MAIN BRIDGE - EMPHASIZING RIKER,MAIN BRIDG,INT.,Code of Honor,1987-07-02,The Next Generation,104.txt
157,LUTAN,"   Welcome to my Centerplace, Captain   Picard. Consider yourselves my   honored guests.",34   EXT. LUTAN'S CENTERPLACE ON LIGON - ESTABLISHING,LUTAN'S CENTERPLACE ON LIGO,EXT.,Code of Honor,1987-07-02,The Next Generation,104.txt
158,YAREENA ,   Every hospitality will be accorded   you.,34   EXT. LUTAN'S CENTERPLACE ON LIGON - ESTABLISHING,LUTAN'S CENTERPLACE ON LIGO,EXT.,Code of Honor,1987-07-02,The Next Generation,104.txt
159,LUTAN,"   This is my First One, Yareena.",34   EXT. LUTAN'S CENTERPLACE ON LIGON - ESTABLISHING,LUTAN'S CENTERPLACE ON LIGO,EXT.,Code of Honor,1987-07-02,The Next Generation,104.txt
160,PICARD,   Lutan is a fortunate man.,34   EXT. LUTAN'S CENTERPLACE ON LIGON - ESTABLISHING,LUTAN'S CENTERPLACE ON LIGO,EXT.,Code of Honor,1987-07-02,The Next Generation,104.txt
161,PICARD,       You've met Counselor Troi.,34   EXT. LUTAN'S CENTERPLACE ON LIGON - ESTABLISHING,LUTAN'S CENTERPLACE ON LIGO,EXT.,Code of Honor,1987-07-02,The Next Generation,104.txt
162,LUTAN,"   Yes.       As on your vessel, you have only   to name whatever courtesy we can   provide.",34   EXT. LUTAN'S CENTERPLACE ON LIGON - ESTABLISHING,LUTAN'S CENTERPLACE ON LIGO,EXT.,Code of Honor,1987-07-02,The Next Generation,104.txt
163,PICARD,"   Then, sir... the courtesy of   seeing Lieutenant Yar.",34   EXT. LUTAN'S CENTERPLACE ON LIGON - ESTABLISHING,LUTAN'S CENTERPLACE ON LIGO,EXT.,Code of Honor,1987-07-02,The Next Generation,104.txt
164,LUTAN,   Lieutenant Yar will be returned   to you tonight at a banquet I have   arranged in your honor.,34   EXT. LUTAN'S CENTERPLACE ON LIGON - ESTABLISHING,LUTAN'S CENTERPLACE ON LIGO,EXT.,Code of Honor,1987-07-02,The Next Generation,104.txt
165,PICARD,   I would like to see her now.,34   EXT. LUTAN'S CENTERPLACE ON LIGON - ESTABLISHING,LUTAN'S CENTERPLACE ON LIGO,EXT.,Code of Honor,1987-07-02,The Next Generation,104.txt
166,LUTAN,"    (thinks; then, to a     sentry)   Bring Lieutenant Yar.       I find it odd, Captain, that a   man of your experience has such   difficulty in understanding   ordinary politeness.",34   EXT. LUTAN'S CENTERPLACE ON LIGON - ESTABLISHING,LUTAN'S CENTERPLACE ON LIGO,EXT.,Code of Honor,1987-07-02,The Next Generation,104.txt
167,PICARD,"   Such as saying ""please"" when   abducting someone?",34   EXT. LUTAN'S CENTERPLACE ON LIGON - ESTABLISHING,LUTAN'S CENTERPLACE ON LIGO,EXT.,Code of Honor,1987-07-02,The Next Generation,104.txt
168,LUTAN,"   The expression ""please"" is used   only when requesting the person   back.",34   EXT. LUTAN'S CENTERPLACE ON LIGON - ESTABLISHING,LUTAN'S CENTERPLACE ON LIGO,EXT.,Code of Honor,1987-07-02,The Next Generation,104.txt
169,PICARD,   Yours is a different world.,34   EXT. LUTAN'S CENTERPLACE ON LIGON - ESTABLISHING,LUTAN'S CENTERPLACE ON LIGO,EXT.,Code of Honor,1987-07-02,The Next Generation,104.txt
170,LUTAN,"   With clear and simple ways deeply   rooted in our culture. If you   are willing to ask for Lieutenant   Yar's release tonight in front   of all, honor will be satisfied.",34   EXT. LUTAN'S CENTERPLACE ON LIGON - ESTABLISHING,LUTAN'S CENTERPLACE ON LIGO,EXT.,Code of Honor,1987-07-02,The Next Generation,104.txt
171,TROI,"       One can see the importance of   ""honor"" here.",34   EXT. LUTAN'S CENTERPLACE ON LIGON - ESTABLISHING,LUTAN'S CENTERPLACE ON LIGO,EXT.,Code of Honor,1987-07-02,The Next Generation,104.txt
172,LUTAN,   Honor is everything.,34   EXT. LUTAN'S CENTERPLACE ON LIGON - ESTABLISHING,LUTAN'S CENTERPLACE ON LIGO,EXT.,Code of Honor,1987-07-02,The Next Generation,104.txt
173,HAGON,"   There will be gifts for each of   you, to absolve the abduction.",34   EXT. LUTAN'S CENTERPLACE ON LIGON - ESTABLISHING,LUTAN'S CENTERPLACE ON LIGO,EXT.,Code of Honor,1987-07-02,The Next Generation,104.txt
174,PICARD,"   Lieutenant, have you been treated   well?",34   EXT. LUTAN'S CENTERPLACE ON LIGON - ESTABLISHING,LUTAN'S CENTERPLACE ON LIGO,EXT.,Code of Honor,1987-07-02,The Next Generation,104.txt
175,TASHA,"   Fine, Captain...    (indicates bandaged     guard; smiles)   ... but they're showing some signs   of wear.",34   EXT. LUTAN'S CENTERPLACE ON LIGON - ESTABLISHING,LUTAN'S CENTERPLACE ON LIGO,EXT.,Code of Honor,1987-07-02,The Next Generation,104.txt
176,YAREENA,"   There isn't any need to be   concerned, Captain. She's being   well cared for.",34   EXT. LUTAN'S CENTERPLACE ON LIGON - ESTABLISHING,LUTAN'S CENTERPLACE ON LIGO,EXT.,Code of Honor,1987-07-02,The Next Generation,104.txt
177,PICARD,   My ship's company and I are   certain of your gentle wisdom in   that.,34   EXT. LUTAN'S CENTERPLACE ON LIGON - ESTABLISHING,LUTAN'S CENTERPLACE ON LIGO,EXT.,Code of Honor,1987-07-02,The Next Generation,104.txt
178,LUTAN,   I thought for a moment I heard   a threat implied.       But that would be foolishness.,34   EXT. LUTAN'S CENTERPLACE ON LIGON - ESTABLISHING,LUTAN'S CENTERPLACE ON LIGO,EXT.,Code of Honor,1987-07-02,The Next Generation,104.txt
179,PICARD,   Something to be carefully avoided   I agree.,34   EXT. LUTAN'S CENTERPLACE ON LIGON - ESTABLISHING,LUTAN'S CENTERPLACE ON LIGO,EXT.,Code of Honor,1987-07-02,The Next Generation,104.txt
180,LUTAN,   The festivities for her return   to you are in preparation. Shall   we retire until then?,34   EXT. LUTAN'S CENTERPLACE ON LIGON - ESTABLISHING,LUTAN'S CENTERPLACE ON LIGO,EXT.,Code of Honor,1987-07-02,The Next Generation,104.txt
181,PICARD,"   Until tonight, Lutan.",34   EXT. LUTAN'S CENTERPLACE ON LIGON - ESTABLISHING,LUTAN'S CENTERPLACE ON LIGO,EXT.,Code of Honor,1987-07-02,The Next Generation,104.txt
182,LUTAN,   We present you gifts!,35   EXT. CENTERPLACE - ESTABLISHING - NIGHT,CENTERPLAC,EXT.,Code of Honor,1987-07-02,The Next Generation,104.txt
183,PICARD,"   Lutan, you have granted us   hospitality and the safety of your   Centerplace. The gifts you give   us are rare and precious. We   thank you. In accordance with   the customs of your ancestors,   which I honor and respect, I am   here in peace to ask for the   return of Lieutenant Yar.",35   EXT. CENTERPLACE - ESTABLISHING - NIGHT,CENTERPLAC,EXT.,Code of Honor,1987-07-02,The Next Generation,104.txt
184,LUTAN,"   Well spoken. There are some among   my equals in this gathering who   were wary of my approaching the   Federation. I am proud to have   taken this first step towards a   treaty -- and proud we have   something of great value to offer   you -- a priceless life-giving   vaccine.       The abduction I have done   according to our custom, for all   to see.       Your conduct in this matter has   been beyond exemplary, Captain   Picard --       -- but now that the moment has   come, I find I cannot part with   her.",35   EXT. CENTERPLACE - ESTABLISHING - NIGHT,CENTERPLAC,EXT.,Code of Honor,1987-07-02,The Next Generation,104.txt
185,PICARD,   You speak of a code of honor...   but what you are now saying is   called under our customs... an   act of war.,35   EXT. CENTERPLACE - ESTABLISHING - NIGHT,CENTERPLAC,EXT.,Code of Honor,1987-07-02,The Next Generation,104.txt
186,LUTAN,"   No, no, Captain! You do not   understand.",35   EXT. CENTERPLACE - ESTABLISHING - NIGHT,CENTERPLAC,EXT.,Code of Honor,1987-07-02,The Next Generation,104.txt
187,PICARD,   Correct! I am now beyond   understanding!,35   EXT. CENTERPLACE - ESTABLISHING - NIGHT,CENTERPLAC,EXT.,Code of Honor,1987-07-02,The Next Generation,104.txt
188,LUTAN,"   This is not an act of war, but   of love. I want Lieutenant Yar   to become my First One.",35   EXT. CENTERPLACE - ESTABLISHING - NIGHT,CENTERPLAC,EXT.,Code of Honor,1987-07-02,The Next Generation,104.txt
189,YAREENA,   I challenge your right of   supercedence!,35   EXT. CENTERPLACE - ESTABLISHING - NIGHT,CENTERPLAC,EXT.,Code of Honor,1987-07-02,The Next Generation,104.txt
190,HAGON,       No woman has challenged   supercedence for over two-hundred   years!,35   EXT. CENTERPLACE - ESTABLISHING - NIGHT,CENTERPLAC,EXT.,Code of Honor,1987-07-02,The Next Generation,104.txt
191,YAREENA,   The right is mine -- and I will   have it!       Natasha Yar -- I challenge you!   A struggle to the death!,35   EXT. CENTERPLACE - ESTABLISHING - NIGHT,CENTERPLAC,EXT.,Code of Honor,1987-07-02,The Next Generation,104.txt
192,PICARD,       NO! The challenge is   unequivocally refused!,35   EXT. CENTERPLACE - ESTABLISHING - NIGHT,CENTERPLAC,EXT.,Code of Honor,1987-07-02,The Next Generation,104.txt
193,LUTAN,   Then you shall have no treaty --   no vaccine -- and no Lieutenant   Yar!,35   EXT. CENTERPLACE - ESTABLISHING - NIGHT,CENTERPLAC,EXT.,Code of Honor,1987-07-02,The Next Generation,104.txt
194,RIKER ,"   Ship's log, First Officer Riker   reporting. We have been informed   of the challenge to Lieutenant   Yar...",39   EXT. SPACE - ENTERPRISE (OPTICAL),SPACE - ENTERPRISE,EXT.,Code of Honor,1987-07-02,The Next Generation,104.txt
195,RIKER,"       ... and are maintaining combat   readiness round-the-clock. We   are probing Lutan's compound   deeply with our sensors now, still   unnoticed.",40   INT. MAIN BRIDGE - FEATURING SCIENCE AND TACTICAL,MAIN BRIDG,INT.,Code of Honor,1987-07-02,The Next Generation,104.txt
196,TASHA,   Captain. Deanna.,41   INT. TASHA'S QUARTERS - NIGHT,TASHA'S QUARTER,INT.,Code of Honor,1987-07-02,The Next Generation,104.txt
197,PICARD,"   Did you have any idea, Lieutenant,   that Lutan would suddenly announce   he wanted you for his First One?   What do you know of this?",41   INT. TASHA'S QUARTERS - NIGHT,TASHA'S QUARTER,INT.,Code of Honor,1987-07-02,The Next Generation,104.txt
198,TASHA,"   Nothing, sir.",41   INT. TASHA'S QUARTERS - NIGHT,TASHA'S QUARTER,INT.,Code of Honor,1987-07-02,The Next Generation,104.txt
199,TROI,       But it was a thrill. Lutan is   such... such a basic male image   and having him say he wants you...,41   INT. TASHA'S QUARTERS - NIGHT,TASHA'S QUARTER,INT.,Code of Honor,1987-07-02,The Next Generation,104.txt
200,TASHA,"       Yes, of course it made me feel   good...",41   INT. TASHA'S QUARTERS - NIGHT,TASHA'S QUARTER,INT.,Code of Honor,1987-07-02,The Next Generation,104.txt
201,TASHA,       Troi! I'm your friend and you   tricked me!,41   INT. TASHA'S QUARTERS - NIGHT,TASHA'S QUARTER,INT.,Code of Honor,1987-07-02,The Next Generation,104.txt
202,TROI,   Only so you'll think about it   completely and clearly.,41   INT. TASHA'S QUARTERS - NIGHT,TASHA'S QUARTER,INT.,Code of Honor,1987-07-02,The Next Generation,104.txt
203,PICARD,"       We're all being manipulated,   Lieutenant, and most of all   myself.",41   INT. TASHA'S QUARTERS - NIGHT,TASHA'S QUARTER,INT.,Code of Honor,1987-07-02,The Next Generation,104.txt
204,TROI,       How simple all this would be   without the Prime Directive.,41   INT. TASHA'S QUARTERS - NIGHT,TASHA'S QUARTER,INT.,Code of Honor,1987-07-02,The Next Generation,104.txt
205,PICARD,"       That thought has passed thorugh   my mind, Counselor.",41   INT. TASHA'S QUARTERS - NIGHT,TASHA'S QUARTER,INT.,Code of Honor,1987-07-02,The Next Generation,104.txt
206,RIKER,   What's this message from Starbase   Fourteen?,42   INT. MAIN BRIDGE - ANGLE ON RIKER,MAIN BRIDG,INT.,Code of Honor,1987-07-02,The Next Generation,104.txt
207,BEVERLY,"   It's showing infection rates,   percentage illness increases...       The plague on Styris IV has   flared up out of control.",42   INT. MAIN BRIDGE - ANGLE ON RIKER,MAIN BRIDG,INT.,Code of Honor,1987-07-02,The Next Generation,104.txt
208,RIKER,"   Oh, no!",42   INT. MAIN BRIDGE - ANGLE ON RIKER,MAIN BRIDG,INT.,Code of Honor,1987-07-02,The Next Generation,104.txt
209,GEORDI,"    (studying his own     viewer)   They're estimating deaths in the   millions, sir.",42   INT. MAIN BRIDGE - ANGLE ON RIKER,MAIN BRIDG,INT.,Code of Honor,1987-07-02,The Next Generation,104.txt
210,RIKER,"       Captain Picard, come in.",42   INT. MAIN BRIDGE - ANGLE ON RIKER,MAIN BRIDG,INT.,Code of Honor,1987-07-02,The Next Generation,104.txt
211,TASHA,"   I know I could win. Not that I'd   take her life, of course, but I'd   be glad to embarrass her. The   idea of accusing me...",44   INT. TASHA'S QUARTERS - NIGHT,TASHA'S QUARTER,INT.,Code of Honor,1987-07-02,The Next Generation,104.txt
212,TROI,   The plague?,44   INT. TASHA'S QUARTERS - NIGHT,TASHA'S QUARTER,INT.,Code of Honor,1987-07-02,The Next Generation,104.txt
213,PICARD,"   If anything, worse than we heard.",44   INT. TASHA'S QUARTERS - NIGHT,TASHA'S QUARTER,INT.,Code of Honor,1987-07-02,The Next Generation,104.txt
214,TASHA,"   Which means they desperately need   the vaccine, sir. And I know   I can win this challenge...",44   INT. TASHA'S QUARTERS - NIGHT,TASHA'S QUARTER,INT.,Code of Honor,1987-07-02,The Next Generation,104.txt
215,PICARD,"   You do not have to prove anything   here, Lieutenant.",44   INT. TASHA'S QUARTERS - NIGHT,TASHA'S QUARTER,INT.,Code of Honor,1987-07-02,The Next Generation,104.txt
216,TROI,"   But the vaccine is important in   this case, sir... ?",44   INT. TASHA'S QUARTERS - NIGHT,TASHA'S QUARTER,INT.,Code of Honor,1987-07-02,The Next Generation,104.txt
217,PICARD,"   Counselor, I would consider you   the last person to argue for   Lieutenant Yar to accept that   challenge.",44   INT. TASHA'S QUARTERS - NIGHT,TASHA'S QUARTER,INT.,Code of Honor,1987-07-02,The Next Generation,104.txt
218,TROI,"   Betazoid blood is also practical,   Captain.       The odds are very good she'd   defeat Lutan's wife easily and   you would win all the bargaining   points you need.",44   INT. TASHA'S QUARTERS - NIGHT,TASHA'S QUARTER,INT.,Code of Honor,1987-07-02,The Next Generation,104.txt
219,PICARD,"   ""The odds are... ?""",44   INT. TASHA'S QUARTERS - NIGHT,TASHA'S QUARTER,INT.,Code of Honor,1987-07-02,The Next Generation,104.txt
220,TROI,"   As you have pointed out yourself,   we are all at risk every day of   every mission.",44   INT. TASHA'S QUARTERS - NIGHT,TASHA'S QUARTER,INT.,Code of Honor,1987-07-02,The Next Generation,104.txt
221,PICARD,   I'll want some explanations from   Lutan.,44   INT. TASHA'S QUARTERS - NIGHT,TASHA'S QUARTER,INT.,Code of Honor,1987-07-02,The Next Generation,104.txt
222,TROI,"   But why not let him volunteer   them, Captain? His needs for   approval are immense. I'm sure   if you found something you liked   about him, he'd be anxious to   agree with it.",44   INT. TASHA'S QUARTERS - NIGHT,TASHA'S QUARTER,INT.,Code of Honor,1987-07-02,The Next Generation,104.txt
223,TASHA,"       Yes, he would indeed. He's almost   crippled with needs, the poor   handsome dear.",44   INT. TASHA'S QUARTERS - NIGHT,TASHA'S QUARTER,INT.,Code of Honor,1987-07-02,The Next Generation,104.txt
224,PICARD,"   I should tell you I do admire the   hospitality you offer here, Lutan.   A pity you began by abducting my   security officer.",45   INT. CENTERPLACE BANQUET AREA - NIGHT,CENTERPLACE BANQUET ARE,INT.,Code of Honor,1987-07-02,The Next Generation,104.txt
225,LUTAN,   I am in the grip of forces you   do not understand.,45   INT. CENTERPLACE BANQUET AREA - NIGHT,CENTERPLACE BANQUET ARE,INT.,Code of Honor,1987-07-02,The Next Generation,104.txt
226,PICARD,       Some of it I do understand. She   is a rather lovely female...,45   INT. CENTERPLACE BANQUET AREA - NIGHT,CENTERPLACE BANQUET ARE,INT.,Code of Honor,1987-07-02,The Next Generation,104.txt
227,LUTAN,"   You surprise me, Captain. What   do you know of needs and feelings?",45   INT. CENTERPLACE BANQUET AREA - NIGHT,CENTERPLACE BANQUET ARE,INT.,Code of Honor,1987-07-02,The Next Generation,104.txt
228,PICARD,"   Nothing.    (pretends to hesitate;     smiles)   Well, almost nothing in my   position of ship's captain.",45   INT. CENTERPLACE BANQUET AREA - NIGHT,CENTERPLACE BANQUET ARE,INT.,Code of Honor,1987-07-02,The Next Generation,104.txt
229,HAGON,"       Aha, I see.",45   INT. CENTERPLACE BANQUET AREA - NIGHT,CENTERPLACE BANQUET ARE,INT.,Code of Honor,1987-07-02,The Next Generation,104.txt
230,PICARD,"       But it puzzles me; if you feel that   way about Tasha, why have you   challenged her to a fight to the   death?",45   INT. CENTERPLACE BANQUET AREA - NIGHT,CENTERPLACE BANQUET ARE,INT.,Code of Honor,1987-07-02,The Next Generation,104.txt
231,LUTAN,"   Not I, Yareena! I am merely a   spectator.",45   INT. CENTERPLACE BANQUET AREA - NIGHT,CENTERPLACE BANQUET ARE,INT.,Code of Honor,1987-07-02,The Next Generation,104.txt
232,PICARD,   But you are also a man of great   importance and wealth.,45   INT. CENTERPLACE BANQUET AREA - NIGHT,CENTERPLACE BANQUET ARE,INT.,Code of Honor,1987-07-02,The Next Generation,104.txt
233,HAGON,"   Great importance, perhaps...",45   INT. CENTERPLACE BANQUET AREA - NIGHT,CENTERPLACE BANQUET ARE,INT.,Code of Honor,1987-07-02,The Next Generation,104.txt
234,PICARD,"   Aha, I see. Then you too   understand the proper value of   women?",45   INT. CENTERPLACE BANQUET AREA - NIGHT,CENTERPLACE BANQUET ARE,INT.,Code of Honor,1987-07-02,The Next Generation,104.txt
235,LUTAN,"   We understand they are highly   pleasant things... but after all,   unimportant, except for the land   they own.",45   INT. CENTERPLACE BANQUET AREA - NIGHT,CENTERPLACE BANQUET ARE,INT.,Code of Honor,1987-07-02,The Next Generation,104.txt
236,PICARD,"   You're a truly clever person,   Lutan. You have nothing to lose   either way the challenge goes.",45   INT. CENTERPLACE BANQUET AREA - NIGHT,CENTERPLACE BANQUET ARE,INT.,Code of Honor,1987-07-02,The Next Generation,104.txt
237,LUTAN,"   A code of honor, Captain, protects   one like a magic cloak.",45   INT. CENTERPLACE BANQUET AREA - NIGHT,CENTERPLACE BANQUET ARE,INT.,Code of Honor,1987-07-02,The Next Generation,104.txt
238,PICARD,"       I will order Lieutenant Yar to   fight.       And may your cloak bring you all   you deserve, Lutan.",45   INT. CENTERPLACE BANQUET AREA - NIGHT,CENTERPLACE BANQUET ARE,INT.,Code of Honor,1987-07-02,The Next Generation,104.txt
239,GEORDI,   Come in.,47   INT. ENTERPRISE - GEORDI'S QUARTERS,ENTERPRIS,INT.,Code of Honor,1987-07-02,The Next Generation,104.txt
240,DATA,"   Why that razor, my friend? Why   not the one I adjusted into   perfect efficiency?",47   INT. ENTERPRISE - GEORDI'S QUARTERS,ENTERPRIS,INT.,Code of Honor,1987-07-02,The Next Generation,104.txt
241,GEORDI,"   Shaving is a human art form, Data.   Technological perfection can shave   too close.",47   INT. ENTERPRISE - GEORDI'S QUARTERS,ENTERPRIS,INT.,Code of Honor,1987-07-02,The Next Generation,104.txt
242,DATA,   Puzzling. How can anything be   too efficient?,47   INT. ENTERPRISE - GEORDI'S QUARTERS,ENTERPRIS,INT.,Code of Honor,1987-07-02,The Next Generation,104.txt
243,GEORDI,   Tens of thousands of things. Maybe   hundreds.,47   INT. ENTERPRISE - GEORDI'S QUARTERS,ENTERPRIS,INT.,Code of Honor,1987-07-02,The Next Generation,104.txt
244,DATA,       We always go back to the human   equation.,47   INT. ENTERPRISE - GEORDI'S QUARTERS,ENTERPRIS,INT.,Code of Honor,1987-07-02,The Next Generation,104.txt
245,GEORDI,   Exactly. Have you kept working   on it?,47   INT. ENTERPRISE - GEORDI'S QUARTERS,ENTERPRIS,INT.,Code of Honor,1987-07-02,The Next Generation,104.txt
246,DATA,"   Constantly, my friend.     ",47   INT. ENTERPRISE - GEORDI'S QUARTERS,ENTERPRIS,INT.,Code of Honor,1987-07-02,The Next Generation,104.txt
247,DATA ,"       Particularly human humor. For   example, a man goes to a store   to buy some kidneys. He says to   the shopkeeper, ""I'd like a pound   of kiddillies, please."" The   shopkeeper says to him, ""You mean   kidneys, don't you?"" The man   says, ""I said kiddillies, diddle   I?""",47   INT. ENTERPRISE - GEORDI'S QUARTERS,ENTERPRIS,INT.,Code of Honor,1987-07-02,The Next Generation,104.txt
248,GEORDI,   It's too old. And you didn't tell   it very well.,47   INT. ENTERPRISE - GEORDI'S QUARTERS,ENTERPRIS,INT.,Code of Honor,1987-07-02,The Next Generation,104.txt
249,DATA,   ... How do you know when   something's funny?,47   INT. ENTERPRISE - GEORDI'S QUARTERS,ENTERPRIS,INT.,Code of Honor,1987-07-02,The Next Generation,104.txt
250,GEORDI,   It's not explainable. You just   do.,47   INT. ENTERPRISE - GEORDI'S QUARTERS,ENTERPRIS,INT.,Code of Honor,1987-07-02,The Next Generation,104.txt
251,DATA,"   Perhaps it is you, Geordi.   Includling the kiddillies, I've   learned six hundred sixty-two   jokes, and you haven't...",47   INT. ENTERPRISE - GEORDI'S QUARTERS,ENTERPRIS,INT.,Code of Honor,1987-07-02,The Next Generation,104.txt
252,GEORDI,"       ""Includling the kiddillies!"" Now   that's funny.",47   INT. ENTERPRISE - GEORDI'S QUARTERS,ENTERPRIS,INT.,Code of Honor,1987-07-02,The Next Generation,104.txt
253,DATA,   It was not meant as a joke!   The tongue slipped!,47   INT. ENTERPRISE - GEORDI'S QUARTERS,ENTERPRIS,INT.,Code of Honor,1987-07-02,The Next Generation,104.txt
254,RIKER,"   Riker to Commander Data,   Lieutenant La Forge. Report to   the Transporter Room for away   party duty.",47   INT. ENTERPRISE - GEORDI'S QUARTERS,ENTERPRIS,INT.,Code of Honor,1987-07-02,The Next Generation,104.txt
255,RIKER,   First officer to captain. Ready   with the away personnel.,48   INT. WEAPONS ROOM ON LIGON - DAY (OPTICAL),WEAPONS ROOM ON LIGON - DAY,INT.,Code of Honor,1987-07-02,The Next Generation,104.txt
