,character,quote,scene,location,view,episode,date,series
432,RIKER,"    (continuing; sees it     too)   There it is! Destroy it with   your phaser, Captain!",69   INT. STARGAZER BRIDGE (OPTICAL),STARGAZER BRIDGE,INT.,"""The Battle""",1987-09-14,The Next Generation
433,PICARD,"   Phaser...       Yes, a sphere... Bok used it...",69   INT. STARGAZER BRIDGE (OPTICAL),STARGAZER BRIDGE,INT.,"""The Battle""",1987-09-14,The Next Generation
434,RIKER,   Destory it!,69   INT. STARGAZER BRIDGE (OPTICAL),STARGAZER BRIDGE,INT.,"""The Battle""",1987-09-14,The Next Generation
435,PICARD,       Phaser... destroy the sphere.,69   INT. STARGAZER BRIDGE (OPTICAL),STARGAZER BRIDGE,INT.,"""The Battle""",1987-09-14,The Next Generation
436,RIKER,   Captain! Are you all right?,69   INT. STARGAZER BRIDGE (OPTICAL),STARGAZER BRIDGE,INT.,"""The Battle""",1987-09-14,The Next Generation
437,PICARD,"   Enterprise, lock on. Beam me   home, Riker.",69   INT. STARGAZER BRIDGE (OPTICAL),STARGAZER BRIDGE,INT.,"""The Battle""",1987-09-14,The Next Generation
