,character,quote,scene,location,view,episode,date,series,file
0,PICARD ,"   Captain's Log, Stardate 43980.7.   The Enterprise has been in   attendance at the biennial Trade   Agreements Conference on Betazed.",1    EXT. SPACE - THE ENTERPRISE (OPTICAL),SPACE - THE ENTERPRISE,EXT.,Menage a Troi,1990-03-09,The Next Generation,172.txt
1,PICARD ,"   For the first time, the Ferengi   are present, and I have   reluctantly consented to their   boarding the Enterprise for the   closing reception.",2    INT. TEN FORWARD,TEN FORWARD,INT.,Menage a Troi,1990-03-09,The Next Generation,172.txt
2,RIKER,   Check... and mate.,2    INT. TEN FORWARD,TEN FORWARD,INT.,Menage a Troi,1990-03-09,The Next Generation,172.txt
3,WESLEY,   Perfect. A queen's gambit...   finished off with the Aldabren   Exchange.,2    INT. TEN FORWARD,TEN FORWARD,INT.,Menage a Troi,1990-03-09,The Next Generation,172.txt
4,NIBOR,       Unfair. I couldn't concentrate   with all that noise...,2    INT. TEN FORWARD,TEN FORWARD,INT.,Menage a Troi,1990-03-09,The Next Generation,172.txt
5,WESLEY,   It's Algolian ceremonial rhythms.,2    INT. TEN FORWARD,TEN FORWARD,INT.,Menage a Troi,1990-03-09,The Next Generation,172.txt
6,NIBOR,   Hyoo-mans...,2    INT. TEN FORWARD,TEN FORWARD,INT.,Menage a Troi,1990-03-09,The Next Generation,172.txt
7,PICARD,"       A toast to the success of the   trade conference, Reittan. I must   admit, I had some doubts when you   invited the Ferengi.",2    INT. TEN FORWARD,TEN FORWARD,INT.,Menage a Troi,1990-03-09,The Next Generation,172.txt
8,REITTAN GRAX,"   They made a profit and behaved   themselves. What more could one   ask? Still, they trouble me. We   Betazeds are uncomfortable with   species like the Ferengi... whose   minds we can't read.",2    INT. TEN FORWARD,TEN FORWARD,INT.,Menage a Troi,1990-03-09,The Next Generation,172.txt
9,DATA,"       Perhaps your telepathic abilities   are ineffective owing to the   anomalous construction of the   Ferengi brain, which is composed   of four different...",2    INT. TEN FORWARD,TEN FORWARD,INT.,Menage a Troi,1990-03-09,The Next Generation,172.txt
10,PICARD,"       Thank you, Data.       It was thoughtful of you to   include Lwaxana Troi as part of   the Betazed delegation.",2    INT. TEN FORWARD,TEN FORWARD,INT.,Menage a Troi,1990-03-09,The Next Generation,172.txt
11,REITTAN GRAX,   Her first husband and I were old   friends. And I've known Deanna   since she was a child.,2    INT. TEN FORWARD,TEN FORWARD,INT.,Menage a Troi,1990-03-09,The Next Generation,172.txt
12,PICARD,   I'm sure Counselor Troi   appreciates this opportunity to   spend time with her mother.,2    INT. TEN FORWARD,TEN FORWARD,INT.,Menage a Troi,1990-03-09,The Next Generation,172.txt
13,LWAXANA ,"   It's so marvelous to see you,   Deanna, darling.       At least pretend you're happy to   see me.",2    INT. TEN FORWARD,TEN FORWARD,INT.,Menage a Troi,1990-03-09,The Next Generation,172.txt
14,TROI,"       Mother, we're among non-telepaths...   it's impolite not   to speak aloud.",2    INT. TEN FORWARD,TEN FORWARD,INT.,Menage a Troi,1990-03-09,The Next Generation,172.txt
15,LWAXANA ,"   You mean talk with my mouth full?   Deanna, please!",2    INT. TEN FORWARD,TEN FORWARD,INT.,Menage a Troi,1990-03-09,The Next Generation,172.txt
16,LWAXANA,"       All right, I will say something   aloud. Have you considered if   you had stayed on Betazed just   where your life might have...",2    INT. TEN FORWARD,TEN FORWARD,INT.,Menage a Troi,1990-03-09,The Next Generation,172.txt
17,TROI,       Let's not guess what I might have   done. I love my work aboard the   Enterprise...,2    INT. TEN FORWARD,TEN FORWARD,INT.,Menage a Troi,1990-03-09,The Next Generation,172.txt
18,LWAXANA,"   I know. But all business and no   play? You should enjoy life more,   like I do. Find the right man,   think of your future. Think of   my future...",2    INT. TEN FORWARD,TEN FORWARD,INT.,Menage a Troi,1990-03-09,The Next Generation,172.txt
19,RIKER,"   Deanna, Lwaxana. Anything I can   do for you?",2    INT. TEN FORWARD,TEN FORWARD,INT.,Menage a Troi,1990-03-09,The Next Generation,172.txt
20,FAREK,       She is as repulsive as the rest   of them.,2    INT. TEN FORWARD,TEN FORWARD,INT.,Menage a Troi,1990-03-09,The Next Generation,172.txt
21,TOG,   Repulsive? I find her exotic!       And what an advantage their   telepathy would be in   negotiations...,2    INT. TEN FORWARD,TEN FORWARD,INT.,Menage a Troi,1990-03-09,The Next Generation,172.txt
22,FAREK,"   To read our competitors' minds...   yes, that would be valuable.",2    INT. TEN FORWARD,TEN FORWARD,INT.,Menage a Troi,1990-03-09,The Next Generation,172.txt
23,FAREK ,   She'd never agree to use her   powers to help us...,2    INT. TEN FORWARD,TEN FORWARD,INT.,Menage a Troi,1990-03-09,The Next Generation,172.txt
24,TOG,   I'm not so sure.,2    INT. TEN FORWARD,TEN FORWARD,INT.,Menage a Troi,1990-03-09,The Next Generation,172.txt
25,TOG,"   Lwaxana Troi of Betazed, I   believe.       I am Daimon Tog of the Ferengi   vessel Krayton. May I join you?",2    INT. TEN FORWARD,TEN FORWARD,INT.,Menage a Troi,1990-03-09,The Next Generation,172.txt
26,LWAXANA,       I was just going to see Captain   Picard. Excuse me.,2    INT. TEN FORWARD,TEN FORWARD,INT.,Menage a Troi,1990-03-09,The Next Generation,172.txt
27,LWAXANA,   Jean-Luc! Come have a drink and   tell me what you've been up to.,2    INT. TEN FORWARD,TEN FORWARD,INT.,Menage a Troi,1990-03-09,The Next Generation,172.txt
28,PICARD,"       Uh... perhaps later, Lwaxana.   Data and I were just about to show   Reittan Grax the new door   mechanisms on the aft Turbolifts.   Would you excuse us?",2    INT. TEN FORWARD,TEN FORWARD,INT.,Menage a Troi,1990-03-09,The Next Generation,172.txt
29,TOG,"   Lwaxana Troi, I desire you.",2    INT. TEN FORWARD,TEN FORWARD,INT.,Menage a Troi,1990-03-09,The Next Generation,172.txt
30,LWAXANA,   Wha... what?,2    INT. TEN FORWARD,TEN FORWARD,INT.,Menage a Troi,1990-03-09,The Next Generation,172.txt
31,TOG,   Your Betazed skills would be very   useful to me... and I find you   attractive. I'm willing to pay   handsomely for you.,2    INT. TEN FORWARD,TEN FORWARD,INT.,Menage a Troi,1990-03-09,The Next Generation,172.txt
32,LWAXANA,       I don't believe this...,2    INT. TEN FORWARD,TEN FORWARD,INT.,Menage a Troi,1990-03-09,The Next Generation,172.txt
33,TOG,   You must be aware that every   female has her price.,2    INT. TEN FORWARD,TEN FORWARD,INT.,Menage a Troi,1990-03-09,The Next Generation,172.txt
34,LWAXANA,   Let's get one thing straight. I   am not for sale. And I'd rather   eat Orion wing-slugs than deal   with a toad-faced troll like you.   Go find someone else to become   your property.,2    INT. TEN FORWARD,TEN FORWARD,INT.,Menage a Troi,1990-03-09,The Next Generation,172.txt
35,TOG,       As you wish.,2    INT. TEN FORWARD,TEN FORWARD,INT.,Menage a Troi,1990-03-09,The Next Generation,172.txt
36,FAREK,"   Now that you've totally humiliated   us, may we return to our vessel?",2    INT. TEN FORWARD,TEN FORWARD,INT.,Menage a Troi,1990-03-09,The Next Generation,172.txt
37,TOG,"       She's exhilarating, isn't she?",2    INT. TEN FORWARD,TEN FORWARD,INT.,Menage a Troi,1990-03-09,The Next Generation,172.txt
38,TOG ,   Now I want her more than ever.   Lwaxana Troi will be mine.,2    INT. TEN FORWARD,TEN FORWARD,INT.,Menage a Troi,1990-03-09,The Next Generation,172.txt
39,TROI,       Are we at war with the Ferengi   yet?,8    INT. ENTERPRISE CORRIDOR - PERSONAL QUARTERS,ENTERPRISE CORRIDO,INT.,Menage a Troi,1990-03-09,The Next Generation,172.txt
40,WORF,   Daimon Tog has returned to his   vessel and the Ferengi have left   orbit.,8    INT. ENTERPRISE CORRIDOR - PERSONAL QUARTERS,ENTERPRISE CORRIDO,INT.,Menage a Troi,1990-03-09,The Next Generation,172.txt
41,TROI,   I'm sure Mother will be relieved.,8    INT. ENTERPRISE CORRIDOR - PERSONAL QUARTERS,ENTERPRISE CORRIDO,INT.,Menage a Troi,1990-03-09,The Next Generation,172.txt
42,WORF,   I hear she handled the situation   quite skillfully. An admirable   woman.,8    INT. ENTERPRISE CORRIDOR - PERSONAL QUARTERS,ENTERPRISE CORRIDO,INT.,Menage a Troi,1990-03-09,The Next Generation,172.txt
43,TROI,   I'll be sure to tell her you said   so.,8    INT. ENTERPRISE CORRIDOR - PERSONAL QUARTERS,ENTERPRISE CORRIDO,INT.,Menage a Troi,1990-03-09,The Next Generation,172.txt
44,LWAXANA ,"   Come in, Little One.",8    INT. ENTERPRISE CORRIDOR - PERSONAL QUARTERS,ENTERPRISE CORRIDO,INT.,Menage a Troi,1990-03-09,The Next Generation,172.txt
45,TROI,"   Mother.       Mother, please.",9    INT. TROI'S QUARTERS (OPTICAL),TROI'S QUARTERS,INT.,Menage a Troi,1990-03-09,The Next Generation,172.txt
46,LWAXANA ,"   Just a moment, Little One. I'm   at one with All Being.",9    INT. TROI'S QUARTERS (OPTICAL),TROI'S QUARTERS,INT.,Menage a Troi,1990-03-09,The Next Generation,172.txt
47,LWAXANA,"   After that horrible little Ferengi   insulted me, I needed to center   myself.       Can you imagine that creature   talking to me like that? Didn't   he realize I am the Daughter of   the Fifth House of Betazed, keeper   of the Chalice of Rixx?",9    INT. TROI'S QUARTERS (OPTICAL),TROI'S QUARTERS,INT.,Menage a Troi,1990-03-09,The Next Generation,172.txt
48,TROI,"   Mother, the Chalice of Rixx is   an old clay pot with mold growing   inside it!",9    INT. TROI'S QUARTERS (OPTICAL),TROI'S QUARTERS,INT.,Menage a Troi,1990-03-09,The Next Generation,172.txt
49,LWAXANA,"   My dear, when you become old   enough and wise enough, you'll   understand. Now sit down and   talk to me. We don't spend enough   time together.",9    INT. TROI'S QUARTERS (OPTICAL),TROI'S QUARTERS,INT.,Menage a Troi,1990-03-09,The Next Generation,172.txt
50,TROI,"       That's true. I'm sorry, and I   didn't mean to be upset with you   at the reception.",9    INT. TROI'S QUARTERS (OPTICAL),TROI'S QUARTERS,INT.,Menage a Troi,1990-03-09,The Next Generation,172.txt
51,LWAXANA,"   Deanna... you must understand,   you're all I've got. My only   concern is for your happiness.",9    INT. TROI'S QUARTERS (OPTICAL),TROI'S QUARTERS,INT.,Menage a Troi,1990-03-09,The Next Generation,172.txt
52,TROI,       I am happy. Why can't you believe   that?,9    INT. TROI'S QUARTERS (OPTICAL),TROI'S QUARTERS,INT.,Menage a Troi,1990-03-09,The Next Generation,172.txt
53,LWAXANA,"   I wish I could. How much   happiness is there in always being   there for someone else, but never   being there for yourself?",9    INT. TROI'S QUARTERS (OPTICAL),TROI'S QUARTERS,INT.,Menage a Troi,1990-03-09,The Next Generation,172.txt
54,TROI,   I get great satisfaction out of   my work.,9    INT. TROI'S QUARTERS (OPTICAL),TROI'S QUARTERS,INT.,Menage a Troi,1990-03-09,The Next Generation,172.txt
55,LWAXANA,"   I'm sure it's rewarding, in its   way. But what about a family?",9    INT. TROI'S QUARTERS (OPTICAL),TROI'S QUARTERS,INT.,Menage a Troi,1990-03-09,The Next Generation,172.txt
56,TROI,   This is my family -- my friends   -- here on the Enterprise.,9    INT. TROI'S QUARTERS (OPTICAL),TROI'S QUARTERS,INT.,Menage a Troi,1990-03-09,The Next Generation,172.txt
57,LWAXANA,"       I am your family, or have you   forgotten? And if I have to spell   it out for you, I'm talking about   finding a husband, having a child.   That's what made me happy. At   least until now.",9    INT. TROI'S QUARTERS (OPTICAL),TROI'S QUARTERS,INT.,Menage a Troi,1990-03-09,The Next Generation,172.txt
58,TROI,"   Look, Mother. Perhaps some day   I'll marry. But you've got to   let me make my own choices...   live my own life, not the life   you'd choose for me.",9    INT. TROI'S QUARTERS (OPTICAL),TROI'S QUARTERS,INT.,Menage a Troi,1990-03-09,The Next Generation,172.txt
59,LWAXANA,       You had a chance... with Commander   Riker. And look how you ruined   that.,9    INT. TROI'S QUARTERS (OPTICAL),TROI'S QUARTERS,INT.,Menage a Troi,1990-03-09,The Next Generation,172.txt
60,TROI,       I did not ruin anything. We   became very good friends.,9    INT. TROI'S QUARTERS (OPTICAL),TROI'S QUARTERS,INT.,Menage a Troi,1990-03-09,The Next Generation,172.txt
61,LWAXANA,"   All the better. You certainly   wouldn't want to marry an enemy.       But I see we can't discuss this.   So have it your way, Little One.",9    INT. TROI'S QUARTERS (OPTICAL),TROI'S QUARTERS,INT.,Menage a Troi,1990-03-09,The Next Generation,172.txt
62,TROI,   Little One? When I was five you   called me that. Stop demeaning   me and address me as an adult.,9    INT. TROI'S QUARTERS (OPTICAL),TROI'S QUARTERS,INT.,Menage a Troi,1990-03-09,The Next Generation,172.txt
63,LWAXANA ,"   I'll be home on Betazed if you   need me, Lit --       Deanna.",10   INT. CORRIDOR,CORRIDOR,INT.,Menage a Troi,1990-03-09,The Next Generation,172.txt
64,WESLEY,"   Adding preprocessors to the   neutrino counters boosted   efficiency by eleven percent.   Of course, Commander La Forge and   Commander Data did most of the   work...",11   INT. READY ROOM,READY ROOM,INT.,Menage a Troi,1990-03-09,The Next Generation,172.txt
65,GEORDI,"   Not so fast, Wesley.   Preprocessing the data with an   optical chip was your idea.",11   INT. READY ROOM,READY ROOM,INT.,Menage a Troi,1990-03-09,The Next Generation,172.txt
66,DATA,"   Correct, sir. Although Commander   La Forge and I designed the chip,   Ensign Crusher derived the   equations governing its operation.",11   INT. READY ROOM,READY ROOM,INT.,Menage a Troi,1990-03-09,The Next Generation,172.txt
67,RIKER,"   The point is, you've completed   our upgrade well ahead of   schedule. Most impressive.",11   INT. READY ROOM,READY ROOM,INT.,Menage a Troi,1990-03-09,The Next Generation,172.txt
68,PICARD,"   Indeed, Number One. Fine work   -- especially you, Mister Crusher.   We're going to miss you.",11   INT. READY ROOM,READY ROOM,INT.,Menage a Troi,1990-03-09,The Next Generation,172.txt
69,PICARD ,"   As you might guess, your final   entrance examination scores for   Starfleet Academy have arrived.       Congratulations. As soon as you   complete the oral exam, you'll   be formally admitted.",11   INT. READY ROOM,READY ROOM,INT.,Menage a Troi,1990-03-09,The Next Generation,172.txt
70,RIKER,   We'll have you back at Betazed   in plenty of time to meet the   Academy transport ship.,11   INT. READY ROOM,READY ROOM,INT.,Menage a Troi,1990-03-09,The Next Generation,172.txt
71,WESLEY,"   Thank you, sir.",11   INT. READY ROOM,READY ROOM,INT.,Menage a Troi,1990-03-09,The Next Generation,172.txt
72,PICARD,   That will be all.,11   INT. READY ROOM,READY ROOM,INT.,Menage a Troi,1990-03-09,The Next Generation,172.txt
73,PICARD ,"   A moment, Number One.",11   INT. READY ROOM,READY ROOM,INT.,Menage a Troi,1990-03-09,The Next Generation,172.txt
74,RIKER,"   Yes, Captain?",11   INT. READY ROOM,READY ROOM,INT.,Menage a Troi,1990-03-09,The Next Generation,172.txt
75,PICARD,   Your science team is very   efficient. How many days would   you say they managed to shave off   our mission?,11   INT. READY ROOM,READY ROOM,INT.,Menage a Troi,1990-03-09,The Next Generation,172.txt
76,RIKER,"   Approximately three. Thanks to   the equipment upgrade, we'll be   able to complete our survey in   less than twenty-four hours.",11   INT. READY ROOM,READY ROOM,INT.,Menage a Troi,1990-03-09,The Next Generation,172.txt
77,PICARD,"   Splendid, Number One.       You'd agree that this is a rather   routine mapping mission?",11   INT. READY ROOM,READY ROOM,INT.,Menage a Troi,1990-03-09,The Next Generation,172.txt
78,RIKER,"       Yes, sir...",11   INT. READY ROOM,READY ROOM,INT.,Menage a Troi,1990-03-09,The Next Generation,172.txt
79,PICARD,   Counselor Troi had the good sense   to request shore leave. I see   I'm going to have to suggest it   to you.,11   INT. READY ROOM,READY ROOM,INT.,Menage a Troi,1990-03-09,The Next Generation,172.txt
80,PICARD ,"   Have a good time, Number One.",11   INT. READY ROOM,READY ROOM,INT.,Menage a Troi,1990-03-09,The Next Generation,172.txt
81,RIKER,   I'm sure it was around here   somewhere...,13   EXT. BETAZED CLEARING - DAY,BETAZED CLEARIN,EXT.,Menage a Troi,1990-03-09,The Next Generation,172.txt
82,TROI,   It's been a few years. Maybe it   died.,13   EXT. BETAZED CLEARING - DAY,BETAZED CLEARIN,EXT.,Menage a Troi,1990-03-09,The Next Generation,172.txt
83,RIKER,   You know Muktok plants live for   hundreds of years...,13   EXT. BETAZED CLEARING - DAY,BETAZED CLEARIN,EXT.,Menage a Troi,1990-03-09,The Next Generation,172.txt
84,RIKER ,   Here it is...,13   EXT. BETAZED CLEARING - DAY,BETAZED CLEARIN,EXT.,Menage a Troi,1990-03-09,The Next Generation,172.txt
85,TROI,   It's lovely. I remember this   music... and all the good times   we had.,13   EXT. BETAZED CLEARING - DAY,BETAZED CLEARIN,EXT.,Menage a Troi,1990-03-09,The Next Generation,172.txt
86,RIKER,   A certain junior lieutenant will   always remember meeting a very   serious psychology student. It   was the best thing about being   assigned to Betazed.,13   EXT. BETAZED CLEARING - DAY,BETAZED CLEARIN,EXT.,Menage a Troi,1990-03-09,The Next Generation,172.txt
87,LWAXANA ,"   Put the food down over there,   Mister Homn.",13   EXT. BETAZED CLEARING - DAY,BETAZED CLEARIN,EXT.,Menage a Troi,1990-03-09,The Next Generation,172.txt
88,LWAXANA,   Isn't it a beautiful day for a   picnic?,13   EXT. BETAZED CLEARING - DAY,BETAZED CLEARIN,EXT.,Menage a Troi,1990-03-09,The Next Generation,172.txt
89,TROI,       Mother! How did you know about   this place?,13   EXT. BETAZED CLEARING - DAY,BETAZED CLEARIN,EXT.,Menage a Troi,1990-03-09,The Next Generation,172.txt
90,LWAXANA,   Your father used to bring me   here.,13   EXT. BETAZED CLEARING - DAY,BETAZED CLEARIN,EXT.,Menage a Troi,1990-03-09,The Next Generation,172.txt
91,RIKER,       And you even brought provisions.   Very thoughtful.,13   EXT. BETAZED CLEARING - DAY,BETAZED CLEARIN,EXT.,Menage a Troi,1990-03-09,The Next Generation,172.txt
92,LWAXANA,   Try this oskoid. The sap keeps   it deliciously warm.,13   EXT. BETAZED CLEARING - DAY,BETAZED CLEARIN,EXT.,Menage a Troi,1990-03-09,The Next Generation,172.txt
93,RIKER,"       Very, very tasty.       Tell me, Lwaxana, the last time   we met, you were searching for   a husband. Did you have any luck?",13   EXT. BETAZED CLEARING - DAY,BETAZED CLEARIN,EXT.,Menage a Troi,1990-03-09,The Next Generation,172.txt
94,LWAXANA,"   Alas, no, but what happens to me   isn't important. I'm more   concerned about other people   getting on with their lives.",13   EXT. BETAZED CLEARING - DAY,BETAZED CLEARIN,EXT.,Menage a Troi,1990-03-09,The Next Generation,172.txt
95,TROI,"   Mother, this isn't the time or   the place...",13   EXT. BETAZED CLEARING - DAY,BETAZED CLEARIN,EXT.,Menage a Troi,1990-03-09,The Next Generation,172.txt
96,LWAXANA,       Did I mention any names?,13   EXT. BETAZED CLEARING - DAY,BETAZED CLEARIN,EXT.,Menage a Troi,1990-03-09,The Next Generation,172.txt
97,TROI,       You didn't have to.,13   EXT. BETAZED CLEARING - DAY,BETAZED CLEARIN,EXT.,Menage a Troi,1990-03-09,The Next Generation,172.txt
98,LWAXANA,"   Can I help it if all my friends   are becoming grandparents?       How about you, Will. Have you   ever thought of having children?",13   EXT. BETAZED CLEARING - DAY,BETAZED CLEARIN,EXT.,Menage a Troi,1990-03-09,The Next Generation,172.txt
99,RIKER,"       There was a time when I thought   having children and a career in   Starfleet were incompatible. But   with Galaxy class starships having   families aboard, I've considered   that possibility...",13   EXT. BETAZED CLEARING - DAY,BETAZED CLEARIN,EXT.,Menage a Troi,1990-03-09,The Next Generation,172.txt
100,LWAXANA,"   Yes, the Enterprise would be a   perfect environment to raise a   family... with someone...",13   EXT. BETAZED CLEARING - DAY,BETAZED CLEARIN,EXT.,Menage a Troi,1990-03-09,The Next Generation,172.txt
101,TROI,       Mother!,13   EXT. BETAZED CLEARING - DAY,BETAZED CLEARIN,EXT.,Menage a Troi,1990-03-09,The Next Generation,172.txt
102,LWAXANA,"       Mister Homn, I saw some   uttaberries along the path. Be   a dear and pick some for   dessert...",13   EXT. BETAZED CLEARING - DAY,BETAZED CLEARIN,EXT.,Menage a Troi,1990-03-09,The Next Generation,172.txt
103,LWAXANA ,   Mister Homn and I can go back home   if you two want to be alone. It's   such a romantic setting...,13   EXT. BETAZED CLEARING - DAY,BETAZED CLEARIN,EXT.,Menage a Troi,1990-03-09,The Next Generation,172.txt
104,TROI,"       Mother, stop it!",13   EXT. BETAZED CLEARING - DAY,BETAZED CLEARIN,EXT.,Menage a Troi,1990-03-09,The Next Generation,172.txt
105,LWAXANA,"   Darling, you're so excitable these   days. Have you thought about a   leave of absence? I could talk   to Jean-Luc...",13   EXT. BETAZED CLEARING - DAY,BETAZED CLEARIN,EXT.,Menage a Troi,1990-03-09,The Next Generation,172.txt
106,RIKER,"       Deanna, try one of the oskoids.   They're different.",13   EXT. BETAZED CLEARING - DAY,BETAZED CLEARIN,EXT.,Menage a Troi,1990-03-09,The Next Generation,172.txt
107,RIKER ,   What the... ?,13   EXT. BETAZED CLEARING - DAY,BETAZED CLEARIN,EXT.,Menage a Troi,1990-03-09,The Next Generation,172.txt
108,TOG,   A gift for one whose beauty   surpasses even these pericules.,13   EXT. BETAZED CLEARING - DAY,BETAZED CLEARIN,EXT.,Menage a Troi,1990-03-09,The Next Generation,172.txt
109,RIKER,   Daimon Tog! I thought the   Krayton left orbit hours ago.,13   EXT. BETAZED CLEARING - DAY,BETAZED CLEARIN,EXT.,Menage a Troi,1990-03-09,The Next Generation,172.txt
110,TOG,   It did. But when I tried to put   the image of Lwaxana Troi out of   my mind... I could not succeed.,13   EXT. BETAZED CLEARING - DAY,BETAZED CLEARIN,EXT.,Menage a Troi,1990-03-09,The Next Generation,172.txt
111,LWAXANA,   This is ludicrous! You came back   to Betazed -- for me?,13   EXT. BETAZED CLEARING - DAY,BETAZED CLEARIN,EXT.,Menage a Troi,1990-03-09,The Next Generation,172.txt
112,TOG,   Why continue to search for   perfection once you've found it?   And when I considered how useful   you would be...,13   EXT. BETAZED CLEARING - DAY,BETAZED CLEARIN,EXT.,Menage a Troi,1990-03-09,The Next Generation,172.txt
113,TROI,   I don't believe this...,13   EXT. BETAZED CLEARING - DAY,BETAZED CLEARIN,EXT.,Menage a Troi,1990-03-09,The Next Generation,172.txt
114,LWAXANA,"       Look, Demon Tog, or whatever you   call yourself, I am the Daughter   of the Fifth House of Betazed,   Keeper of the Holy Rings. And   unless you want to create an   interstellar incident, you had   better beam back to your ship.",13   EXT. BETAZED CLEARING - DAY,BETAZED CLEARIN,EXT.,Menage a Troi,1990-03-09,The Next Generation,172.txt
115,TOG,"   Returning to my ship is exactly   what I had in mind.       Krayton, transport four   immediately.",13   EXT. BETAZED CLEARING - DAY,BETAZED CLEARIN,EXT.,Menage a Troi,1990-03-09,The Next Generation,172.txt
116,RIKER,"   No, Tog!",13   EXT. BETAZED CLEARING - DAY,BETAZED CLEARIN,EXT.,Menage a Troi,1990-03-09,The Next Generation,172.txt
117,RIKER,   Deanna? Lwaxana?,18   INT. FERENGI HOLDING TANK (OPTICAL),FERENGI HOLDING TANK,INT.,Menage a Troi,1990-03-09,The Next Generation,172.txt
118,LWAXANA,   Where are we?,18   INT. FERENGI HOLDING TANK (OPTICAL),FERENGI HOLDING TANK,INT.,Menage a Troi,1990-03-09,The Next Generation,172.txt
119,RIKER,"       From the smell of things, I'd   say we're aboard a Ferengi vessel.",18   INT. FERENGI HOLDING TANK (OPTICAL),FERENGI HOLDING TANK,INT.,Menage a Troi,1990-03-09,The Next Generation,172.txt
120,LWAXANA,   The Ferengi can't do this! You're   Starfleet officers!,18   INT. FERENGI HOLDING TANK (OPTICAL),FERENGI HOLDING TANK,INT.,Menage a Troi,1990-03-09,The Next Generation,172.txt
121,RIKER,   Tog must have missed that chapter   in the Ferengi Book of Etiquette.,18   INT. FERENGI HOLDING TANK (OPTICAL),FERENGI HOLDING TANK,INT.,Menage a Troi,1990-03-09,The Next Generation,172.txt
122,RIKER,   The Enterprise is too far out of   range.,18   INT. FERENGI HOLDING TANK (OPTICAL),FERENGI HOLDING TANK,INT.,Menage a Troi,1990-03-09,The Next Generation,172.txt
123,NIBOR,   Daimon... they have regained   consciousness.,18   INT. FERENGI HOLDING TANK (OPTICAL),FERENGI HOLDING TANK,INT.,Menage a Troi,1990-03-09,The Next Generation,172.txt
124,TOG,   Very good.,18   INT. FERENGI HOLDING TANK (OPTICAL),FERENGI HOLDING TANK,INT.,Menage a Troi,1990-03-09,The Next Generation,172.txt
125,RIKER,       What have you done with them?,18   INT. FERENGI HOLDING TANK (OPTICAL),FERENGI HOLDING TANK,INT.,Menage a Troi,1990-03-09,The Next Generation,172.txt
126,LWAXANA,   I should have known. Even their   transporters can't be trusted.,19   INT. FERENGI LAB (OPTICAL),FERENGI LAB,INT.,Menage a Troi,1990-03-09,The Next Generation,172.txt
127,TROI,   Why have you removed our clothing?,19   INT. FERENGI LAB (OPTICAL),FERENGI LAB,INT.,Menage a Troi,1990-03-09,The Next Generation,172.txt
128,FAREK,   Females do not deserve the honor   of clothing.,19   INT. FERENGI LAB (OPTICAL),FERENGI LAB,INT.,Menage a Troi,1990-03-09,The Next Generation,172.txt
129,LWAXANA,       We are not Ferengi females.       They're as bad as humans. Look   at the leer on his face.,19   INT. FERENGI LAB (OPTICAL),FERENGI LAB,INT.,Menage a Troi,1990-03-09,The Next Generation,172.txt
130,TOG,"   No, his is an expression of   revulsion. But it is a feeling   I do not share, Lwaxana.",19   INT. FERENGI LAB (OPTICAL),FERENGI LAB,INT.,Menage a Troi,1990-03-09,The Next Generation,172.txt
131,LWAXANA,   It's cold in here. Do you want   me to become ill?,19   INT. FERENGI LAB (OPTICAL),FERENGI LAB,INT.,Menage a Troi,1990-03-09,The Next Generation,172.txt
132,TOG,"   No, I don't. Farek, please   arrange for their clothing to be   returned.",19   INT. FERENGI LAB (OPTICAL),FERENGI LAB,INT.,Menage a Troi,1990-03-09,The Next Generation,172.txt
133,LWAXANA,"   Thank you, Daimon Tog.",19   INT. FERENGI LAB (OPTICAL),FERENGI LAB,INT.,Menage a Troi,1990-03-09,The Next Generation,172.txt
