,character,quote,scene,location,view,episode,date,series,file
354,SHELBY,"   Can you locate it, Worf?",72   INT. BORG SHIP (OPTICAL),BORG SHIP,INT.,"The Best of Both Worlds, Part I",1990-04-06,The Next Generation,174.txt
355,WORF,       This way...,72   INT. BORG SHIP (OPTICAL),BORG SHIP,INT.,"The Best of Both Worlds, Part I",1990-04-06,The Next Generation,174.txt
356,RIKER,"   I strongly recommend redeploying   all available defenses to protect   sector zero-zero-one, Admiral...",73A  INT. READY ROOM (OPTICAL),READY ROOM,INT.,"The Best of Both Worlds, Part I",1990-04-06,The Next Generation,174.txt
357,HANSON,       We're moving to intercept at Wolf   three five nine. We'll make our   stand there. How much longer can   you maintain pursuit?,73A  INT. READY ROOM (OPTICAL),READY ROOM,INT.,"The Best of Both Worlds, Part I",1990-04-06,The Next Generation,174.txt
358,RIKER,"   Twenty-two minutes if they stay   at current speed. If we can't   bring them out of warp, we'll   do as much damage as we can before   we have to disengage.",73A  INT. READY ROOM (OPTICAL),READY ROOM,INT.,"The Best of Both Worlds, Part I",1990-04-06,The Next Generation,174.txt
359,HANSON,       Picard?,73A  INT. READY ROOM (OPTICAL),READY ROOM,INT.,"The Best of Both Worlds, Part I",1990-04-06,The Next Generation,174.txt
360,RIKER,"   Nothing yet, sir.",73A  INT. READY ROOM (OPTICAL),READY ROOM,INT.,"The Best of Both Worlds, Part I",1990-04-06,The Next Generation,174.txt
361,WORF,   In here.,74A  INT. BORG SHIP,BORG SHIP,INT.,"The Best of Both Worlds, Part I",1990-04-06,The Next Generation,174.txt
362,SHELBY,   Shelby to Enterprise.,74A  INT. BORG SHIP,BORG SHIP,INT.,"The Best of Both Worlds, Part I",1990-04-06,The Next Generation,174.txt
363,RIKER,   Go ahead.,74A  INT. BORG SHIP,BORG SHIP,INT.,"The Best of Both Worlds, Part I",1990-04-06,The Next Generation,174.txt
364,SHELBY,   We've found the captain's uniform.   And his communicator.,74A  INT. BORG SHIP,BORG SHIP,INT.,"The Best of Both Worlds, Part I",1990-04-06,The Next Generation,174.txt
365,SHELBY,   We're resuming our search.,75B  INT. MAIN BRIDGE,MAIN BRIDGE,INT.,"The Best of Both Worlds, Part I",1990-04-06,The Next Generation,174.txt
366,RIKER,"       Stand by, Commander.",75B  INT. MAIN BRIDGE,MAIN BRIDGE,INT.,"The Best of Both Worlds, Part I",1990-04-06,The Next Generation,174.txt
367,WESLEY,   We're in business.,75B  INT. MAIN BRIDGE,MAIN BRIDGE,INT.,"The Best of Both Worlds, Part I",1990-04-06,The Next Generation,174.txt
368,GEORDI,   It'll burn out the main   deflector... but it'll be one hell   of a bang.,75B  INT. MAIN BRIDGE,MAIN BRIDGE,INT.,"The Best of Both Worlds, Part I",1990-04-06,The Next Generation,174.txt
369,RIKER,   Radiation danger?,75B  INT. MAIN BRIDGE,MAIN BRIDGE,INT.,"The Best of Both Worlds, Part I",1990-04-06,The Next Generation,174.txt
370,WESLEY,   We'll need to evacuate the entire   forward half of the secondary   hull. And the lower three decks   of the saucer.,75B  INT. MAIN BRIDGE,MAIN BRIDGE,INT.,"The Best of Both Worlds, Part I",1990-04-06,The Next Generation,174.txt
371,TROI,   I'll see to that.,75B  INT. MAIN BRIDGE,MAIN BRIDGE,INT.,"The Best of Both Worlds, Part I",1990-04-06,The Next Generation,174.txt
372,RIKER,       Commander Shelby... we have only   seventeen minutes of warp power   left. Do what you can to get   them out of warp.,75B  INT. MAIN BRIDGE,MAIN BRIDGE,INT.,"The Best of Both Worlds, Part I",1990-04-06,The Next Generation,174.txt
373,SHELBY,       Acknowledged. Shelby out.       Let's take out some of these   distribution nodes and see what   happens...       Get ready. This may rile up our   friends.,75C  INT. BORG SHIP (OPTICAL),BORG SHIP,INT.,"The Best of Both Worlds, Part I",1990-04-06,The Next Generation,174.txt
374,SHELBY,   Ready phasers...,76   INT. BORG SHIP,BORG SHIP,INT.,"The Best of Both Worlds, Part I",1990-04-06,The Next Generation,174.txt
375,SHELBY,   Fire.,76   INT. BORG SHIP,BORG SHIP,INT.,"The Best of Both Worlds, Part I",1990-04-06,The Next Generation,174.txt
376,SHELBY,"   Enterprise, encountering   resistance, prepare to beam us   back on my signal...",76   INT. BORG SHIP,BORG SHIP,INT.,"The Best of Both Worlds, Part I",1990-04-06,The Next Generation,174.txt
377,SHELBY,   Enterprise... beam us...,88   INT. BORG SHIP,BORG SHIP,INT.,"The Best of Both Worlds, Part I",1990-04-06,The Next Generation,174.txt
378,WORF,   Wait! Look --,88   INT. BORG SHIP,BORG SHIP,INT.,"The Best of Both Worlds, Part I",1990-04-06,The Next Generation,174.txt
379,WORF,   Captain!,88   INT. BORG SHIP,BORG SHIP,INT.,"The Best of Both Worlds, Part I",1990-04-06,The Next Generation,174.txt
380,SHELBY,"   Enterprise, get us out of here.",88   INT. BORG SHIP,BORG SHIP,INT.,"The Best of Both Worlds, Part I",1990-04-06,The Next Generation,174.txt
381,WESLEY,"   Sir, they did it... the Borg ship   is dropping out of warp...",99   INT. MAIN BRIDGE,MAIN BRIDGE,INT.,"The Best of Both Worlds, Part I",1990-04-06,The Next Generation,174.txt
382,RIKER,   Go to impulse.,99   INT. MAIN BRIDGE,MAIN BRIDGE,INT.,"The Best of Both Worlds, Part I",1990-04-06,The Next Generation,174.txt
383,GEORDI,   Diverting warp energy to main   deflector...,99   INT. MAIN BRIDGE,MAIN BRIDGE,INT.,"The Best of Both Worlds, Part I",1990-04-06,The Next Generation,174.txt
384,RIKER,"   Move us to within forty thousand   kilometers, match velocity.   Commence arming sequence...   Increase deflector modulation to   upper frequency band...",99   INT. MAIN BRIDGE,MAIN BRIDGE,INT.,"The Best of Both Worlds, Part I",1990-04-06,The Next Generation,174.txt
385,RIKER,   The captain?,99   INT. MAIN BRIDGE,MAIN BRIDGE,INT.,"The Best of Both Worlds, Part I",1990-04-06,The Next Generation,174.txt
386,DATA,"   Sir, Captain Picard has been   altered by the Borg. We were   unable to retrieve him...",99   INT. MAIN BRIDGE,MAIN BRIDGE,INT.,"The Best of Both Worlds, Part I",1990-04-06,The Next Generation,174.txt
387,RIKER,   Altered... ?,99   INT. MAIN BRIDGE,MAIN BRIDGE,INT.,"The Best of Both Worlds, Part I",1990-04-06,The Next Generation,174.txt
388,WORF,"   He is a Borg, sir.",99   INT. MAIN BRIDGE,MAIN BRIDGE,INT.,"The Best of Both Worlds, Part I",1990-04-06,The Next Generation,174.txt
389,SHELBY,   We'll go back... I need more   people... we need to retune the   phasers again... we'll get him   out of there...,99   INT. MAIN BRIDGE,MAIN BRIDGE,INT.,"The Best of Both Worlds, Part I",1990-04-06,The Next Generation,174.txt
390,GEORDI,"   Commander, reading subspace field   fluctuations within the Borg ship.   Looks like they're regenerating...   restoring power. They could be   capable of warp any minute.",99   INT. MAIN BRIDGE,MAIN BRIDGE,INT.,"The Best of Both Worlds, Part I",1990-04-06,The Next Generation,174.txt
391,RIKER,   Is the deflector ready?,99   INT. MAIN BRIDGE,MAIN BRIDGE,INT.,"The Best of Both Worlds, Part I",1990-04-06,The Next Generation,174.txt
392,GEORDI,"    (registering import of     the pending decision)   Ready, sir.",99   INT. MAIN BRIDGE,MAIN BRIDGE,INT.,"The Best of Both Worlds, Part I",1990-04-06,The Next Generation,174.txt
393,BEVERLY,"   Will, he's alive... if we get him   back, I might be able to   restore...",99   INT. MAIN BRIDGE,MAIN BRIDGE,INT.,"The Best of Both Worlds, Part I",1990-04-06,The Next Generation,174.txt
394,RIKER,"   This is our only chance to destroy   them... if they get back into warp,   our weapon becomes useless.",99   INT. MAIN BRIDGE,MAIN BRIDGE,INT.,"The Best of Both Worlds, Part I",1990-04-06,The Next Generation,174.txt
395,SHELBY,   We'll go back... we'll sabotage   them again if we have to...,99   INT. MAIN BRIDGE,MAIN BRIDGE,INT.,"The Best of Both Worlds, Part I",1990-04-06,The Next Generation,174.txt
396,RIKER,       We can't maintain pursuit. We   don't have the power.       Prepare to fire.,99   INT. MAIN BRIDGE,MAIN BRIDGE,INT.,"The Best of Both Worlds, Part I",1990-04-06,The Next Generation,174.txt
397,SHELBY,   At least consult with Starfleet   Command.       Get Admiral Hanson on subspace...,99   INT. MAIN BRIDGE,MAIN BRIDGE,INT.,"The Best of Both Worlds, Part I",1990-04-06,The Next Generation,174.txt
398,RIKER,"   Belay that order, Lieutenant.   There's no time...",99   INT. MAIN BRIDGE,MAIN BRIDGE,INT.,"The Best of Both Worlds, Part I",1990-04-06,The Next Generation,174.txt
399,WORF,"   Sir, we are being hailed by the   Borg...",99   INT. MAIN BRIDGE,MAIN BRIDGE,INT.,"The Best of Both Worlds, Part I",1990-04-06,The Next Generation,174.txt
400,RIKER,   On screen.,99   INT. MAIN BRIDGE,MAIN BRIDGE,INT.,"The Best of Both Worlds, Part I",1990-04-06,The Next Generation,174.txt
401,PICARD/BORG,"   I am Locutus of Borg. Resistance   is futile. Your life as it has   been is over. From this time   forward, you will service... us.",99   INT. MAIN BRIDGE,MAIN BRIDGE,INT.,"The Best of Both Worlds, Part I",1990-04-06,The Next Generation,174.txt
402,RIKER,   Mister Worf... fire.,99   INT. MAIN BRIDGE,MAIN BRIDGE,INT.,"The Best of Both Worlds, Part I",1990-04-06,The Next Generation,174.txt
