,character,quote,scene,location,view,episode,date,series,file
0,PICARD ,"   Captain's log, Stardate 43994.1.   The Enterprise has arrived at   Jouret Four in response to a   distress signal from one of the   Federation's outermost colonies.",1    EXT. SPACE - THE ENTERPRISE (OPTICAL),SPACE - THE ENTERPRISE,EXT.,"The Best of Both Worlds, Part I",1990-04-06,The Next Generation,174.txt
1,RIKER,       Anything from the surface?,2    INT. TRANSPORTER ROOM (OPTICAL),TRANSPORTER ROOM,INT.,"The Best of Both Worlds, Part I",1990-04-06,The Next Generation,174.txt
2,WORF,   Nossir. There have been no   communications from the colony   for over twelve hours.,2    INT. TRANSPORTER ROOM (OPTICAL),TRANSPORTER ROOM,INT.,"The Best of Both Worlds, Part I",1990-04-06,The Next Generation,174.txt
3,RIKER,   Sensors picking up any signs of   life?,2    INT. TRANSPORTER ROOM (OPTICAL),TRANSPORTER ROOM,INT.,"The Best of Both Worlds, Part I",1990-04-06,The Next Generation,174.txt
4,WORF,   None.,2    INT. TRANSPORTER ROOM (OPTICAL),TRANSPORTER ROOM,INT.,"The Best of Both Worlds, Part I",1990-04-06,The Next Generation,174.txt
5,O'BRIEN,"   The surface environment is safe   for transport, Commander.",2    INT. TRANSPORTER ROOM (OPTICAL),TRANSPORTER ROOM,INT.,"The Best of Both Worlds, Part I",1990-04-06,The Next Generation,174.txt
6,RIKER,"       Mister O'Brien, verify these are   accurate coordinates for New   Providence colony.",3    EXT. PLANET SURFACE - DAY,PLANET SURFAC,EXT.,"The Best of Both Worlds, Part I",1990-04-06,The Next Generation,174.txt
7,O'BRIEN,"   Coordinates verified, sir. You're   at the center of town.",3    EXT. PLANET SURFACE - DAY,PLANET SURFAC,EXT.,"The Best of Both Worlds, Part I",1990-04-06,The Next Generation,174.txt
8,PICARD ,"   Captain's log, Stardate 43997.6.   Admiral Hanson and Lieutenant   Commander Shelby of Starfleet   Tactical have arrived to review   the disappearance of New   Providence colony. No sign   remains of the nine hundred   inhabitants.",5    EXT. SPACE - THE ENTERPRISE (OPTICAL),SPACE - THE ENTERPRISE,EXT.,"The Best of Both Worlds, Part I",1990-04-06,The Next Generation,174.txt
9,HANSON,"   The truth is... hell, we're not   ready. We've known they were   coming for over a year... we've   thrown every resource we've got   into this but still...",6    INT. CAPT. READY ROOM,CAPT. READY ROOM,INT.,"The Best of Both Worlds, Part I",1990-04-06,The Next Generation,174.txt
10,RIKER,"   Then, you're convinced it is the   Borg... ?",6    INT. CAPT. READY ROOM,CAPT. READY ROOM,INT.,"The Best of Both Worlds, Part I",1990-04-06,The Next Generation,174.txt
11,SHELBY,   That's what I'm here to find out.   The initial descriptions of these   surface conditions are almost   identical to your reports from   system J-two-five.,6    INT. CAPT. READY ROOM,CAPT. READY ROOM,INT.,"The Best of Both Worlds, Part I",1990-04-06,The Next Generation,174.txt
12,PICARD,       Mister Riker wrote those   reports... he agrees with you.,6    INT. CAPT. READY ROOM,CAPT. READY ROOM,INT.,"The Best of Both Worlds, Part I",1990-04-06,The Next Generation,174.txt
13,HANSON,       Commander Shelby took over Borg   tactical analysis six months ago.   I've learned to give her a wide   latitude when I want to get things   done... That's how I intend to   operate here.,6    INT. CAPT. READY ROOM,CAPT. READY ROOM,INT.,"The Best of Both Worlds, Part I",1990-04-06,The Next Generation,174.txt
14,SHELBY,"   My priority has been to develop   some kind, any kind of defense   strategy...",6    INT. CAPT. READY ROOM,CAPT. READY ROOM,INT.,"The Best of Both Worlds, Part I",1990-04-06,The Next Generation,174.txt
15,RIKER,   Obviously nothing we have now can   stop them.,6    INT. CAPT. READY ROOM,CAPT. READY ROOM,INT.,"The Best of Both Worlds, Part I",1990-04-06,The Next Generation,174.txt
16,SHELBY,       We've been designing new   weapons... but they're still on   the drawing board.,6    INT. CAPT. READY ROOM,CAPT. READY ROOM,INT.,"The Best of Both Worlds, Part I",1990-04-06,The Next Generation,174.txt
17,HANSON,   We expected much more lead time.   Your encounter with the Borg was   over seven thousand light years   away...,6    INT. CAPT. READY ROOM,CAPT. READY ROOM,INT.,"The Best of Both Worlds, Part I",1990-04-06,The Next Generation,174.txt
18,PICARD,"   If this is the Borg, it would   indicate they have a source of   power far superior to our own...",6    INT. CAPT. READY ROOM,CAPT. READY ROOM,INT.,"The Best of Both Worlds, Part I",1990-04-06,The Next Generation,174.txt
19,SHELBY,"   I'd like to see the colony site   as soon as possible, Captain.",6    INT. CAPT. READY ROOM,CAPT. READY ROOM,INT.,"The Best of Both Worlds, Part I",1990-04-06,The Next Generation,174.txt
20,RIKER,   It'll be night at the site in   thirty minutes. We've scheduled   an away team for dawn.,6    INT. CAPT. READY ROOM,CAPT. READY ROOM,INT.,"The Best of Both Worlds, Part I",1990-04-06,The Next Generation,174.txt
21,PICARD,       Why don't you show the commander   to her quarters...,6    INT. CAPT. READY ROOM,CAPT. READY ROOM,INT.,"The Best of Both Worlds, Part I",1990-04-06,The Next Generation,174.txt
22,RIKER,"   It's our poker night, Admiral.   There's always an open seat for   you...",6    INT. CAPT. READY ROOM,CAPT. READY ROOM,INT.,"The Best of Both Worlds, Part I",1990-04-06,The Next Generation,174.txt
23,HANSON,"       Next time, Commander. Your   captain and I have a lot to cover.   But rumor has it that Commander   Shelby's played a hand or two...",6    INT. CAPT. READY ROOM,CAPT. READY ROOM,INT.,"The Best of Both Worlds, Part I",1990-04-06,The Next Generation,174.txt
24,HANSON,"   Keep your eye on her, Jean-Luc.   One impressive young lady...",6    INT. CAPT. READY ROOM,CAPT. READY ROOM,INT.,"The Best of Both Worlds, Part I",1990-04-06,The Next Generation,174.txt
25,PICARD,"   You seem rather taken with her,   J.P.",6    INT. CAPT. READY ROOM,CAPT. READY ROOM,INT.,"The Best of Both Worlds, Part I",1990-04-06,The Next Generation,174.txt
26,HANSON,"   Just an old man's fantasies. When   Shelby came into tactical, every   damned admiral's uncle had a take   on this Borg business... she cut   through it, put us on track.",6    INT. CAPT. READY ROOM,CAPT. READY ROOM,INT.,"The Best of Both Worlds, Part I",1990-04-06,The Next Generation,174.txt
27,PICARD,   Earl Grey?,6    INT. CAPT. READY ROOM,CAPT. READY ROOM,INT.,"The Best of Both Worlds, Part I",1990-04-06,The Next Generation,174.txt
28,HANSON,   Four sugars.       She'd make you a hell of a first   officer.,6    INT. CAPT. READY ROOM,CAPT. READY ROOM,INT.,"The Best of Both Worlds, Part I",1990-04-06,The Next Generation,174.txt
29,PICARD,   I already have a hell of a first   officer.,6    INT. CAPT. READY ROOM,CAPT. READY ROOM,INT.,"The Best of Both Worlds, Part I",1990-04-06,The Next Generation,174.txt
30,HANSON,   Don't tell me he's gonna pass up   another commission?,6    INT. CAPT. READY ROOM,CAPT. READY ROOM,INT.,"The Best of Both Worlds, Part I",1990-04-06,The Next Generation,174.txt
31,PICARD,   One's available?,6    INT. CAPT. READY ROOM,CAPT. READY ROOM,INT.,"The Best of Both Worlds, Part I",1990-04-06,The Next Generation,174.txt
32,HANSON,   The Melbourne. It's his if he   wants it. Hasn't he told you?,6    INT. CAPT. READY ROOM,CAPT. READY ROOM,INT.,"The Best of Both Worlds, Part I",1990-04-06,The Next Generation,174.txt
33,PICARD,"   Well, I guess I knew this day   would have to come... he'll make   a fine captain, J.P.",6    INT. CAPT. READY ROOM,CAPT. READY ROOM,INT.,"The Best of Both Worlds, Part I",1990-04-06,The Next Generation,174.txt
34,HANSON,"   You may want to tell him that.       We're still waiting for his   decision. Hell, this is the third   time we've pulled out the   captain's chair for Riker. He   just won't sit down. And I'll   tell you something -- there are   a lot of young hotshots like   Shelby on their way up. Riker   could suddenly look like he's   standing still next to them. He's   hurting his career by staying put.   If I were you, I'd kick him in   the rear end for his own good.",6    INT. CAPT. READY ROOM,CAPT. READY ROOM,INT.,"The Best of Both Worlds, Part I",1990-04-06,The Next Generation,174.txt
35,SHELBY,   We know the Borg have no interest   in power or political conquest...,7    INT. CORRIDOR,CORRIDOR,INT.,"The Best of Both Worlds, Part I",1990-04-06,The Next Generation,174.txt
36,RIKER,"       They identify what's useful to   them, then consume it. Or try   to at least...",7    INT. CORRIDOR,CORRIDOR,INT.,"The Best of Both Worlds, Part I",1990-04-06,The Next Generation,174.txt
37,SHELBY,   But here's the question -- after   they take what they want... what   happens to the rest?       There has to be some evidence...   residue... something that tells   us they've been here.,7    INT. CORRIDOR,CORRIDOR,INT.,"The Best of Both Worlds, Part I",1990-04-06,The Next Generation,174.txt
38,SHELBY,   I don't know exactly what I'm   looking for... but we've tested   the sections of the Enterprise's   hull that were damaged by the   Borg. There were some unusual   magnetic-resonance traces...,8    INT. SHELBY'S QUARTERS - CONTINUOUS,SHELBY'S QUARTER,INT.,"The Best of Both Worlds, Part I",1990-04-06,The Next Generation,174.txt
39,RIKER,   A Borg footprint?,8    INT. SHELBY'S QUARTERS - CONTINUOUS,SHELBY'S QUARTER,INT.,"The Best of Both Worlds, Part I",1990-04-06,The Next Generation,174.txt
40,SHELBY,   That's my theory. I'll see if   it holds up tomorrow.       I've reviewed your personnel...   I'll be assigning Mister La Forge   and Mister Data to accompany me   on the away team...,8    INT. SHELBY'S QUARTERS - CONTINUOUS,SHELBY'S QUARTER,INT.,"The Best of Both Worlds, Part I",1990-04-06,The Next Generation,174.txt
41,RIKER,"   I've... already assigned them to   the away team, Commander. And   I'll be with you as well.",8    INT. SHELBY'S QUARTERS - CONTINUOUS,SHELBY'S QUARTER,INT.,"The Best of Both Worlds, Part I",1990-04-06,The Next Generation,174.txt
42,SHELBY,       Of course. I appreciate any   assistance you can offer.,8    INT. SHELBY'S QUARTERS - CONTINUOUS,SHELBY'S QUARTER,INT.,"The Best of Both Worlds, Part I",1990-04-06,The Next Generation,174.txt
43,SHELBY,"   Tell me, something, Commander...   is serving aboard the Enterprise   as extraordinary an experience   as I've heard?",8    INT. SHELBY'S QUARTERS - CONTINUOUS,SHELBY'S QUARTER,INT.,"The Best of Both Worlds, Part I",1990-04-06,The Next Generation,174.txt
44,RIKER,   Every bit of it.,8    INT. SHELBY'S QUARTERS - CONTINUOUS,SHELBY'S QUARTER,INT.,"The Best of Both Worlds, Part I",1990-04-06,The Next Generation,174.txt
45,SHELBY,   Good.    (intimately sharing a     secret)   Because I intend to convince   Captain Picard that I'm the right   choice for the job.,8    INT. SHELBY'S QUARTERS - CONTINUOUS,SHELBY'S QUARTER,INT.,"The Best of Both Worlds, Part I",1990-04-06,The Next Generation,174.txt
46,RIKER,       Job? Which job... ?,8    INT. SHELBY'S QUARTERS - CONTINUOUS,SHELBY'S QUARTER,INT.,"The Best of Both Worlds, Part I",1990-04-06,The Next Generation,174.txt
47,SHELBY,"   Yours, of course.    (off his look,     ""embarrassed"")   I'm sorry... I heard you were   leaving.",8    INT. SHELBY'S QUARTERS - CONTINUOUS,SHELBY'S QUARTER,INT.,"The Best of Both Worlds, Part I",1990-04-06,The Next Generation,174.txt
48,RIKER,"   If I am... I'm sure you'll be the   first to know, Commander.       Poker's at seventeen hundred   hours, my quarters, deck eight...",8    INT. SHELBY'S QUARTERS - CONTINUOUS,SHELBY'S QUARTER,INT.,"The Best of Both Worlds, Part I",1990-04-06,The Next Generation,174.txt
49,DATA,"   I will buy another card,   Counselor.",8A   INT. RIKER'S QUARTERS - POKER TABLE,RIKER'S QUARTER,INT.,"The Best of Both Worlds, Part I",1990-04-06,The Next Generation,174.txt
50,WESLEY,"   Got another king in the hole,   Data?",8A   INT. RIKER'S QUARTERS - POKER TABLE,RIKER'S QUARTER,INT.,"The Best of Both Worlds, Part I",1990-04-06,The Next Generation,174.txt
51,DATA,"   I am afraid I cannot answer that   Wesley. And as you are a newcomer   to the game, may I say it is   inappropriate to ask.",8A   INT. RIKER'S QUARTERS - POKER TABLE,RIKER'S QUARTER,INT.,"The Best of Both Worlds, Part I",1990-04-06,The Next Generation,174.txt
52,TROI,   No help there.,8A   INT. RIKER'S QUARTERS - POKER TABLE,RIKER'S QUARTER,INT.,"The Best of Both Worlds, Part I",1990-04-06,The Next Generation,174.txt
53,GEORDI,       Fold. Again.,8A   INT. RIKER'S QUARTERS - POKER TABLE,RIKER'S QUARTER,INT.,"The Best of Both Worlds, Part I",1990-04-06,The Next Generation,174.txt
54,WESLEY,   I'm in.,8A   INT. RIKER'S QUARTERS - POKER TABLE,RIKER'S QUARTER,INT.,"The Best of Both Worlds, Part I",1990-04-06,The Next Generation,174.txt
55,TROI,   Three jacks looking back for the   handsome young ensign.,8A   INT. RIKER'S QUARTERS - POKER TABLE,RIKER'S QUARTER,INT.,"The Best of Both Worlds, Part I",1990-04-06,The Next Generation,174.txt
56,GEORDI,   Beginner's luck.,8A   INT. RIKER'S QUARTERS - POKER TABLE,RIKER'S QUARTER,INT.,"The Best of Both Worlds, Part I",1990-04-06,The Next Generation,174.txt
57,TROI,   Pair of deuces stands.,8A   INT. RIKER'S QUARTERS - POKER TABLE,RIKER'S QUARTER,INT.,"The Best of Both Worlds, Part I",1990-04-06,The Next Generation,174.txt
58,TROI,"   Possible flush, possible straight   flush. The bet is yours, Mister   Crusher.",8A   INT. RIKER'S QUARTERS - POKER TABLE,RIKER'S QUARTER,INT.,"The Best of Both Worlds, Part I",1990-04-06,The Next Generation,174.txt
59,WESLEY,   I'm in for ten...,8A   INT. RIKER'S QUARTERS - POKER TABLE,RIKER'S QUARTER,INT.,"The Best of Both Worlds, Part I",1990-04-06,The Next Generation,174.txt
60,RIKER,"       Time to put on the long pants,   Wes. I'll see your ten. And   raise you a hundred.",8A   INT. RIKER'S QUARTERS - POKER TABLE,RIKER'S QUARTER,INT.,"The Best of Both Worlds, Part I",1990-04-06,The Next Generation,174.txt
61,GEORDI,   He's got the straight flush.,8A   INT. RIKER'S QUARTERS - POKER TABLE,RIKER'S QUARTER,INT.,"The Best of Both Worlds, Part I",1990-04-06,The Next Generation,174.txt
62,DATA,"   Not necessarily. Commander Riker   may be bluffing, Wesley.",8A   INT. RIKER'S QUARTERS - POKER TABLE,RIKER'S QUARTER,INT.,"The Best of Both Worlds, Part I",1990-04-06,The Next Generation,174.txt
63,WESLEY,   I don't think so. I fold.,8A   INT. RIKER'S QUARTERS - POKER TABLE,RIKER'S QUARTER,INT.,"The Best of Both Worlds, Part I",1990-04-06,The Next Generation,174.txt
64,GEORDI,"       With three jacks?       Wesley, you may get straight A's   in school, but you've still got   a little to learn about poker...",8A   INT. RIKER'S QUARTERS - POKER TABLE,RIKER'S QUARTER,INT.,"The Best of Both Worlds, Part I",1990-04-06,The Next Generation,174.txt
65,SHELBY,"   I've only got two pair, Commander.   But I've got to see that blind   card. I'll call.",8A   INT. RIKER'S QUARTERS - POKER TABLE,RIKER'S QUARTER,INT.,"The Best of Both Worlds, Part I",1990-04-06,The Next Generation,174.txt
66,GEORDI,       You got him!,8A   INT. RIKER'S QUARTERS - POKER TABLE,RIKER'S QUARTER,INT.,"The Best of Both Worlds, Part I",1990-04-06,The Next Generation,174.txt
67,RIKER,   Mister Data and our guest appear   to be tardy...,11   INT. TRANSPORTER ROOM,TRANSPORTER ROOM,INT.,"The Best of Both Worlds, Part I",1990-04-06,The Next Generation,174.txt
68,O'BRIEN,"   Sir, Commander Shelby and Data   beamed down to the planet surface   an hour ago...",11   INT. TRANSPORTER ROOM,TRANSPORTER ROOM,INT.,"The Best of Both Worlds, Part I",1990-04-06,The Next Generation,174.txt
69,RIKER,       On whose authority?,11   INT. TRANSPORTER ROOM,TRANSPORTER ROOM,INT.,"The Best of Both Worlds, Part I",1990-04-06,The Next Generation,174.txt
70,O'BRIEN,"       On... hers, sir.",11   INT. TRANSPORTER ROOM,TRANSPORTER ROOM,INT.,"The Best of Both Worlds, Part I",1990-04-06,The Next Generation,174.txt
71,SHELBY,"   Morning. Early bird gets the   worm, eh? We've had some   interesting results...",12   EXT. PLANET SURFACE - DAWN (OPTICAL),PLANET SURFACE - DAWN,EXT.,"The Best of Both Worlds, Part I",1990-04-06,The Next Generation,174.txt
72,RIKER,"       Commander Shelby...    (he pauses, will not     do this in front of     the other officers)   Walk with me, Commander.",12   EXT. PLANET SURFACE - DAWN (OPTICAL),PLANET SURFACE - DAWN,EXT.,"The Best of Both Worlds, Part I",1990-04-06,The Next Generation,174.txt
73,DATA,   I believe Commander Shelby   erred... there are no known   avifaunal or crawling vermicular   lifeforms on Jouret Four.,12   EXT. PLANET SURFACE - DAWN (OPTICAL),PLANET SURFACE - DAWN,EXT.,"The Best of Both Worlds, Part I",1990-04-06,The Next Generation,174.txt
74,GEORDI,"   That's... not what she meant,   Data... but, uh, you're right,   she erred...",12   EXT. PLANET SURFACE - DAWN (OPTICAL),PLANET SURFACE - DAWN,EXT.,"The Best of Both Worlds, Part I",1990-04-06,The Next Generation,174.txt
75,SHELBY,       I'm sorry... I woke up early and   I saw a weather system was moving   in... it could have affected the   soil readings...,12   EXT. PLANET SURFACE - DAWN (OPTICAL),PLANET SURFACE - DAWN,EXT.,"The Best of Both Worlds, Part I",1990-04-06,The Next Generation,174.txt
76,RIKER,   So without any regard to the risk   of coming down alone...,12   EXT. PLANET SURFACE - DAWN (OPTICAL),PLANET SURFACE - DAWN,EXT.,"The Best of Both Worlds, Part I",1990-04-06,The Next Generation,174.txt
77,SHELBY,"   Really, Commander... if we ran   into the Borg, two extra bodies   wouldn't've made a hell of a   difference, would they? We had   three hours before the storm front   hit, less than two hours now.   Data was available. I took him.   We came. I don't see your   problem...",12   EXT. PLANET SURFACE - DAWN (OPTICAL),PLANET SURFACE - DAWN,EXT.,"The Best of Both Worlds, Part I",1990-04-06,The Next Generation,174.txt
78,RIKER,"   My problem, Commander, is I expect   to be notified before there's a   change in my orders...",12   EXT. PLANET SURFACE - DAWN (OPTICAL),PLANET SURFACE - DAWN,EXT.,"The Best of Both Worlds, Part I",1990-04-06,The Next Generation,174.txt
79,SHELBY,"       Noted for future reference. Do   you wish to hear my report, sir?",12   EXT. PLANET SURFACE - DAWN (OPTICAL),PLANET SURFACE - DAWN,EXT.,"The Best of Both Worlds, Part I",1990-04-06,The Next Generation,174.txt
80,RIKER,   Go ahead.,12   EXT. PLANET SURFACE - DAWN (OPTICAL),PLANET SURFACE - DAWN,EXT.,"The Best of Both Worlds, Part I",1990-04-06,The Next Generation,174.txt
81,SHELBY,   The soil contains the same   magnetic-resonance traces...   That's our footprint. There's   no doubt any more. It's the Borg.,12   EXT. PLANET SURFACE - DAWN (OPTICAL),PLANET SURFACE - DAWN,EXT.,"The Best of Both Worlds, Part I",1990-04-06,The Next Generation,174.txt
82,PICARD ,"   Captain's log, Stardate 43998.5.   With confirmation of the Borg's   presence in Federation space,   Admiral Hanson has returned to   Starbase three two four to discuss   strategy with Starfleet Command.   Lieutenant Commander Shelby   remains on board to continue   tactical preparations.",14   EXT. SPACE - THE ENTERPRISE (OPTICAL),SPACE - THE ENTERPRISE,EXT.,"The Best of Both Worlds, Part I",1990-04-06,The Next Generation,174.txt
83,RIKER,"   ... a standing Yellow Alert...   all Federation and allied outposts   have been warned... Ops will   continue to monitor long range   sensors... I've assigned Data,   La Forge and Mister Crusher to   work with Commander Shelby.",15   INT. CAPT. READY ROOM,CAPT. READY ROOM,INT.,"The Best of Both Worlds, Part I",1990-04-06,The Next Generation,174.txt
84,PICARD,"   Very good, Number One. You've   covered all the bases. As usual.       What's your impression of Shelby?",15   INT. CAPT. READY ROOM,CAPT. READY ROOM,INT.,"The Best of Both Worlds, Part I",1990-04-06,The Next Generation,174.txt
85,RIKER,"   She knows her stuff, Captain.",15   INT. CAPT. READY ROOM,CAPT. READY ROOM,INT.,"The Best of Both Worlds, Part I",1990-04-06,The Next Generation,174.txt
86,PICARD,   She has your full confidence...,15   INT. CAPT. READY ROOM,CAPT. READY ROOM,INT.,"The Best of Both Worlds, Part I",1990-04-06,The Next Generation,174.txt
87,RIKER,"   Well, I think she needs...   supervision.     ",15   INT. CAPT. READY ROOM,CAPT. READY ROOM,INT.,"The Best of Both Worlds, Part I",1990-04-06,The Next Generation,174.txt
88,RIKER ,   She takes the initiative a little   too... easily. Sometimes with   risks.,15   INT. CAPT. READY ROOM,CAPT. READY ROOM,INT.,"The Best of Both Worlds, Part I",1990-04-06,The Next Generation,174.txt
89,PICARD,   Sounds a little like a young   lieutenant commander I once   recruited as my first officer.,15   INT. CAPT. READY ROOM,CAPT. READY ROOM,INT.,"The Best of Both Worlds, Part I",1990-04-06,The Next Generation,174.txt
90,RIKER,       Perhaps.,15   INT. CAPT. READY ROOM,CAPT. READY ROOM,INT.,"The Best of Both Worlds, Part I",1990-04-06,The Next Generation,174.txt
91,PICARD,"   You're the best officer I've ever   served with, Will.",15   INT. CAPT. READY ROOM,CAPT. READY ROOM,INT.,"The Best of Both Worlds, Part I",1990-04-06,The Next Generation,174.txt
92,PICARD,       But what are you still doing here?,15   INT. CAPT. READY ROOM,CAPT. READY ROOM,INT.,"The Best of Both Worlds, Part I",1990-04-06,The Next Generation,174.txt
93,RIKER,       Sir?,15   INT. CAPT. READY ROOM,CAPT. READY ROOM,INT.,"The Best of Both Worlds, Part I",1990-04-06,The Next Generation,174.txt
94,PICARD,   I hear you've been offered the   Melbourne.,15   INT. CAPT. READY ROOM,CAPT. READY ROOM,INT.,"The Best of Both Worlds, Part I",1990-04-06,The Next Generation,174.txt
95,RIKER,   I've decided not to pursue the   commission at this time.,15   INT. CAPT. READY ROOM,CAPT. READY ROOM,INT.,"The Best of Both Worlds, Part I",1990-04-06,The Next Generation,174.txt
96,PICARD,"   She's a fine ship, Will.",15   INT. CAPT. READY ROOM,CAPT. READY ROOM,INT.,"The Best of Both Worlds, Part I",1990-04-06,The Next Generation,174.txt
97,RIKER,"   She's not the Enterprise.       With all due respect, sir, you   need me. Particularly now.",15   INT. CAPT. READY ROOM,CAPT. READY ROOM,INT.,"The Best of Both Worlds, Part I",1990-04-06,The Next Generation,174.txt
98,PICARD,   Starfleet needs good captains.   Particularly now. I cannot keep   you to myself forever.,15   INT. CAPT. READY ROOM,CAPT. READY ROOM,INT.,"The Best of Both Worlds, Part I",1990-04-06,The Next Generation,174.txt
99,PICARD,   I want you to reconsider your   decision.,15   INT. CAPT. READY ROOM,CAPT. READY ROOM,INT.,"The Best of Both Worlds, Part I",1990-04-06,The Next Generation,174.txt
100,RIKER,"       Are you asking me to leave,   Captain?",15   INT. CAPT. READY ROOM,CAPT. READY ROOM,INT.,"The Best of Both Worlds, Part I",1990-04-06,The Next Generation,174.txt
101,PICARD,"   I'm asking you to look at your   career objectively and make the   best decision.       I know it's hard to walk away.   But you're ready to work without   a net, my friend. You're ready   to make the life and death   decisions a captain must make.   And, hard as it is to accept, if   you choose to leave, the   Enterprise will go on just fine   without you.",15   INT. CAPT. READY ROOM,CAPT. READY ROOM,INT.,"The Best of Both Worlds, Part I",1990-04-06,The Next Generation,174.txt
102,RIKER,"   What am I still doing here,   Deanna? I've pushed myself hard   to get this far...       ... sacrificed a lot.     ",15A  INT. TEN-FORWARD,TEN-FORWARD,INT.,"The Best of Both Worlds, Part I",1990-04-06,The Next Generation,174.txt
103,RIKER ,   I've always said I wanted my own   command. And yet something's   holding me back. Is it wrong to   want to stay... ?,15A  INT. TEN-FORWARD,TEN-FORWARD,INT.,"The Best of Both Worlds, Part I",1990-04-06,The Next Generation,174.txt
104,TROI,   What do you think?,15A  INT. TEN-FORWARD,TEN-FORWARD,INT.,"The Best of Both Worlds, Part I",1990-04-06,The Next Generation,174.txt
105,RIKER,"    (shakes his head,     doesn't know)   Maybe I'm just afraid of the big   chair.",15A  INT. TEN-FORWARD,TEN-FORWARD,INT.,"The Best of Both Worlds, Part I",1990-04-06,The Next Generation,174.txt
106,TROI,   I don't think so.,15A  INT. TEN-FORWARD,TEN-FORWARD,INT.,"The Best of Both Worlds, Part I",1990-04-06,The Next Generation,174.txt
107,RIKER,"       The captain says Shelby reminds   him of the way I used to be. And   he's right. She comes in here,   full of drive and ambition,   impatient, taking risks... I look   at her and I wonder whatever   happened to those things in me? I   I liked those things in me.       I've lost something.",15A  INT. TEN-FORWARD,TEN-FORWARD,INT.,"The Best of Both Worlds, Part I",1990-04-06,The Next Generation,174.txt
108,TROI,"       You mean you're older, more   experienced... a little more   seasoned...",15A  INT. TEN-FORWARD,TEN-FORWARD,INT.,"The Best of Both Worlds, Part I",1990-04-06,The Next Generation,174.txt
109,RIKER,"       ""Seasoned"". What a horrible thing   to say to a man.",15A  INT. TEN-FORWARD,TEN-FORWARD,INT.,"The Best of Both Worlds, Part I",1990-04-06,The Next Generation,174.txt
110,TROI,   I don't think you've lost a   thing... and you've gained a lot   more than you realize. You're   much more comfortable with   yourself than you used to be...,15A  INT. TEN-FORWARD,TEN-FORWARD,INT.,"The Best of Both Worlds, Part I",1990-04-06,The Next Generation,174.txt
111,RIKER,   Maybe that's the problem. Could   be I'm too comfortable here.,15A  INT. TEN-FORWARD,TEN-FORWARD,INT.,"The Best of Both Worlds, Part I",1990-04-06,The Next Generation,174.txt
112,TROI,"   I'm not sure I know what that   means.       You're happy here... happier than   I've ever known you to be. It   really comes down to a simple   question -- what do you want, Will   Riker?",15A  INT. TEN-FORWARD,TEN-FORWARD,INT.,"The Best of Both Worlds, Part I",1990-04-06,The Next Generation,174.txt
113,TROI,   What?,15A  INT. TEN-FORWARD,TEN-FORWARD,INT.,"The Best of Both Worlds, Part I",1990-04-06,The Next Generation,174.txt
