,character,quote,scene,location,view,episode,date,series,file
114,RIKER,"   Stupid. An old song I heard when   I was a kid. Keeps running   through my mind...    (off her look, he begins     to sing)   ""Didja ever have the feeling that   you wanted to go... still had the   feeling that you wanted to stay...   You knew it was right... wasn't   wrong... still you knew you   wouldn't be very long... it's   tough to have the feeling that   you wanted to go... """,15A  INT. TEN-FORWARD,TEN-FORWARD,INT.,"The Best of Both Worlds, Part I",1990-04-06,The Next Generation,174.txt
115,RIKER,"       ""... still had the feeling that   you wanted to stay... start to   go... change your mind... """,15A  INT. TEN-FORWARD,TEN-FORWARD,INT.,"The Best of Both Worlds, Part I",1990-04-06,The Next Generation,174.txt
116,GUINAN,"   You start on Friday -- two shows   a night, matinee on Wednesday.",15A  INT. TEN-FORWARD,TEN-FORWARD,INT.,"The Best of Both Worlds, Part I",1990-04-06,The Next Generation,174.txt
117,RIKER,   I play the trombone too...,15A  INT. TEN-FORWARD,TEN-FORWARD,INT.,"The Best of Both Worlds, Part I",1990-04-06,The Next Generation,174.txt
118,SHELBY ,   ... a manipulation effect in the   Borg ship's subspace field...   a definite pattern -- at   four-point-eight minute intervals   during your first confrontation   with them.,16   INT. ENGINEERING - CLOSE ON MONITOR,ENGINEERIN,INT.,"The Best of Both Worlds, Part I",1990-04-06,The Next Generation,174.txt
119,GEORDI,   Might indicate high-output   auxiliary generators kicking in.,16   INT. ENGINEERING - CLOSE ON MONITOR,ENGINEERIN,INT.,"The Best of Both Worlds, Part I",1990-04-06,The Next Generation,174.txt
120,SHELBY,       One theory is that their systems   are decentralized with redundant   power sources located throughout   the ship.,16   INT. ENGINEERING - CLOSE ON MONITOR,ENGINEERIN,INT.,"The Best of Both Worlds, Part I",1990-04-06,The Next Generation,174.txt
121,DATA,   It is a reasonable conclusion.   Borg technology has given each   member of their society the   ability to interface and function   collectively. It is likely they   would construct their ship with   the same philosophy.,16   INT. ENGINEERING - CLOSE ON MONITOR,ENGINEERIN,INT.,"The Best of Both Worlds, Part I",1990-04-06,The Next Generation,174.txt
122,WESLEY,       Knock out one generator and   another takes over without   interruption.,16   INT. ENGINEERING - CLOSE ON MONITOR,ENGINEERIN,INT.,"The Best of Both Worlds, Part I",1990-04-06,The Next Generation,174.txt
123,RIKER,   What kind of damage would we have   to do to shut them down... ?,16   INT. ENGINEERING - CLOSE ON MONITOR,ENGINEERIN,INT.,"The Best of Both Worlds, Part I",1990-04-06,The Next Generation,174.txt
124,SHELBY,   Projections suggest a Borg ship   like this one could continue to   function effectively even if   seventy-eight percent of it was   inoperable.,16   INT. ENGINEERING - CLOSE ON MONITOR,ENGINEERIN,INT.,"The Best of Both Worlds, Part I",1990-04-06,The Next Generation,174.txt
125,WESLEY,       And our best shot barely scratched   the surface.,16   INT. ENGINEERING - CLOSE ON MONITOR,ENGINEERIN,INT.,"The Best of Both Worlds, Part I",1990-04-06,The Next Generation,174.txt
126,GEORDI,"   From what I've seen, I can't   believe any of your new weapons   systems can be ready in less than   eighteen months, Commander.",16   INT. ENGINEERING - CLOSE ON MONITOR,ENGINEERIN,INT.,"The Best of Both Worlds, Part I",1990-04-06,The Next Generation,174.txt
127,SHELBY,       We've been projecting twenty-four.,16   INT. ENGINEERING - CLOSE ON MONITOR,ENGINEERIN,INT.,"The Best of Both Worlds, Part I",1990-04-06,The Next Generation,174.txt
128,RIKER,       Is there anything here we can try   to adapt to our current defense   systems... ?,16   INT. ENGINEERING - CLOSE ON MONITOR,ENGINEERIN,INT.,"The Best of Both Worlds, Part I",1990-04-06,The Next Generation,174.txt
129,GEORDI,       We'll have to look through the   specs again.       I don't know. My mind's turned   to clay.,16   INT. ENGINEERING - CLOSE ON MONITOR,ENGINEERIN,INT.,"The Best of Both Worlds, Part I",1990-04-06,The Next Generation,174.txt
130,WESLEY,   Mine too.,16   INT. ENGINEERING - CLOSE ON MONITOR,ENGINEERIN,INT.,"The Best of Both Worlds, Part I",1990-04-06,The Next Generation,174.txt
131,SHELBY,   I think we should look at   modifying the plasma phaser   design...,16   INT. ENGINEERING - CLOSE ON MONITOR,ENGINEERIN,INT.,"The Best of Both Worlds, Part I",1990-04-06,The Next Generation,174.txt
132,RIKER,"   Commander, I think we should call   it a night.",16   INT. ENGINEERING - CLOSE ON MONITOR,ENGINEERIN,INT.,"The Best of Both Worlds, Part I",1990-04-06,The Next Generation,174.txt
133,SHELBY,   All right. Anyone who's really   that tired... if you want to   leave...,16   INT. ENGINEERING - CLOSE ON MONITOR,ENGINEERIN,INT.,"The Best of Both Worlds, Part I",1990-04-06,The Next Generation,174.txt
134,WESLEY,"   No, that's okay...",16   INT. ENGINEERING - CLOSE ON MONITOR,ENGINEERIN,INT.,"The Best of Both Worlds, Part I",1990-04-06,The Next Generation,174.txt
135,GEORDI,"   Go ahead, Commander...",16   INT. ENGINEERING - CLOSE ON MONITOR,ENGINEERIN,INT.,"The Best of Both Worlds, Part I",1990-04-06,The Next Generation,174.txt
136,SHELBY,       What would happen if we take the   frequency klystron from the   existing unit...,16   INT. ENGINEERING - CLOSE ON MONITOR,ENGINEERIN,INT.,"The Best of Both Worlds, Part I",1990-04-06,The Next Generation,174.txt
137,RIKER,   We'll break here. That's an   order. We'll reconvene at oh five   hundred...,16   INT. ENGINEERING - CLOSE ON MONITOR,ENGINEERIN,INT.,"The Best of Both Worlds, Part I",1990-04-06,The Next Generation,174.txt
138,SHELBY,"   Sir, if you'll allow me to   continue with Mister Data, who   does not require rest...",16   INT. ENGINEERING - CLOSE ON MONITOR,ENGINEERIN,INT.,"The Best of Both Worlds, Part I",1990-04-06,The Next Generation,174.txt
139,RIKER,"   You need rest, Commander.",16   INT. ENGINEERING - CLOSE ON MONITOR,ENGINEERIN,INT.,"The Best of Both Worlds, Part I",1990-04-06,The Next Generation,174.txt
140,SHELBY,   If we have a confrontation with   the Borg without improving our   defense systems...,16   INT. ENGINEERING - CLOSE ON MONITOR,ENGINEERIN,INT.,"The Best of Both Worlds, Part I",1990-04-06,The Next Generation,174.txt
141,RIKER,"   If we have a confrontation, I   don't want a crew fighting the   Borg at the same time they're   fighting their own fatigue...   Dismissed.",16   INT. ENGINEERING - CLOSE ON MONITOR,ENGINEERIN,INT.,"The Best of Both Worlds, Part I",1990-04-06,The Next Generation,174.txt
142,HANSON ,"   At nineteen hundred hours   yesterday, the USS Lalo   departed Zeta Alpha Two on a   freight run to Sentinel Minor   Four. At twenty-two hundred hours   and twelve minutes, a distress   signal was received at Starbase   one five seven. The Lalo reported   contact with an alien vessel...       ... described as cube-shaped. The   distress signal ended abruptly.   She has not been heard from since.",21   INT. OBSERVATION LOUNGE (OPTICAL),OBSERVATION LOUNGE,INT.,"The Best of Both Worlds, Part I",1990-04-06,The Next Generation,174.txt
143,PICARD,"   How long to get there at warp   nine, Mister Data?",21   INT. OBSERVATION LOUNGE (OPTICAL),OBSERVATION LOUNGE,INT.,"The Best of Both Worlds, Part I",1990-04-06,The Next Generation,174.txt
144,DATA,"   One hour, seventeen minutes, sir.",21   INT. OBSERVATION LOUNGE (OPTICAL),OBSERVATION LOUNGE,INT.,"The Best of Both Worlds, Part I",1990-04-06,The Next Generation,174.txt
145,PICARD,   Make it so.,21   INT. OBSERVATION LOUNGE (OPTICAL),OBSERVATION LOUNGE,INT.,"The Best of Both Worlds, Part I",1990-04-06,The Next Generation,174.txt
146,HANSON,"   We're coming with every available   starship to assist, Captain. But   the closest help is six days away.",21   INT. OBSERVATION LOUNGE (OPTICAL),OBSERVATION LOUNGE,INT.,"The Best of Both Worlds, Part I",1990-04-06,The Next Generation,174.txt
147,PICARD,"       We'll try to occupy them pending   your arrival, Admiral.",21   INT. OBSERVATION LOUNGE (OPTICAL),OBSERVATION LOUNGE,INT.,"The Best of Both Worlds, Part I",1990-04-06,The Next Generation,174.txt
148,HANSON,   I know you will. Hanson out.,21   INT. OBSERVATION LOUNGE (OPTICAL),OBSERVATION LOUNGE,INT.,"The Best of Both Worlds, Part I",1990-04-06,The Next Generation,174.txt
149,RIKER,   All hands will stand to battle   stations...,21   INT. OBSERVATION LOUNGE (OPTICAL),OBSERVATION LOUNGE,INT.,"The Best of Both Worlds, Part I",1990-04-06,The Next Generation,174.txt
150,PICARD,"   Commander Shelby, status of   defense preparations?",21   INT. OBSERVATION LOUNGE (OPTICAL),OBSERVATION LOUNGE,INT.,"The Best of Both Worlds, Part I",1990-04-06,The Next Generation,174.txt
151,SHELBY,"   Mister La Forge has a plan to   modulate shield nutation...   hopefully, that'll hold them off   for awhile.",21   INT. OBSERVATION LOUNGE (OPTICAL),OBSERVATION LOUNGE,INT.,"The Best of Both Worlds, Part I",1990-04-06,The Next Generation,174.txt
152,GEORDI,"   At the same time, we're retuning   phasers to higher EM-base   emitting frequencies -- we'll try   to disrupt their subspace field.",21   INT. OBSERVATION LOUNGE (OPTICAL),OBSERVATION LOUNGE,INT.,"The Best of Both Worlds, Part I",1990-04-06,The Next Generation,174.txt
153,PICARD,   Your assessment of our potential   effectiveness?,21   INT. OBSERVATION LOUNGE (OPTICAL),OBSERVATION LOUNGE,INT.,"The Best of Both Worlds, Part I",1990-04-06,The Next Generation,174.txt
154,GEORDI,"   Shot in the dark, Captain. Best   we can do for now.",21   INT. OBSERVATION LOUNGE (OPTICAL),OBSERVATION LOUNGE,INT.,"The Best of Both Worlds, Part I",1990-04-06,The Next Generation,174.txt
155,PICARD,       Dismissed.,21   INT. OBSERVATION LOUNGE (OPTICAL),OBSERVATION LOUNGE,INT.,"The Best of Both Worlds, Part I",1990-04-06,The Next Generation,174.txt
156,WORF,"   Sir, reading an unidentified   vessel just entering sensor range,   bearing two-one-zero mark   one-five-one...",23   INT. MAIN BRIDGE,MAIN BRIDGE,INT.,"The Best of Both Worlds, Part I",1990-04-06,The Next Generation,174.txt
157,PICARD,"   Hail them, Mister Worf...",23   INT. MAIN BRIDGE,MAIN BRIDGE,INT.,"The Best of Both Worlds, Part I",1990-04-06,The Next Generation,174.txt
158,WORF,"   No response, sir...",23   INT. MAIN BRIDGE,MAIN BRIDGE,INT.,"The Best of Both Worlds, Part I",1990-04-06,The Next Generation,174.txt
159,PICARD,   Move to intercept.,23   INT. MAIN BRIDGE,MAIN BRIDGE,INT.,"The Best of Both Worlds, Part I",1990-04-06,The Next Generation,174.txt
160,WORF,"    (beat, reacting to     console)   Sir, the vessel has already   changed course to intercept us.   Approaching at... warp nine point   three... Entering visual   range...",23   INT. MAIN BRIDGE,MAIN BRIDGE,INT.,"The Best of Both Worlds, Part I",1990-04-06,The Next Generation,174.txt
161,PICARD,   On screen.,23   INT. MAIN BRIDGE,MAIN BRIDGE,INT.,"The Best of Both Worlds, Part I",1990-04-06,The Next Generation,174.txt
162,PICARD,   Magnify.,23   INT. MAIN BRIDGE,MAIN BRIDGE,INT.,"The Best of Both Worlds, Part I",1990-04-06,The Next Generation,174.txt
163,PICARD,"   Mister Worf, dispatch a subspace   message to Admiral Hanson -- we   have engaged the Borg.",23   INT. MAIN BRIDGE,MAIN BRIDGE,INT.,"The Best of Both Worlds, Part I",1990-04-06,The Next Generation,174.txt
164,WORF,"   Captain, you are being hailed.",26   INT. MAIN BRIDGE (OPTICAL),MAIN BRIDGE,INT.,"The Best of Both Worlds, Part I",1990-04-06,The Next Generation,174.txt
165,PICARD,   I am?,26   INT. MAIN BRIDGE (OPTICAL),MAIN BRIDGE,INT.,"The Best of Both Worlds, Part I",1990-04-06,The Next Generation,174.txt
166,WORF,"   Yes, Captain. By name.",26   INT. MAIN BRIDGE (OPTICAL),MAIN BRIDGE,INT.,"The Best of Both Worlds, Part I",1990-04-06,The Next Generation,174.txt
167,RIKER,"   Data, is it the same ship we faced   at J-two-five?",26   INT. MAIN BRIDGE (OPTICAL),MAIN BRIDGE,INT.,"The Best of Both Worlds, Part I",1990-04-06,The Next Generation,174.txt
168,DATA,"   Uncertain, Commander. However,   dimensions are precisely the same.",26   INT. MAIN BRIDGE (OPTICAL),MAIN BRIDGE,INT.,"The Best of Both Worlds, Part I",1990-04-06,The Next Generation,174.txt
169,PICARD,   On screen.,26   INT. MAIN BRIDGE (OPTICAL),MAIN BRIDGE,INT.,"The Best of Both Worlds, Part I",1990-04-06,The Next Generation,174.txt
170,PICARD,   I am Jean-Luc...,26   INT. MAIN BRIDGE (OPTICAL),MAIN BRIDGE,INT.,"The Best of Both Worlds, Part I",1990-04-06,The Next Generation,174.txt
171,BORG,"   Jean-Luc Picard, captain of the   Starship Enterprise, registry   NCC-1701D, you will lower shields   and prepare to transport yourself   aboard our vessel. If you do not   cooperate, we will destroy your   ship.",26   INT. MAIN BRIDGE (OPTICAL),MAIN BRIDGE,INT.,"The Best of Both Worlds, Part I",1990-04-06,The Next Generation,174.txt
172,PICARD,   You have committed acts of   aggression against the United   Federation of Planets. If you   do not immediately withdraw...,26   INT. MAIN BRIDGE (OPTICAL),MAIN BRIDGE,INT.,"The Best of Both Worlds, Part I",1990-04-06,The Next Generation,174.txt
173,BORG,   You will surrender yourself or   we will destroy your ship. Your   defensive capabilities are unable   to withstand us.,26   INT. MAIN BRIDGE (OPTICAL),MAIN BRIDGE,INT.,"The Best of Both Worlds, Part I",1990-04-06,The Next Generation,174.txt
174,RIKER,       What the hell could they want with   you?,26   INT. MAIN BRIDGE (OPTICAL),MAIN BRIDGE,INT.,"The Best of Both Worlds, Part I",1990-04-06,The Next Generation,174.txt
175,SHELBY,   I thought they weren't interested   in human lifeforms... only our   technology.,26   INT. MAIN BRIDGE (OPTICAL),MAIN BRIDGE,INT.,"The Best of Both Worlds, Part I",1990-04-06,The Next Generation,174.txt
176,PICARD,"   Their priorities seem to have   changed. Open channel.       We have developed new defense   capabilities since our last   meeting and we are prepared to   use them if you do not withdraw   from Federation space. If you   do so immediately, I will agree   to arrange a conference of our   peoples at a neutral location.",26   INT. MAIN BRIDGE (OPTICAL),MAIN BRIDGE,INT.,"The Best of Both Worlds, Part I",1990-04-06,The Next Generation,174.txt
177,GEORDI,       Shields are being probed... I'm   modulating nutation...,27   INT. ENGINEERING,ENGINEERING,INT.,"The Best of Both Worlds, Part I",1990-04-06,The Next Generation,174.txt
178,WORF,"   Sir, the Borg are attempting to   lock on to us with their tractor   beam...",29   INT. MAIN BRIDGE,MAIN BRIDGE,INT.,"The Best of Both Worlds, Part I",1990-04-06,The Next Generation,174.txt
179,PICARD,   Load all torpedo bays... ready   phasers... target coordinates on   the source of the tractor beam...,29   INT. MAIN BRIDGE,MAIN BRIDGE,INT.,"The Best of Both Worlds, Part I",1990-04-06,The Next Generation,174.txt
180,RIKER,   Status of shields...,29   INT. MAIN BRIDGE,MAIN BRIDGE,INT.,"The Best of Both Worlds, Part I",1990-04-06,The Next Generation,174.txt
181,DATA,   Holding...,29   INT. MAIN BRIDGE,MAIN BRIDGE,INT.,"The Best of Both Worlds, Part I",1990-04-06,The Next Generation,174.txt
182,SHELBY,       The nutation modulation has them   confused...,29   INT. MAIN BRIDGE,MAIN BRIDGE,INT.,"The Best of Both Worlds, Part I",1990-04-06,The Next Generation,174.txt
183,RIKER,"       They have the ability to analyze   and adapt, Commander...",29   INT. MAIN BRIDGE,MAIN BRIDGE,INT.,"The Best of Both Worlds, Part I",1990-04-06,The Next Generation,174.txt
184,GEORDI,   Shield modulation has failed...   they've locked on...,29A  INT. ENGINEERING,ENGINEERING,INT.,"The Best of Both Worlds, Part I",1990-04-06,The Next Generation,174.txt
185,WORF,   Shields are being drained...   ninety per cent... eighty...,29A  INT. ENGINEERING,ENGINEERING,INT.,"The Best of Both Worlds, Part I",1990-04-06,The Next Generation,174.txt
186,GEORDI,   Trying to recalibrate nutation...   damn...,29A  INT. ENGINEERING,ENGINEERING,INT.,"The Best of Both Worlds, Part I",1990-04-06,The Next Generation,174.txt
187,WORF,   Shields have failed.,29A  INT. ENGINEERING,ENGINEERING,INT.,"The Best of Both Worlds, Part I",1990-04-06,The Next Generation,174.txt
188,PICARD,   Fire all weapons...,29A  INT. ENGINEERING,ENGINEERING,INT.,"The Best of Both Worlds, Part I",1990-04-06,The Next Generation,174.txt
189,GEORDI,   Their subspace field is intact...   new phaser frequencies had no   impact...,31   INT. ENGINEERING,ENGINEERING,INT.,"The Best of Both Worlds, Part I",1990-04-06,The Next Generation,174.txt
190,RIKER,   Reverse engines...,32   INT. MAIN BRIDGE,MAIN BRIDGE,INT.,"The Best of Both Worlds, Part I",1990-04-06,The Next Generation,174.txt
191,GEORDI,   Full reverse... we're not   moving...,32   INT. MAIN BRIDGE,MAIN BRIDGE,INT.,"The Best of Both Worlds, Part I",1990-04-06,The Next Generation,174.txt
192,PICARD,   Fire at will...,32   INT. MAIN BRIDGE,MAIN BRIDGE,INT.,"The Best of Both Worlds, Part I",1990-04-06,The Next Generation,174.txt
193,WORF,   Launching torpedos... phaser   spread continuing...,32   INT. MAIN BRIDGE,MAIN BRIDGE,INT.,"The Best of Both Worlds, Part I",1990-04-06,The Next Generation,174.txt
194,DATA,"   Still no damage to the Borg   vessel, sir...",32   INT. MAIN BRIDGE,MAIN BRIDGE,INT.,"The Best of Both Worlds, Part I",1990-04-06,The Next Generation,174.txt
195,COMPUTER,   Warning. Outer hull breach.,34   INT. ENGINEERING,ENGINEERING,INT.,"The Best of Both Worlds, Part I",1990-04-06,The Next Generation,174.txt
196,WORF,   They're cutting into the hull...   Engineering section...,35   INT. MAIN BRIDGE,MAIN BRIDGE,INT.,"The Best of Both Worlds, Part I",1990-04-06,The Next Generation,174.txt
197,RIKER,   Geordi... evacuate Engineering...,35   INT. MAIN BRIDGE,MAIN BRIDGE,INT.,"The Best of Both Worlds, Part I",1990-04-06,The Next Generation,174.txt
198,GEORDI,   Computer. Evacuation sequence...,36   INT. ENGINEERING,ENGINEERING,INT.,"The Best of Both Worlds, Part I",1990-04-06,The Next Generation,174.txt
199,COMPUTER,   Redirecting Engineering control   to bridge. Sealing doors to core   chamber...,36   INT. ENGINEERING,ENGINEERING,INT.,"The Best of Both Worlds, Part I",1990-04-06,The Next Generation,174.txt
200,GEORDI,   Move it people!,36   INT. ENGINEERING,ENGINEERING,INT.,"The Best of Both Worlds, Part I",1990-04-06,The Next Generation,174.txt
201,COMPUTER,"   Warning. Inner hull failing.   Decompression danger, deck   thirty-six, section four.   Sealing Main Engineering.",36   INT. ENGINEERING,ENGINEERING,INT.,"The Best of Both Worlds, Part I",1990-04-06,The Next Generation,174.txt
202,SHELBY,"   Data, fluctuate phaser resonance   frequencies... random settings...   keep changing them... don't give   them time to adapt...",37   INT. MAIN BRIDGE,MAIN BRIDGE,INT.,"The Best of Both Worlds, Part I",1990-04-06,The Next Generation,174.txt
203,WORF,   The tractor beam has been   released.,38A  INT. MAIN BRIDGE,MAIN BRIDGE,INT.,"The Best of Both Worlds, Part I",1990-04-06,The Next Generation,174.txt
204,PICARD,   Warp nine. Course one-five-one   mark three-three-zero... engage...,38A  INT. MAIN BRIDGE,MAIN BRIDGE,INT.,"The Best of Both Worlds, Part I",1990-04-06,The Next Generation,174.txt
205,WORF,"   They are in pursuit, Captain.",40   INT. MAIN BRIDGE,MAIN BRIDGE,INT.,"The Best of Both Worlds, Part I",1990-04-06,The Next Generation,174.txt
206,PICARD,   Maintain course.,40   INT. MAIN BRIDGE,MAIN BRIDGE,INT.,"The Best of Both Worlds, Part I",1990-04-06,The Next Generation,174.txt
207,RIKER,"   Damage report, Geordi.",40   INT. MAIN BRIDGE,MAIN BRIDGE,INT.,"The Best of Both Worlds, Part I",1990-04-06,The Next Generation,174.txt
208,GEORDI,       Hull rupture in Main   Engineering... damage is heavy...     ,40   INT. MAIN BRIDGE,MAIN BRIDGE,INT.,"The Best of Both Worlds, Part I",1990-04-06,The Next Generation,174.txt
209,GEORDI ,   We lost a lot of good people down   there.,40   INT. MAIN BRIDGE,MAIN BRIDGE,INT.,"The Best of Both Worlds, Part I",1990-04-06,The Next Generation,174.txt
210,DATA,"   Eleven dead... eight more   unaccounted for, Captain.",40   INT. MAIN BRIDGE,MAIN BRIDGE,INT.,"The Best of Both Worlds, Part I",1990-04-06,The Next Generation,174.txt
211,RIKER,       Repair teams to Engineering...   seal hull breach...,40   INT. MAIN BRIDGE,MAIN BRIDGE,INT.,"The Best of Both Worlds, Part I",1990-04-06,The Next Generation,174.txt
212,GEORDI,   They didn't get to the core...   I can control functions from   here...,40   INT. MAIN BRIDGE,MAIN BRIDGE,INT.,"The Best of Both Worlds, Part I",1990-04-06,The Next Generation,174.txt
213,WESLEY,"   Approaching the Paulson Nebula,   sir...",40   INT. MAIN BRIDGE,MAIN BRIDGE,INT.,"The Best of Both Worlds, Part I",1990-04-06,The Next Generation,174.txt
214,PICARD,"   Drop to impulse... take us in,   Ensign...",40   INT. MAIN BRIDGE,MAIN BRIDGE,INT.,"The Best of Both Worlds, Part I",1990-04-06,The Next Generation,174.txt
215,WESLEY,"   The field is getting too dense,   sir...",42   INT. MAIN BRIDGE - INCLUDE MAIN VIEWER (OPTICAL),MAIN BRIDGE - INCLUDE MAIN VIEWER,INT.,"The Best of Both Worlds, Part I",1990-04-06,The Next Generation,174.txt
216,PICARD,"   Steady... Mister Data, analysis   of the nebula cloud...",42   INT. MAIN BRIDGE - INCLUDE MAIN VIEWER (OPTICAL),MAIN BRIDGE - INCLUDE MAIN VIEWER,INT.,"The Best of Both Worlds, Part I",1990-04-06,The Next Generation,174.txt
217,DATA,"   Eighty-two percent Dilithium   hydroxyls... manganese, chromium.   It should provide an effective   screen against their sensors,   sir...",42   INT. MAIN BRIDGE - INCLUDE MAIN VIEWER (OPTICAL),MAIN BRIDGE - INCLUDE MAIN VIEWER,INT.,"The Best of Both Worlds, Part I",1990-04-06,The Next Generation,174.txt
218,PICARD,"   Prepare to take us in, Mister   Crusher. Now. Mister La Forge,   prepare to reverse engines, full   stop.",42   INT. MAIN BRIDGE - INCLUDE MAIN VIEWER (OPTICAL),MAIN BRIDGE - INCLUDE MAIN VIEWER,INT.,"The Best of Both Worlds, Part I",1990-04-06,The Next Generation,174.txt
219,WORF,   The Borg ship is continuing   scans... attempting to locate   us...,46   INT. MAIN BRIDGE,MAIN BRIDGE,INT.,"The Best of Both Worlds, Part I",1990-04-06,The Next Generation,174.txt
220,PICARD,   Good. As long as they're looking   for us... they can't hurt anyone   else.,46   INT. MAIN BRIDGE,MAIN BRIDGE,INT.,"The Best of Both Worlds, Part I",1990-04-06,The Next Generation,174.txt
221,RIKER,"   Shut down all active sensors,   passive scanners only. Deflectors   to minimum emissions.",46   INT. MAIN BRIDGE,MAIN BRIDGE,INT.,"The Best of Both Worlds, Part I",1990-04-06,The Next Generation,174.txt
222,PICARD,   We'll maintain position.    (looks at Riker and     Shelby)   Until we have a better idea.,46   INT. MAIN BRIDGE,MAIN BRIDGE,INT.,"The Best of Both Worlds, Part I",1990-04-06,The Next Generation,174.txt
223,SHELBY ,   Time index five-one-four... Data   started to fluctuate phaser   resonance frequencies... the   Borg's beam breaks contact...   Freeze picture.,48   INT. OBSERVATION LOUNGE - CLOSE ON MONITOR (OPTICAL),OBSERVATION LOUNGE - CLOSE ON MONITOR,INT.,"The Best of Both Worlds, Part I",1990-04-06,The Next Generation,174.txt
224,SHELBY,"   Take a close look, Commander...   Mister La Forge?    ",48   INT. OBSERVATION LOUNGE - CLOSE ON MONITOR (OPTICAL),OBSERVATION LOUNGE - CLOSE ON MONITOR,INT.,"The Best of Both Worlds, Part I",1990-04-06,The Next Generation,174.txt
225,GEORDI ,"   There's a two percent power drop,   just for an instant... but it's   system-wide... The phaser   frequency spread was in a high   narrow band.",48   INT. OBSERVATION LOUNGE - CLOSE ON MONITOR (OPTICAL),OBSERVATION LOUNGE - CLOSE ON MONITOR,INT.,"The Best of Both Worlds, Part I",1990-04-06,The Next Generation,174.txt
226,DATA,"   Conceivably, the ship's power   distribution nodes are vulnerable   to those frequencies.",48   INT. OBSERVATION LOUNGE - CLOSE ON MONITOR (OPTICAL),OBSERVATION LOUNGE - CLOSE ON MONITOR,INT.,"The Best of Both Worlds, Part I",1990-04-06,The Next Generation,174.txt
227,GEORDI,   If we can generate a concentrated   burst of energy with that same   frequency distribution... I mean   a lot more than anything our   phasers or photon torpedos could   provide...,48   INT. OBSERVATION LOUNGE - CLOSE ON MONITOR (OPTICAL),OBSERVATION LOUNGE - CLOSE ON MONITOR,INT.,"The Best of Both Worlds, Part I",1990-04-06,The Next Generation,174.txt
228,RIKER,   How do we do that?,48   INT. OBSERVATION LOUNGE - CLOSE ON MONITOR (OPTICAL),OBSERVATION LOUNGE - CLOSE ON MONITOR,INT.,"The Best of Both Worlds, Part I",1990-04-06,The Next Generation,174.txt
229,WESLEY,   The main deflector dish.,48   INT. OBSERVATION LOUNGE - CLOSE ON MONITOR (OPTICAL),OBSERVATION LOUNGE - CLOSE ON MONITOR,INT.,"The Best of Both Worlds, Part I",1990-04-06,The Next Generation,174.txt
230,GEORDI,   It's the only component of the   Enterprise designed to channel   that much power at controlled   frequencies.,48   INT. OBSERVATION LOUNGE - CLOSE ON MONITOR (OPTICAL),OBSERVATION LOUNGE - CLOSE ON MONITOR,INT.,"The Best of Both Worlds, Part I",1990-04-06,The Next Generation,174.txt
231,SHELBY,"   Unfortunately, there is one slight   detail -- in the process, the   blast completely destroys the   Enterprise as well.",48   INT. OBSERVATION LOUNGE - CLOSE ON MONITOR (OPTICAL),OBSERVATION LOUNGE - CLOSE ON MONITOR,INT.,"The Best of Both Worlds, Part I",1990-04-06,The Next Generation,174.txt
232,RIKER,       But if we could get far enough   away... increase the deflector   range...,48   INT. OBSERVATION LOUNGE - CLOSE ON MONITOR (OPTICAL),OBSERVATION LOUNGE - CLOSE ON MONITOR,INT.,"The Best of Both Worlds, Part I",1990-04-06,The Next Generation,174.txt
233,SHELBY,"       It could work. In the meantime,   we should retune all phasers,   including hand units, to the same   frequency.",48   INT. OBSERVATION LOUNGE - CLOSE ON MONITOR (OPTICAL),OBSERVATION LOUNGE - CLOSE ON MONITOR,INT.,"The Best of Both Worlds, Part I",1990-04-06,The Next Generation,174.txt
