,character,quote,scene,location,view,episode,date,series,file
0,RIKER,"       You're absolutely right, Doctor.   In fact, right now it's hard to   imagine ever hurting anyone...",1    INT. ASYLUM CELL,ASYLUM CELL,INT.,Frame of Mind,1993-02-16,The Next Generation,247.txt
1,DOCTOR ,   How do you feel about that person   you used to be?,1    INT. ASYLUM CELL,ASYLUM CELL,INT.,Frame of Mind,1993-02-16,The Next Generation,247.txt
2,RIKER,"   I feel... terrible. But thanks to   you, I'm much better now. And I   feel confident that when I leave,   I'll be ready to take my place in   society again.",1    INT. ASYLUM CELL,ASYLUM CELL,INT.,Frame of Mind,1993-02-16,The Next Generation,247.txt
3,DOCTOR ,   When do you think that will be?,1    INT. ASYLUM CELL,ASYLUM CELL,INT.,Frame of Mind,1993-02-16,The Next Generation,247.txt
4,RIKER,   Well... now. Right away.,1    INT. ASYLUM CELL,ASYLUM CELL,INT.,Frame of Mind,1993-02-16,The Next Generation,247.txt
5,DOCTOR ,   What makes you say that?,1    INT. ASYLUM CELL,ASYLUM CELL,INT.,Frame of Mind,1993-02-16,The Next Generation,247.txt
6,RIKER,"   You said when I was able to accept   what I'd done, and understood the   consequences of my actions, that   I'd be free to go.",1    INT. ASYLUM CELL,ASYLUM CELL,INT.,Frame of Mind,1993-02-16,The Next Generation,247.txt
7,DOCTOR ,"   ""Free to go."" Are you saying you   don't think you should stand trial   for what you've done?",1    INT. ASYLUM CELL,ASYLUM CELL,INT.,Frame of Mind,1993-02-16,The Next Generation,247.txt
8,RIKER,   I'm looking forward to proving my   innocence...,1    INT. ASYLUM CELL,ASYLUM CELL,INT.,Frame of Mind,1993-02-16,The Next Generation,247.txt
9,DOCTOR ,   I thought you said you accepted   what you'd done.,1    INT. ASYLUM CELL,ASYLUM CELL,INT.,Frame of Mind,1993-02-16,The Next Generation,247.txt
10,RIKER,   But that's not what I meant. I...   I meant that I was sick when it   happened. I wasn't responsible   for what I did...,1    INT. ASYLUM CELL,ASYLUM CELL,INT.,Frame of Mind,1993-02-16,The Next Generation,247.txt
11,DOCTOR ,   How do I know that you're not just   telling me what I want to hear?,1    INT. ASYLUM CELL,ASYLUM CELL,INT.,Frame of Mind,1993-02-16,The Next Generation,247.txt
12,DOCTOR ,       Perhaps we should continue this   discussion next week...,1    INT. ASYLUM CELL,ASYLUM CELL,INT.,Frame of Mind,1993-02-16,The Next Generation,247.txt
13,RIKER,   No. I want to talk about it   now...,1    INT. ASYLUM CELL,ASYLUM CELL,INT.,Frame of Mind,1993-02-16,The Next Generation,247.txt
14,DOCTOR ,       You're starting to sound angry   again. Maybe you need another   treatment...,1    INT. ASYLUM CELL,ASYLUM CELL,INT.,Frame of Mind,1993-02-16,The Next Generation,247.txt
15,RIKER,"   What I need is to get out of this   cell. I'm locked up day and   night... you control every   move... tell me what to eat, what   to think, what to say...",1    INT. ASYLUM CELL,ASYLUM CELL,INT.,Frame of Mind,1993-02-16,The Next Generation,247.txt
16,RIKER,"       And when I show a glimmer of   independent thought, you strap me   down, inject me with drugs and   call it a ""treatment.""",1    INT. ASYLUM CELL,ASYLUM CELL,INT.,Frame of Mind,1993-02-16,The Next Generation,247.txt
17,DOCTOR ,   You're becoming agitated...,1    INT. ASYLUM CELL,ASYLUM CELL,INT.,Frame of Mind,1993-02-16,The Next Generation,247.txt
18,RIKER,"   You bet I'm agitated! I may be   surrounded by insanity, but I'm   not insane. And I won't let you   or anyone... me think I am....",1    INT. ASYLUM CELL,ASYLUM CELL,INT.,Frame of Mind,1993-02-16,The Next Generation,247.txt
19,RIKER,   I won't let you or anyone think   that...,1    INT. ASYLUM CELL,ASYLUM CELL,INT.,Frame of Mind,1993-02-16,The Next Generation,247.txt
20,RIKER,"   I'm sorry. Can we take it from   ""You're becoming agitated""?",1    INT. ASYLUM CELL,ASYLUM CELL,INT.,Frame of Mind,1993-02-16,The Next Generation,247.txt
21,BEVERLY,       Why don't we break for tonight.   I think we've made a lot of   progress.,1    INT. ASYLUM CELL,ASYLUM CELL,INT.,Frame of Mind,1993-02-16,The Next Generation,247.txt
22,RIKER,   But I'm still not confident about   that final speech...,1    INT. ASYLUM CELL,ASYLUM CELL,INT.,Frame of Mind,1993-02-16,The Next Generation,247.txt
23,BEVERLY,"   There's such a thing as over-rehearsing,   Wil. You'll do just   fine.       Try to relax. You're resisting   the character. Let yourself feel   what he's feeling.",1    INT. ASYLUM CELL,ASYLUM CELL,INT.,Frame of Mind,1993-02-16,The Next Generation,247.txt
24,RIKER,       Maybe I'm just not right for this   part...,1    INT. ASYLUM CELL,ASYLUM CELL,INT.,Frame of Mind,1993-02-16,The Next Generation,247.txt
25,DATA,       Most humanoids have the potential   to be irrational. Perhaps you   should attempt to access that part   of your psyche.,1    INT. ASYLUM CELL,ASYLUM CELL,INT.,Frame of Mind,1993-02-16,The Next Generation,247.txt
26,BEVERLY,   Haven't you ever felt at odds with   everyone -- like the whole world   was against you?,1    INT. ASYLUM CELL,ASYLUM CELL,INT.,Frame of Mind,1993-02-16,The Next Generation,247.txt
27,RIKER,   Yeah... my first year at the   Academy...,1    INT. ASYLUM CELL,ASYLUM CELL,INT.,Frame of Mind,1993-02-16,The Next Generation,247.txt
28,BEVERLY,   Try to tap into that feeling.   That's what your character is   going through in this scene.,1    INT. ASYLUM CELL,ASYLUM CELL,INT.,Frame of Mind,1993-02-16,The Next Generation,247.txt
29,RIKER,   I'll work on it...,1    INT. ASYLUM CELL,ASYLUM CELL,INT.,Frame of Mind,1993-02-16,The Next Generation,247.txt
30,BEVERLY,   It'll be wonderful. You're going   to knock 'em dead.,1    INT. ASYLUM CELL,ASYLUM CELL,INT.,Frame of Mind,1993-02-16,The Next Generation,247.txt
31,RIKER,"   ""You control every move... tell me   what to eat, what to think, what   to say... """,3    INT. CORRIDOR,CORRIDOR,INT.,Frame of Mind,1993-02-16,The Next Generation,247.txt
32,RIKER,"       ""What to eat, what to think, what   to say... ""       ""And when I show a glimmer of   independent thought, you strap me   down, inject me with drugs and   call it a 'treatment'... """,3    INT. CORRIDOR,CORRIDOR,INT.,Frame of Mind,1993-02-16,The Next Generation,247.txt
33,RIKER,"       ""I may be surrounded by insanity,   but I'm not insane --""",3    INT. CORRIDOR,CORRIDOR,INT.,Frame of Mind,1993-02-16,The Next Generation,247.txt
34,RIKER,   Excuse me...,3    INT. CORRIDOR,CORRIDOR,INT.,Frame of Mind,1993-02-16,The Next Generation,247.txt
35,RIKER,       Tilonus Four? Didn't their   government just collapse?,4    INT. READY ROOM,READY ROOM,INT.,Frame of Mind,1993-02-16,The Next Generation,247.txt
36,PICARD,"       It's in a state of total anarchy.   When the Prime Minister was   assassinated, a Federation   research team was on the planet.   It is believed they were forced to   go into hiding...       Your mission will be to locate and   evacuate them.",4    INT. READY ROOM,READY ROOM,INT.,Frame of Mind,1993-02-16,The Next Generation,247.txt
37,RIKER,   Can't they go to local   authorities?,4    INT. READY ROOM,READY ROOM,INT.,Frame of Mind,1993-02-16,The Next Generation,247.txt
38,PICARD,"   There are no local authorities.   The government's been splintered --   several factions are vying for   power. And they're desperate for   weapons or technology of any   kind...       Apparently, some factions are   resorting to torture to gather   information. A Starfleet research   team would be a prime target.",4    INT. READY ROOM,READY ROOM,INT.,Frame of Mind,1993-02-16,The Next Generation,247.txt
39,RIKER,   Then I'll have to go alone...   undercover.,4    INT. READY ROOM,READY ROOM,INT.,Frame of Mind,1993-02-16,The Next Generation,247.txt
40,PICARD,   Agreed. Mister Worf is ready to   give you a detailed briefing on   Tilonian culture.,4    INT. READY ROOM,READY ROOM,INT.,Frame of Mind,1993-02-16,The Next Generation,247.txt
41,RIKER,       Looks like I'll have to back out   of Doctor Crusher's play after   all...,4    INT. READY ROOM,READY ROOM,INT.,Frame of Mind,1993-02-16,The Next Generation,247.txt
42,PICARD,"   No, no... you'll have plenty of   time for that, Number One. We   won't be arriving at Tilonus for   another five days.       Besides, if you back out now,   Beverly will come after me to play   the part.",4    INT. READY ROOM,READY ROOM,INT.,Frame of Mind,1993-02-16,The Next Generation,247.txt
43,WORF,   This is the last known location of   the research team. They had   occupied a small building in the   Southwest quarter of the city.   You will begin your search there.,5    INT. OBSERVATION LOUNGE,OBSERVATION LOUNGE,INT.,Frame of Mind,1993-02-16,The Next Generation,247.txt
44,RIKER,   The Southwest quarter covers over   two hundred square kilometers.   That's a lot of ground for one man   to cover...       I'd better pack an extra pair of   boots.,5    INT. OBSERVATION LOUNGE,OBSERVATION LOUNGE,INT.,Frame of Mind,1993-02-16,The Next Generation,247.txt
45,WORF,       This apparel will allow you to   pass as a common merchant.,5    INT. OBSERVATION LOUNGE,OBSERVATION LOUNGE,INT.,Frame of Mind,1993-02-16,The Next Generation,247.txt
46,WORF,       This Tilonian pendant has been   equipped with a communicator   circuit.,5    INT. OBSERVATION LOUNGE,OBSERVATION LOUNGE,INT.,Frame of Mind,1993-02-16,The Next Generation,247.txt
47,RIKER,       It doesn't really match the   outfit...,5    INT. OBSERVATION LOUNGE,OBSERVATION LOUNGE,INT.,Frame of Mind,1993-02-16,The Next Generation,247.txt
48,WORF,"   I suggest you pay closer   attention, Commander. Your life   will be at stake.",5    INT. OBSERVATION LOUNGE,OBSERVATION LOUNGE,INT.,Frame of Mind,1993-02-16,The Next Generation,247.txt
49,WORF,       Do you understand what I am   saying?,5    INT. OBSERVATION LOUNGE,OBSERVATION LOUNGE,INT.,Frame of Mind,1993-02-16,The Next Generation,247.txt
50,RIKER,       Yes... of course I do...,5    INT. OBSERVATION LOUNGE,OBSERVATION LOUNGE,INT.,Frame of Mind,1993-02-16,The Next Generation,247.txt
51,WORF,"       Because you will be posing as a   merchant, you will need to know   how to use the Nisroh for the   traditional bartering ceremony.",5    INT. OBSERVATION LOUNGE,OBSERVATION LOUNGE,INT.,Frame of Mind,1993-02-16,The Next Generation,247.txt
52,WORF,       You will be judged on your prowess   with the blade...,5    INT. OBSERVATION LOUNGE,OBSERVATION LOUNGE,INT.,Frame of Mind,1993-02-16,The Next Generation,247.txt
53,WORF,"   I am sorry, Commander! I did not   intend --",5    INT. OBSERVATION LOUNGE,OBSERVATION LOUNGE,INT.,Frame of Mind,1993-02-16,The Next Generation,247.txt
54,RIKER,"   That's okay, that's okay...",5    INT. OBSERVATION LOUNGE,OBSERVATION LOUNGE,INT.,Frame of Mind,1993-02-16,The Next Generation,247.txt
55,RIKER,       I guess I really wasn't paying   attention...       I'd better get to Sickbay. We'll   pick this up later.,5    INT. OBSERVATION LOUNGE,OBSERVATION LOUNGE,INT.,Frame of Mind,1993-02-16,The Next Generation,247.txt
56,WORF,   Aye sir...,5    INT. OBSERVATION LOUNGE,OBSERVATION LOUNGE,INT.,Frame of Mind,1993-02-16,The Next Generation,247.txt
57,BEVERLY,"       You'll do anything to get out of   this play, won't you?       Well, you're going to have to do   better than this...",6    INT. SICKBAY (OPTICAL),SICKBAY,INT.,Frame of Mind,1993-02-16,The Next Generation,247.txt
58,RIKER,   The play's tomorrow night. I've   still got twenty-four hours left.,6    INT. SICKBAY (OPTICAL),SICKBAY,INT.,Frame of Mind,1993-02-16,The Next Generation,247.txt
59,BEVERLY,   Don't get any ideas. I'll expect   you on stage at eighteen hundred   hours.,6    INT. SICKBAY (OPTICAL),SICKBAY,INT.,Frame of Mind,1993-02-16,The Next Generation,247.txt
60,RIKER,   Right...,6    INT. SICKBAY (OPTICAL),SICKBAY,INT.,Frame of Mind,1993-02-16,The Next Generation,247.txt
61,RIKER,       It still hurts...,6    INT. SICKBAY (OPTICAL),SICKBAY,INT.,Frame of Mind,1993-02-16,The Next Generation,247.txt
62,BEVERLY,   There's no nerve damage... you   shouldn't be feeling any pain.,6    INT. SICKBAY (OPTICAL),SICKBAY,INT.,Frame of Mind,1993-02-16,The Next Generation,247.txt
63,RIKER,   Probably just a symptom of stage   fright --,6    INT. SICKBAY (OPTICAL),SICKBAY,INT.,Frame of Mind,1993-02-16,The Next Generation,247.txt
64,GEORDI,       He was working on a conduit on   Deck Thirty-seven. A plasma torch   blew up in his hands...,6    INT. SICKBAY (OPTICAL),SICKBAY,INT.,Frame of Mind,1993-02-16,The Next Generation,247.txt
65,WOUNDED CREWMEMBER,   It hurts! Oh God -- it hurts!,6    INT. SICKBAY (OPTICAL),SICKBAY,INT.,Frame of Mind,1993-02-16,The Next Generation,247.txt
66,RIKER,   I've been on a lot of missions...   and I've seen a lot of people get   injured...       But I've never been affected like   this...,7    INT. TEN FORWARD,TEN FORWARD,INT.,Frame of Mind,1993-02-16,The Next Generation,247.txt
67,RIKER,       He was looking right at me.,7    INT. TEN FORWARD,TEN FORWARD,INT.,Frame of Mind,1993-02-16,The Next Generation,247.txt
68,TROI,   And that was disturbing to you...,7    INT. TEN FORWARD,TEN FORWARD,INT.,Frame of Mind,1993-02-16,The Next Generation,247.txt
69,RIKER,"   It was like he was... blaming me   or something. But it's more than   just this one incident. For the   past few days, I've been feeling   like everyone's staring at me...   or talking about me...     ",7    INT. TEN FORWARD,TEN FORWARD,INT.,Frame of Mind,1993-02-16,The Next Generation,247.txt
70,RIKER ,"       I feel like I'm in ""Frame of   Mind""...",7    INT. TEN FORWARD,TEN FORWARD,INT.,Frame of Mind,1993-02-16,The Next Generation,247.txt
71,TROI,"   ""Frame of Mind""?",7    INT. TEN FORWARD,TEN FORWARD,INT.,Frame of Mind,1993-02-16,The Next Generation,247.txt
72,RIKER,"   Doctor Crusher's play. Ever since   I started rehearsing the role,   I've been feeling a little   restless... uneasy...",7    INT. TEN FORWARD,TEN FORWARD,INT.,Frame of Mind,1993-02-16,The Next Generation,247.txt
73,TROI,   You're probably drawing on   feelings that you're not used to   expressing...,7    INT. TEN FORWARD,TEN FORWARD,INT.,Frame of Mind,1993-02-16,The Next Generation,247.txt
74,RIKER,   Yeah. The play is full of   disturbing images. People losing   their minds... being tortured by   doctors...       I can't get it out of my head...,7    INT. TEN FORWARD,TEN FORWARD,INT.,Frame of Mind,1993-02-16,The Next Generation,247.txt
75,TROI,"   Sometimes it's healthy to explore   the darker sides of the psyche.   Jung called it ""owning your own   shadow.""       This could be a sign that you're   a real actor, Wil. It's becoming   more than just a role to you.",7    INT. TEN FORWARD,TEN FORWARD,INT.,Frame of Mind,1993-02-16,The Next Generation,247.txt
76,RIKER,   Maybe you're right...,7    INT. TEN FORWARD,TEN FORWARD,INT.,Frame of Mind,1993-02-16,The Next Generation,247.txt
77,TROI,   Don't be afraid of your darker   side. Have fun with it.,7    INT. TEN FORWARD,TEN FORWARD,INT.,Frame of Mind,1993-02-16,The Next Generation,247.txt
78,RIKER,       Who is that?,7    INT. TEN FORWARD,TEN FORWARD,INT.,Frame of Mind,1993-02-16,The Next Generation,247.txt
79,RIKER,       You just missed him.       Do we have a new Lieutenant on   board?,7    INT. TEN FORWARD,TEN FORWARD,INT.,Frame of Mind,1993-02-16,The Next Generation,247.txt
80,TROI,   I'm not sure. Do you want me to   check the personnel logs?,7    INT. TEN FORWARD,TEN FORWARD,INT.,Frame of Mind,1993-02-16,The Next Generation,247.txt
81,RIKER,   No... I'll check them tomorrow...       I think I'll get to bed early.   Tomorrow's the performance and I   want to be up for it.,7    INT. TEN FORWARD,TEN FORWARD,INT.,Frame of Mind,1993-02-16,The Next Generation,247.txt
82,TROI,   I'm looking forward to it.       Break a leg.,7    INT. TEN FORWARD,TEN FORWARD,INT.,Frame of Mind,1993-02-16,The Next Generation,247.txt
83,RIKER,   I'll try not to take that   literally.,7    INT. TEN FORWARD,TEN FORWARD,INT.,Frame of Mind,1993-02-16,The Next Generation,247.txt
84,DATA/DOCTOR,       Perhaps we should continue this   discussion next week...,10   INT. ASYLUM CELL/THEATER,ASYLUM CELL/THEATER,INT.,Frame of Mind,1993-02-16,The Next Generation,247.txt
85,RIKER,   No. I want to talk about it   now...,10   INT. ASYLUM CELL/THEATER,ASYLUM CELL/THEATER,INT.,Frame of Mind,1993-02-16,The Next Generation,247.txt
86,DATA/DOCTOR,       You're starting to sound angry   again. Maybe you need another   treatment...,10   INT. ASYLUM CELL/THEATER,ASYLUM CELL/THEATER,INT.,Frame of Mind,1993-02-16,The Next Generation,247.txt
87,RIKER,"   What I need is to get out of this   cell. I'm locked up day and   night... you control every   move... tell me what to eat, what   to think, what to say...",10   INT. ASYLUM CELL/THEATER,ASYLUM CELL/THEATER,INT.,Frame of Mind,1993-02-16,The Next Generation,247.txt
88,RIKER,"       And when I show a glimmer of   independent thought, you strap me   down, inject me with drugs and   call it a ""treatment.""",10   INT. ASYLUM CELL/THEATER,ASYLUM CELL/THEATER,INT.,Frame of Mind,1993-02-16,The Next Generation,247.txt
89,DOCTOR,   You're becoming agitated...,10   INT. ASYLUM CELL/THEATER,ASYLUM CELL/THEATER,INT.,Frame of Mind,1993-02-16,The Next Generation,247.txt
90,RIKER,"   You bet I'm agitated! I may be   surrounded by insanity, but I'm   not insane. And I won't let you   or anyone else tell me I am.",10   INT. ASYLUM CELL/THEATER,ASYLUM CELL/THEATER,INT.,Frame of Mind,1993-02-16,The Next Generation,247.txt
91,RIKER,"       You can destroy my mind, but you   can't change the truth. I didn't   kill that man.       And that's what's driving you   crazy...",10   INT. ASYLUM CELL/THEATER,ASYLUM CELL/THEATER,INT.,Frame of Mind,1993-02-16,The Next Generation,247.txt
92,DATA/DOCTOR,   I can see we have a lot of work to   do.,10   INT. ASYLUM CELL/THEATER,ASYLUM CELL/THEATER,INT.,Frame of Mind,1993-02-16,The Next Generation,247.txt
93,RIKER,"   No matter what you do, you can't   change the fact that I'm innocent!       I'm not crazy!",10   INT. ASYLUM CELL/THEATER,ASYLUM CELL/THEATER,INT.,Frame of Mind,1993-02-16,The Next Generation,247.txt
94,RIKER,       I'm not crazy...,10   INT. ASYLUM CELL/THEATER,ASYLUM CELL/THEATER,INT.,Frame of Mind,1993-02-16,The Next Generation,247.txt
95,RIKER,       I'm... not...       ...crazy.,10   INT. ASYLUM CELL/THEATER,ASYLUM CELL/THEATER,INT.,Frame of Mind,1993-02-16,The Next Generation,247.txt
96,,   I can see we have a lot of work to   do.,10   INT. ASYLUM CELL/THEATER,ASYLUM CELL/THEATER,INT.,Frame of Mind,1993-02-16,The Next Generation,247.txt
97,RIKER,   Where am I?       How did you get me off the ship?,19   INT. ASYLUM CELL - CONTINUOUS,ASYLUM CEL,INT.,Frame of Mind,1993-02-16,The Next Generation,247.txt
98,DOCTOR,       The ship again...,19   INT. ASYLUM CELL - CONTINUOUS,ASYLUM CEL,INT.,Frame of Mind,1993-02-16,The Next Generation,247.txt
99,RIKER,   What's going on?,19   INT. ASYLUM CELL - CONTINUOUS,ASYLUM CEL,INT.,Frame of Mind,1993-02-16,The Next Generation,247.txt
100,DOCTOR,   I understand this must be very   disturbing for you. But try to   relax.       Tell me. Where were you a moment   ago?,19   INT. ASYLUM CELL - CONTINUOUS,ASYLUM CEL,INT.,Frame of Mind,1993-02-16,The Next Generation,247.txt
101,RIKER,   I was on the Enterprise. In the   middle of a play...       Here... but it wasn't real... it   was a stage...,19   INT. ASYLUM CELL - CONTINUOUS,ASYLUM CEL,INT.,Frame of Mind,1993-02-16,The Next Generation,247.txt
102,DOCTOR,   I can assure you this is not a   stage.       Do you remember your name?,19   INT. ASYLUM CELL - CONTINUOUS,ASYLUM CEL,INT.,Frame of Mind,1993-02-16,The Next Generation,247.txt
103,RIKER,   I'm Commander...       Commander...,19   INT. ASYLUM CELL - CONTINUOUS,ASYLUM CEL,INT.,Frame of Mind,1993-02-16,The Next Generation,247.txt
104,RIKER,       I knew who I was a second ago...   I was on the ship... in a play...       It's getting harder to remember...,19   INT. ASYLUM CELL - CONTINUOUS,ASYLUM CEL,INT.,Frame of Mind,1993-02-16,The Next Generation,247.txt
105,DOCTOR,   That's good. You're starting to   come out of your delusional state.,19   INT. ASYLUM CELL - CONTINUOUS,ASYLUM CEL,INT.,Frame of Mind,1993-02-16,The Next Generation,247.txt
106,RIKER,       Delusion... it couldn't be a   delusion. I was there...,19   INT. ASYLUM CELL - CONTINUOUS,ASYLUM CEL,INT.,Frame of Mind,1993-02-16,The Next Generation,247.txt
107,DOCTOR,       We've discussed this. Do you   remember when we contacted   Starfleet... and asked them about   you?,19   INT. ASYLUM CELL - CONTINUOUS,ASYLUM CEL,INT.,Frame of Mind,1993-02-16,The Next Generation,247.txt
108,RIKER,   No...,19   INT. ASYLUM CELL - CONTINUOUS,ASYLUM CEL,INT.,Frame of Mind,1993-02-16,The Next Generation,247.txt
109,DOCTOR,   We spoke with Admiral Budrow. On   Starbase...,19   INT. ASYLUM CELL - CONTINUOUS,ASYLUM CEL,INT.,Frame of Mind,1993-02-16,The Next Generation,247.txt
110,RIKER,       ... Starbase Twenty-nine.,19   INT. ASYLUM CELL - CONTINUOUS,ASYLUM CEL,INT.,Frame of Mind,1993-02-16,The Next Generation,247.txt
111,RIKER,   He said he'd never heard of me...   that they had no officer matching   my description...,19   INT. ASYLUM CELL - CONTINUOUS,ASYLUM CEL,INT.,Frame of Mind,1993-02-16,The Next Generation,247.txt
112,DOCTOR,   That's right. Now. Focus on who   I am. Do you remember me?,19   INT. ASYLUM CELL - CONTINUOUS,ASYLUM CEL,INT.,Frame of Mind,1993-02-16,The Next Generation,247.txt
113,RIKER,   I'm not sure...,19   INT. ASYLUM CELL - CONTINUOUS,ASYLUM CEL,INT.,Frame of Mind,1993-02-16,The Next Generation,247.txt
114,DOCTOR,   I'm Doctor Syrus.       Do you remember anything about   where you are now?,19   INT. ASYLUM CELL - CONTINUOUS,ASYLUM CEL,INT.,Frame of Mind,1993-02-16,The Next Generation,247.txt
115,RIKER,   I hurt my head... somebody hit   me...,19   INT. ASYLUM CELL - CONTINUOUS,ASYLUM CEL,INT.,Frame of Mind,1993-02-16,The Next Generation,247.txt
116,DOCTOR,   You tried to escape. You   struggled with one of the   attendants and hit your head on a   door. Do you remember that?,19   INT. ASYLUM CELL - CONTINUOUS,ASYLUM CEL,INT.,Frame of Mind,1993-02-16,The Next Generation,247.txt
117,RIKER,"   Yes... now I do. But at first, I   thought a Klingon cut me... with   a knife...",19   INT. ASYLUM CELL - CONTINUOUS,ASYLUM CEL,INT.,Frame of Mind,1993-02-16,The Next Generation,247.txt
118,DOCTOR,   It's called transposition. You're   projecting elements from your   delusions onto events that really   happened.       But that's good. There was a time   when you couldn't break away from   your Starship fantasy at all.,19   INT. ASYLUM CELL - CONTINUOUS,ASYLUM CEL,INT.,Frame of Mind,1993-02-16,The Next Generation,247.txt
119,RIKER,   If what you're saying is true...   where am I?,19   INT. ASYLUM CELL - CONTINUOUS,ASYLUM CEL,INT.,Frame of Mind,1993-02-16,The Next Generation,247.txt
120,DOCTOR,   You're in Ward Forty-seven of the   Tilonus Institute for Mental   Disorders.,19   INT. ASYLUM CELL - CONTINUOUS,ASYLUM CEL,INT.,Frame of Mind,1993-02-16,The Next Generation,247.txt
121,RIKER,   Why am I here?,19   INT. ASYLUM CELL - CONTINUOUS,ASYLUM CEL,INT.,Frame of Mind,1993-02-16,The Next Generation,247.txt
122,DOCTOR,   We'll talk more later. You don't   have to remember everything today.       You're making excellent progress.,19   INT. ASYLUM CELL - CONTINUOUS,ASYLUM CEL,INT.,Frame of Mind,1993-02-16,The Next Generation,247.txt
123,RIKER,   Wait...,19   INT. ASYLUM CELL - CONTINUOUS,ASYLUM CEL,INT.,Frame of Mind,1993-02-16,The Next Generation,247.txt
124,ATTENDANT,   Good afternoon. I've got some   good news for you.       Doctor Syrus suggested that you   might enjoy a couple of hours in   the Common Area today.,19   INT. ASYLUM CELL - CONTINUOUS,ASYLUM CEL,INT.,Frame of Mind,1993-02-16,The Next Generation,247.txt
125,ATTENDANT,       Well?,19   INT. ASYLUM CELL - CONTINUOUS,ASYLUM CEL,INT.,Frame of Mind,1993-02-16,The Next Generation,247.txt
126,RIKER,       I guess so...,19   INT. ASYLUM CELL - CONTINUOUS,ASYLUM CEL,INT.,Frame of Mind,1993-02-16,The Next Generation,247.txt
127,ATTENDANT,   I hope you're hungry. They're   serving spiny lobe-fish today.,19   INT. ASYLUM CELL - CONTINUOUS,ASYLUM CEL,INT.,Frame of Mind,1993-02-16,The Next Generation,247.txt
128,RIKER,       There's no need for this.,19   INT. ASYLUM CELL - CONTINUOUS,ASYLUM CEL,INT.,Frame of Mind,1993-02-16,The Next Generation,247.txt
129,ATTENDANT,   That's what you said the last   time.,19   INT. ASYLUM CELL - CONTINUOUS,ASYLUM CEL,INT.,Frame of Mind,1993-02-16,The Next Generation,247.txt
130,ATTENDANT,       I'll be back with your lunch.,23   INT. ASYLUM - COMMON AREA,ASYLU,INT.,Frame of Mind,1993-02-16,The Next Generation,247.txt
131,INMATE,   I hear you're a Starfleet   officer...,23   INT. ASYLUM - COMMON AREA,ASYLU,INT.,Frame of Mind,1993-02-16,The Next Generation,247.txt
132,INMATE,       I'm Commander Bloom from the   Yorktown...       There are at least a dozen of us   here... maybe more...     ,23   INT. ASYLUM - COMMON AREA,ASYLU,INT.,Frame of Mind,1993-02-16,The Next Generation,247.txt
133,INMATE ,   We were kidnapped... brought here   against our will...,23   INT. ASYLUM - COMMON AREA,ASYLU,INT.,Frame of Mind,1993-02-16,The Next Generation,247.txt
134,INMATE,       Sanders was on the Yosemite. They   did something to his mind. I   think they're trying to get neuro   chemicals from our brains...       Stafko was with me on the   Yorktown. I don't know what they   did to him...,23   INT. ASYLUM - COMMON AREA,ASYLU,INT.,Frame of Mind,1993-02-16,The Next Generation,247.txt
135,INMATE,       We're going to get out of here.   I've made a communicator...,23   INT. ASYLUM - COMMON AREA,ASYLU,INT.,Frame of Mind,1993-02-16,The Next Generation,247.txt
136,RIKER,       You have?,23   INT. ASYLUM - COMMON AREA,ASYLU,INT.,Frame of Mind,1993-02-16,The Next Generation,247.txt
