,character,quote,scene,location,view,episode,date,series,file
294,PICARD,       Listen to that... he sounds   angry... aggressive...       What does Worf want... is he   responding to some sort of   predatory instinct? Does he see   us as prey?,51   INT. SICKBAY,SICKBAY,INT.,Genesis,1994-01-07,The Next Generation,271.txt
295,DATA,"   There are crewmembers in the   corridors and other sections of   the ship. It would be much easier   for him to capture and consume one   of them, rather than attempt to   break through a door.",51   INT. SICKBAY,SICKBAY,INT.,Genesis,1994-01-07,The Next Generation,271.txt
296,PICARD,   Then... what does he want?     ,51   INT. SICKBAY,SICKBAY,INT.,Genesis,1994-01-07,The Next Generation,271.txt
297,PICARD ,       Predators use vocalizations to   frighten off other predators... to   mark territory... and to initiate   the mating process...       The mating process...,51   INT. SICKBAY,SICKBAY,INT.,Genesis,1994-01-07,The Next Generation,271.txt
298,PICARD,       Counselor Troi has been bitten by   a Klingon... but it's not in a   life-threatening location...   nowhere near a major artery or   organ...,51   INT. SICKBAY,SICKBAY,INT.,Genesis,1994-01-07,The Next Generation,271.txt
299,PICARD,"       And look at the wound itself...   the penetration of the bite is   very shallow, as if he didn't   intend to seriously injure her...",51   INT. SICKBAY,SICKBAY,INT.,Genesis,1994-01-07,The Next Generation,271.txt
300,DATA,"   What are you suggesting, Captain?",51   INT. SICKBAY,SICKBAY,INT.,Genesis,1994-01-07,The Next Generation,271.txt
301,PICARD,   Is it possible that Worf thinks of   Troi as his mate?,51   INT. SICKBAY,SICKBAY,INT.,Genesis,1994-01-07,The Next Generation,271.txt
302,DATA,"   If that is true, then he must now   by trying to reach her.",51   INT. SICKBAY,SICKBAY,INT.,Genesis,1994-01-07,The Next Generation,271.txt
303,PICARD,"   We... we can't just leave. We've   got to stay here and protect   her... and keep working on the   retro-virus...       If we can't stun him, then we'll   have to distract him somehow...   lure him away from Deanna...",51   INT. SICKBAY,SICKBAY,INT.,Genesis,1994-01-07,The Next Generation,271.txt
304,DATA,   The mating instinct is quite   strong in Klingon biology. I am   not certain what would serve as an   effective lure.,51   INT. SICKBAY,SICKBAY,INT.,Genesis,1994-01-07,The Next Generation,271.txt
305,PICARD,"   Klingons have a highly developed   sense of smell... if we could   duplicate Deanna's pheromones, we   might be able to convince him she   has left Sickbay... and is   somewhere else on the ship...",51   INT. SICKBAY,SICKBAY,INT.,Genesis,1994-01-07,The Next Generation,271.txt
306,DATA,"       I am extracting a blood sample   from one of her sebaceous glands,   where pheromones are produced.",51   INT. SICKBAY,SICKBAY,INT.,Genesis,1994-01-07,The Next Generation,271.txt
307,DATA,       I believe I can activate the   pheromones with a bio-activant   solution.,51   INT. SICKBAY,SICKBAY,INT.,Genesis,1994-01-07,The Next Generation,271.txt
308,PICARD,   Can you amplify the pheromones?   They'll have to be far more   powerful than Deanna's actual   scent.,51   INT. SICKBAY,SICKBAY,INT.,Genesis,1994-01-07,The Next Generation,271.txt
309,DATA,   I believe this will produce the   desired effect.       I will use it to draw Worf to a   different part of the ship.,51   INT. SICKBAY,SICKBAY,INT.,Genesis,1994-01-07,The Next Generation,271.txt
310,PICARD,   No... you... you must stay here...   continue working on the retro-virus...,51   INT. SICKBAY,SICKBAY,INT.,Genesis,1994-01-07,The Next Generation,271.txt
311,PICARD,       I'll go...,51   INT. SICKBAY,SICKBAY,INT.,Genesis,1994-01-07,The Next Generation,271.txt
312,DATA,"   Captain, that would be extremely   unwise. Worf may be much faster   than --",51   INT. SICKBAY,SICKBAY,INT.,Genesis,1994-01-07,The Next Generation,271.txt
313,PICARD,       No time... no time to argue.,51   INT. SICKBAY,SICKBAY,INT.,Genesis,1994-01-07,The Next Generation,271.txt
314,DATA,       Computer -- activate medical   database.,55   INT. SICKBAY,SICKBAY,INT.,Genesis,1994-01-07,The Next Generation,271.txt
315,COMPUTER,   Main computer systems are inactive --   unable to comply.,55   INT. SICKBAY,SICKBAY,INT.,Genesis,1994-01-07,The Next Generation,271.txt
316,DATA,"   Computer, bypass database system --   activate local subprocessors only.",55   INT. SICKBAY,SICKBAY,INT.,Genesis,1994-01-07,The Next Generation,271.txt
317,COMPUTER,   Acknowledged.,55   INT. SICKBAY,SICKBAY,INT.,Genesis,1994-01-07,The Next Generation,271.txt
318,PICARD,       Deck Seventeen.,61   INT. TURBOLIFT - CONTINUOUS,TURBOLIFT,INT.,Genesis,1994-01-07,The Next Generation,271.txt
319,DATA,"       Computer, display progress of   genetic re-sequencing.",62   INT. SICKBAY (OPTICAL),SICKBAY,INT.,Genesis,1994-01-07,The Next Generation,271.txt
320,COMPUTER,   Genetic re-sequencing in progress --   DNA to seventy percent normal.,67   INT. SICKBAY (OPTICAL),SICKBAY,INT.,Genesis,1994-01-07,The Next Generation,271.txt
321,DATA,"   Computer, increase nucleotide   substitution by thirty-two   percent.",67   INT. SICKBAY (OPTICAL),SICKBAY,INT.,Genesis,1994-01-07,The Next Generation,271.txt
322,DATA,       Data to Captain Picard.,71   INT. SICKBAY,SICKBAY,INT.,Genesis,1994-01-07,The Next Generation,271.txt
323,PICARD,   Go ahead.,71   INT. SICKBAY,SICKBAY,INT.,Genesis,1994-01-07,The Next Generation,271.txt
324,DATA,"   The retro-virus is working. I can   release it into the ship's   atmosphere in a gaseous state, but   it will take some time to take   effect.",71   INT. SICKBAY,SICKBAY,INT.,Genesis,1994-01-07,The Next Generation,271.txt
325,PICARD,       Acknowledged.,72   INT. JEFFERIES TUBE,JEFFERIES TUBE,INT.,Genesis,1994-01-07,The Next Generation,271.txt
326,DATA,"   Are you all right, sir?",72   INT. JEFFERIES TUBE,JEFFERIES TUBE,INT.,Genesis,1994-01-07,The Next Generation,271.txt
327,PICARD,"   I'm fine, Mister Data. Proceed...",72   INT. JEFFERIES TUBE,JEFFERIES TUBE,INT.,Genesis,1994-01-07,The Next Generation,271.txt
328,PICARD,"       Well, Mister Worf... let's hope   you wake up feeling like a new   man.",72   INT. JEFFERIES TUBE,JEFFERIES TUBE,INT.,Genesis,1994-01-07,The Next Generation,271.txt
329,PICARD ,"   Captain's log, supplemental.   Commander Data has succeeded in   returning the crew to normal.   Doctor Crusher has determined that   the synthetic T-cell she used to   cure Mister Barclay's Urodelan flu   initiated the intron virus which   swept through the ship.",73   EXT. SPACE - THE ENTERPRISE,SPACE,EXT.,Genesis,1994-01-07,The Next Generation,271.txt
330,BARCLAY,   So... this was my fault...,74   INT. SICKBAY,SICKBAY,INT.,Genesis,1994-01-07,The Next Generation,271.txt
331,BEVERLY,"   No... in a way, it was mine. I   didn't realize it at the time, but   there's an anomaly in your genetic   chemistry that caused the   synthetic T-cell to mutate...       Instead of just activating one   dormant gene, it started to   activate all of them -- including   your introns.",74   INT. SICKBAY,SICKBAY,INT.,Genesis,1994-01-07,The Next Generation,271.txt
332,BARCLAY,   And that... that caused me to devolve...,74   INT. SICKBAY,SICKBAY,INT.,Genesis,1994-01-07,The Next Generation,271.txt
333,BEVERLY,       Along with every other member of   the crew. The T-cell became   airborne and started to spread   like a virus...,74   INT. SICKBAY,SICKBAY,INT.,Genesis,1994-01-07,The Next Generation,271.txt
334,BEVERLY,"   You know, Reg... this is a   completely new disease. And it's   traditional to classify a new   disease with the name of the first   diagnosed patient...",74   INT. SICKBAY,SICKBAY,INT.,Genesis,1994-01-07,The Next Generation,271.txt
335,BARCLAY,   You mean... you want to name the   disease... after me?,74   INT. SICKBAY,SICKBAY,INT.,Genesis,1994-01-07,The Next Generation,271.txt
336,BEVERLY,"   That's right. How about...   ""Barclay's Proto-morphosis   Syndrome""?",74   INT. SICKBAY,SICKBAY,INT.,Genesis,1994-01-07,The Next Generation,271.txt
337,BARCLAY,"   ""Barclay's Proto-morphosis""...   it... it has a nice ring to it...       Thank you, Doctor...",74   INT. SICKBAY,SICKBAY,INT.,Genesis,1994-01-07,The Next Generation,271.txt
338,TROI,       He transformed into a spider...   and now he's had a disease named   after him...       I think I'd better clear my   calendar for the next few weeks.,74   INT. SICKBAY,SICKBAY,INT.,Genesis,1994-01-07,The Next Generation,271.txt
