,character,quote,scene,location,view,episode,date,series
0,QUARK  ,   I thought I told you to cancel that    order.  Now what am I supposed to do    with five thousand wrappages of    Cardassian yamok sauce.  They were    the only ones who could stomach that    swill!,1    INT. QUARK'S,QUARK'S,INT.,,1993-02-16,Deep Space Nine
1,JAKE,"   Hey, are you gonna play, or what?",1    INT. QUARK'S,QUARK'S,INT.,,1993-02-16,Deep Space Nine
2,QUARK,"   You ordered it, you're going    to pay for it!  I'll take half of    your paycheck every week for the    next... six years!    (turns to face him     squarely)   And from now on, no more Cardassian    food in here!  Ever!",1    INT. QUARK'S,QUARK'S,INT.,,1993-02-16,Deep Space Nine
3,JAKE,"       C'mon, Nog, it's your turn.",1    INT. QUARK'S,QUARK'S,INT.,,1993-02-16,Deep Space Nine
4,NOG,       ... five thousand wrappages... that's    a lot of yamok sauce...,1    INT. QUARK'S,QUARK'S,INT.,,1993-02-16,Deep Space Nine
5,JAKE,"   Look, either take your turn, or I    win.",1    INT. QUARK'S,QUARK'S,INT.,,1993-02-16,Deep Space Nine
6,NOG,   ... it'd be a shame for it to go to    waste...,1    INT. QUARK'S,QUARK'S,INT.,,1993-02-16,Deep Space Nine
7,JAKE,    (tosses in cards;     disgusted)   That's it; game's over.,1    INT. QUARK'S,QUARK'S,INT.,,1993-02-16,Deep Space Nine
8,NOG,"   Jake, I'm getting that... tingle in    the lobes.  And when a lobe tingles,    it means only one thing:    ""Opportunity.""",1    INT. QUARK'S,QUARK'S,INT.,,1993-02-16,Deep Space Nine
9,JAKE,       What're you talking about?,1    INT. QUARK'S,QUARK'S,INT.,,1993-02-16,Deep Space Nine
10,NOG,"   I'm talking about gold-pressed    latinum... maybe four, or five bars...",1    INT. QUARK'S,QUARK'S,INT.,,1993-02-16,Deep Space Nine
11,JAKE,   I thought you were talking about    yamok sauce.,1    INT. QUARK'S,QUARK'S,INT.,,1993-02-16,Deep Space Nine
12,NOG,   You've got a lot to learn about    opportunity.       Come on.,1    INT. QUARK'S,QUARK'S,INT.,,1993-02-16,Deep Space Nine
13,JAKE,       Where?,1    INT. QUARK'S,QUARK'S,INT.,,1993-02-16,Deep Space Nine
14,SISKO ,"   Station log.  Stardate xxxx.xx.     With the help of the Federation,    Bajor is about to commence its first    large-scale energy transfer: The    tapping of the molten core of its    fifth moon, Jeraddo.",3    EXT. SPACE - DEEP SPACE NINE (OPTICAL) (STOCK),SPACE - DEEP SPACE NINE,EXT.,,1993-02-16,Deep Space Nine
15,DAX,   Magma pressures remain constant...,4    INT. OPS,OPS,INT.,,1993-02-16,Deep Space Nine
16,O'BRIEN,   Differential subsurface movement is    at zero-point-three percent.,4    INT. OPS,OPS,INT.,,1993-02-16,Deep Space Nine
17,TORAN,   Is that good?,4    INT. OPS,OPS,INT.,,1993-02-16,Deep Space Nine
18,KIRA,       They'd tell you if it weren't.,4    INT. OPS,OPS,INT.,,1993-02-16,Deep Space Nine
19,TORAN,   Why is that red light blinking?,4    INT. OPS,OPS,INT.,,1993-02-16,Deep Space Nine
20,O'BRIEN,   We're in normal standby mode.,4    INT. OPS,OPS,INT.,,1993-02-16,Deep Space Nine
21,TORAN,"   I take it, then, that we're not    expecting any surprises.",4    INT. OPS,OPS,INT.,,1993-02-16,Deep Space Nine
22,SISKO,   We don't like surprises any more    than you do.,4    INT. OPS,OPS,INT.,,1993-02-16,Deep Space Nine
23,KIRA,"   Minister Toran, these people are    professionals.",4    INT. OPS,OPS,INT.,,1993-02-16,Deep Space Nine
24,TORAN,"   Forgive my bureaucratic nitpicking,    Major, but we're counting on Jeraddo's    energy to heat a few hundred thousand    Bajoran homes this winter.",4    INT. OPS,OPS,INT.,,1993-02-16,Deep Space Nine
25,KIRA,"   With that in mind, we're due to make    our next inspection...",4    INT. OPS,OPS,INT.,,1993-02-16,Deep Space Nine
26,DAX,"   Anyway, so there I was, sitting in    Quark's, when Morn just comes over    and invites me for dinner... Grid    square twelve-delta reads clear of    life forms...",10   INT. RUNABOUT,RUNABOUT,INT.,,1993-02-16,Deep Space Nine
27,KIRA,   Morn?  Are you serious?,10   INT. RUNABOUT,RUNABOUT,INT.,,1993-02-16,Deep Space Nine
28,DAX,       Beginning scan of grid square fifteen    delta...,10   INT. RUNABOUT,RUNABOUT,INT.,,1993-02-16,Deep Space Nine
29,KIRA,   So what did you say?,10   INT. RUNABOUT,RUNABOUT,INT.,,1993-02-16,Deep Space Nine
30,DAX,   I told him I was busy.,10   INT. RUNABOUT,RUNABOUT,INT.,,1993-02-16,Deep Space Nine
31,KIRA,   Good.,10   INT. RUNABOUT,RUNABOUT,INT.,,1993-02-16,Deep Space Nine
32,DAX,   But you know those seven or eight    little wiry hairs sticking out of    his forehead?,10   INT. RUNABOUT,RUNABOUT,INT.,,1993-02-16,Deep Space Nine
33,KIRA,       What... ?,10   INT. RUNABOUT,RUNABOUT,INT.,,1993-02-16,Deep Space Nine
34,DAX,   They make him look kind of cute.,10   INT. RUNABOUT,RUNABOUT,INT.,,1993-02-16,Deep Space Nine
35,DAX,       That's odd... Sensors read a humanoid    presence in fifteen delta.  Could be    one of the project thermologists.,10   INT. RUNABOUT,RUNABOUT,INT.,,1993-02-16,Deep Space Nine
36,KIRA,   Not in fifteen delta.,10   INT. RUNABOUT,RUNABOUT,INT.,,1993-02-16,Deep Space Nine
37,DAX,   See for yourself.,10   INT. RUNABOUT,RUNABOUT,INT.,,1993-02-16,Deep Space Nine
38,KIRA,       All the inhabitants should've been    evacuated by now.       I'd better beam down there and see    what's going on.,10   INT. RUNABOUT,RUNABOUT,INT.,,1993-02-16,Deep Space Nine
39,DAX,   Ready to transport.,10   INT. RUNABOUT,RUNABOUT,INT.,,1993-02-16,Deep Space Nine
40,KIRA,   I won't be long.,10   INT. RUNABOUT,RUNABOUT,INT.,,1993-02-16,Deep Space Nine
41,MULLIBOK  ,"   The problem is, they don't like    uniforms.",15   EXT. OUTSIDE COTTAGE - DAY (CONTINUING),OUTSIDE COTTAGE - DAY,EXT.,,1993-02-16,Deep Space Nine
42,KIRA,"   Neither do I, but it comes with the    job.",15   EXT. OUTSIDE COTTAGE - DAY (CONTINUING),OUTSIDE COTTAGE - DAY,EXT.,,1993-02-16,Deep Space Nine
43,MULLIBOK,   Which is?,15   EXT. OUTSIDE COTTAGE - DAY (CONTINUING),OUTSIDE COTTAGE - DAY,EXT.,,1993-02-16,Deep Space Nine
44,KIRA,"   Do we talk, or do they attack?",15   EXT. OUTSIDE COTTAGE - DAY (CONTINUING),OUTSIDE COTTAGE - DAY,EXT.,,1993-02-16,Deep Space Nine
45,MULLIBOK,   You're halfway pretty.,15   EXT. OUTSIDE COTTAGE - DAY (CONTINUING),OUTSIDE COTTAGE - DAY,EXT.,,1993-02-16,Deep Space Nine
46,KIRA,   Does that mean I can come in?,15   EXT. OUTSIDE COTTAGE - DAY (CONTINUING),OUTSIDE COTTAGE - DAY,EXT.,,1993-02-16,Deep Space Nine
47,MULLIBOK,"   Problem is, I don't like uniforms,    either.  They scare me.       We've had our fill of uniformed    bullies.",15   EXT. OUTSIDE COTTAGE - DAY (CONTINUING),OUTSIDE COTTAGE - DAY,EXT.,,1993-02-16,Deep Space Nine
48,KIRA,   I'm no Cardassian.  You know you're    supposed to be out of here by now.,15   EXT. OUTSIDE COTTAGE - DAY (CONTINUING),OUTSIDE COTTAGE - DAY,EXT.,,1993-02-16,Deep Space Nine
49,MULLIBOK,"   All I know is this farm.  If you    want proof, girl, just take a look    at my crop.",15   EXT. OUTSIDE COTTAGE - DAY (CONTINUING),OUTSIDE COTTAGE - DAY,EXT.,,1993-02-16,Deep Space Nine
50,KIRA,"       I'd rather you didn't call me ""girl.""",15   EXT. OUTSIDE COTTAGE - DAY (CONTINUING),OUTSIDE COTTAGE - DAY,EXT.,,1993-02-16,Deep Space Nine
51,MULLIBOK,"       ... Our crop, I should say.  Mostly    the katterpod beans.  You won't find    better katterpods.",15   EXT. OUTSIDE COTTAGE - DAY (CONTINUING),OUTSIDE COTTAGE - DAY,EXT.,,1993-02-16,Deep Space Nine
52,KIRA,   My father always said you get bigger    katterpods when you spray in some    chlorobicrobes.,15   EXT. OUTSIDE COTTAGE - DAY (CONTINUING),OUTSIDE COTTAGE - DAY,EXT.,,1993-02-16,Deep Space Nine
53,MULLIBOK,"   Is that right.  That could be.       So your family's farmers, then.",15   EXT. OUTSIDE COTTAGE - DAY (CONTINUING),OUTSIDE COTTAGE - DAY,EXT.,,1993-02-16,Deep Space Nine
54,KIRA,"   No... but if I don't get on your    good side soon, my arm's going to    fall off.",15   EXT. OUTSIDE COTTAGE - DAY (CONTINUING),OUTSIDE COTTAGE - DAY,EXT.,,1993-02-16,Deep Space Nine
55,MULLIBOK,       Pretty eyes like yours deserve a    meal.  Come on in.,15   EXT. OUTSIDE COTTAGE - DAY (CONTINUING),OUTSIDE COTTAGE - DAY,EXT.,,1993-02-16,Deep Space Nine
56,KIRA,"   I'm afraid we don't have the time.     Obviously, you were overlooked in    the general evacuation; I've got to    get you out of here.",15   EXT. OUTSIDE COTTAGE - DAY (CONTINUING),OUTSIDE COTTAGE - DAY,EXT.,,1993-02-16,Deep Space Nine
57,MULLIBOK,   We'll talk about that over supper.,15   EXT. OUTSIDE COTTAGE - DAY (CONTINUING),OUTSIDE COTTAGE - DAY,EXT.,,1993-02-16,Deep Space Nine
58,NOG,"   Excuse me, Sir... Are you the captain    of the Lissepian cargo ship?",21   INT. PROMENADE,PROMENADE,INT.,,1993-02-16,Deep Space Nine
59,CAPTAIN,   That's right.,21   INT. PROMENADE,PROMENADE,INT.,,1993-02-16,Deep Space Nine
60,NOG,   And you do a lot of trading with the    Cardassians?,21   INT. PROMENADE,PROMENADE,INT.,,1993-02-16,Deep Space Nine
61,CAPTAIN,   Why not... one thing about    Cardassians; they pay their bills.,21   INT. PROMENADE,PROMENADE,INT.,,1993-02-16,Deep Space Nine
62,NOG,"   Yes, I've heard that... And I've    also heard they really love their    yamok sauce.",21   INT. PROMENADE,PROMENADE,INT.,,1993-02-16,Deep Space Nine
63,CAPTAIN,"   Look, if you're trying to buy some    yamok sauce from me, boy, you're    wasting your time.  I'm not carrying    any.",21   INT. PROMENADE,PROMENADE,INT.,,1993-02-16,Deep Space Nine
64,NOG,   We're not buying... we're selling.,21   INT. PROMENADE,PROMENADE,INT.,,1993-02-16,Deep Space Nine
65,JAKE,   Five thousand wrappages of it.,21   INT. PROMENADE,PROMENADE,INT.,,1993-02-16,Deep Space Nine
66,CAPTAIN,       Where would you two boys get all    that yamok sauce?,21   INT. PROMENADE,PROMENADE,INT.,,1993-02-16,Deep Space Nine
67,NOG,   We have connections.,21   INT. PROMENADE,PROMENADE,INT.,,1993-02-16,Deep Space Nine
68,CAPTAIN,"       ... five thousand, you say.",21   INT. PROMENADE,PROMENADE,INT.,,1993-02-16,Deep Space Nine
69,NOG,   And they can be yours for... say...    five bars of gold-pressed latinum.,21   INT. PROMENADE,PROMENADE,INT.,,1993-02-16,Deep Space Nine
70,CAPTAIN,   That's a lot of latinum.,21   INT. PROMENADE,PROMENADE,INT.,,1993-02-16,Deep Space Nine
71,NOG,   That's a lot of yamok sauce.,21   INT. PROMENADE,PROMENADE,INT.,,1993-02-16,Deep Space Nine
72,CAPTAIN,"   Look, I'm not carrying any latinum.     But I'll tell you what I'll do: I'll    trade you something for it.",21   INT. PROMENADE,PROMENADE,INT.,,1993-02-16,Deep Space Nine
73,NOG,       We were kind of counting on latinum...,21   INT. PROMENADE,PROMENADE,INT.,,1993-02-16,Deep Space Nine
74,JAKE,   Hold on.       What would you trade?,21   INT. PROMENADE,PROMENADE,INT.,,1993-02-16,Deep Space Nine
75,CAPTAIN,"   I'll give you a hundred gross of    self-sealing stem bolts.  Some Bajoran    ordered them from me, and now he    can't pay.",21   INT. PROMENADE,PROMENADE,INT.,,1993-02-16,Deep Space Nine
76,JAKE,       Self-sealing stem bolts?,21   INT. PROMENADE,PROMENADE,INT.,,1993-02-16,Deep Space Nine
77,CAPTAIN,   Top grade merchandise; you won't    find a better stem bolt in this    sector.,21   INT. PROMENADE,PROMENADE,INT.,,1993-02-16,Deep Space Nine
78,NOG,   I don't think so.  We deal strictly    in latinum.,21   INT. PROMENADE,PROMENADE,INT.,,1993-02-16,Deep Space Nine
79,JAKE,"       Nog, are you sure?",21   INT. PROMENADE,PROMENADE,INT.,,1993-02-16,Deep Space Nine
80,NOG,   What're we going to do with stem    bolts?,21   INT. PROMENADE,PROMENADE,INT.,,1993-02-16,Deep Space Nine
81,JAKE,   What're we going to do with yamok    sauce?,21   INT. PROMENADE,PROMENADE,INT.,,1993-02-16,Deep Space Nine
82,NOG,"   Sir, I've discussed it with my    partner, and you have a deal.",21   INT. PROMENADE,PROMENADE,INT.,,1993-02-16,Deep Space Nine
83,CAPTAIN,   Good.  I'll meet you at cargo bay    nine at twenty-one hundred hours.     We'll make the trade then.,21   INT. PROMENADE,PROMENADE,INT.,,1993-02-16,Deep Space Nine
84,NOG,"   Now the question is, what do we do    with a hundred gross of self-sealing    stem bolts.",21   INT. PROMENADE,PROMENADE,INT.,,1993-02-16,Deep Space Nine
85,JAKE,   I've got a better question.  How do    we get your uncle's yamok sauce?,21   INT. PROMENADE,PROMENADE,INT.,,1993-02-16,Deep Space Nine
86,MULLIBOK,   At least you're not the type that'd    dispossess a man on an empty stomach.,26   INT. COTTAGE - DAY,COTTAGE,INT.,,1993-02-16,Deep Space Nine
87,KIRA,   I wouldn't think of it.,26   INT. COTTAGE - DAY,COTTAGE,INT.,,1993-02-16,Deep Space Nine
88,MULLIBOK,"   That's fine.  Of course, these roots    take about three hours to soften.",26   INT. COTTAGE - DAY,COTTAGE,INT.,,1993-02-16,Deep Space Nine
89,KIRA,   What?,26   INT. COTTAGE - DAY,COTTAGE,INT.,,1993-02-16,Deep Space Nine
90,MULLIBOK,   Surely you don't eat your roots hard.,26   INT. COTTAGE - DAY,COTTAGE,INT.,,1993-02-16,Deep Space Nine
91,KIRA,       I'm in no hurry.       Kira to Ganges.,26   INT. COTTAGE - DAY,COTTAGE,INT.,,1993-02-16,Deep Space Nine
92,DAX,   This is Dax.  Are you all right?,26   INT. COTTAGE - DAY,COTTAGE,INT.,,1993-02-16,Deep Space Nine
93,KIRA,   A man with a talent for delay just    invited me to a farewell supper here.     You go on.  I'll have one of the    thermologists bring me back.,26   INT. COTTAGE - DAY,COTTAGE,INT.,,1993-02-16,Deep Space Nine
94,DAX,   Enjoy supper; Dax out.,26   INT. COTTAGE - DAY,COTTAGE,INT.,,1993-02-16,Deep Space Nine
95,MULLIBOK,"   After you wash it, scrub off the    skin.",26   INT. COTTAGE - DAY,COTTAGE,INT.,,1993-02-16,Deep Space Nine
96,KIRA,"       You don't talk much, do you?",26   INT. COTTAGE - DAY,COTTAGE,INT.,,1993-02-16,Deep Space Nine
97,MULLIBOK,"   They don't talk at all.  Cardassians    took care of that.  They escaped to    this moon about eighteen years ago.     I've been here forty.  We've done    well together.       Be a good girl, and set out the plates    and utensils, please.",26   INT. COTTAGE - DAY,COTTAGE,INT.,,1993-02-16,Deep Space Nine
98,MULLIBOK,   In that cupboard on the other side    there.,26   INT. COTTAGE - DAY,COTTAGE,INT.,,1993-02-16,Deep Space Nine
99,MULLIBOK,"       Y'know, dear, you look good even    from this angle; but you walk like a    carnivorous rastipod.",26   INT. COTTAGE - DAY,COTTAGE,INT.,,1993-02-16,Deep Space Nine
100,KIRA,    (wheels around; losing     it)   Now look!...,26   INT. COTTAGE - DAY,COTTAGE,INT.,,1993-02-16,Deep Space Nine
101,KIRA,   You're trying to make me mad.,26   INT. COTTAGE - DAY,COTTAGE,INT.,,1993-02-16,Deep Space Nine
102,MULLIBOK,       How'm I doing?,26   INT. COTTAGE - DAY,COTTAGE,INT.,,1993-02-16,Deep Space Nine
103,KIRA,   Not well enough to get rid of me.,26   INT. COTTAGE - DAY,COTTAGE,INT.,,1993-02-16,Deep Space Nine
104,MULLIBOK,       Damn.,26   INT. COTTAGE - DAY,COTTAGE,INT.,,1993-02-16,Deep Space Nine
105,MULLIBOK,"   So what do they call you, dear?",26   INT. COTTAGE - DAY,COTTAGE,INT.,,1993-02-16,Deep Space Nine
106,KIRA,       I'm Major Kira; I'm in charge of    evacuating all the...,26   INT. COTTAGE - DAY,COTTAGE,INT.,,1993-02-16,Deep Space Nine
107,MULLIBOK,       You're given name.,26   INT. COTTAGE - DAY,COTTAGE,INT.,,1993-02-16,Deep Space Nine
108,KIRA,       Nerys.,26   INT. COTTAGE - DAY,COTTAGE,INT.,,1993-02-16,Deep Space Nine
109,MULLIBOK,"   Well, Nerys, I'm Mullibok, and this    root really does take three hours to    cook, so... You sit yourself down    and relax, child, it'll be tasty.",26   INT. COTTAGE - DAY,COTTAGE,INT.,,1993-02-16,Deep Space Nine
110,KIRA,"   Mullibok, they begin tapping the    core of this moon in seven days.",26   INT. COTTAGE - DAY,COTTAGE,INT.,,1993-02-16,Deep Space Nine
111,MULLIBOK,       I know.,26   INT. COTTAGE - DAY,COTTAGE,INT.,,1993-02-16,Deep Space Nine
112,KIRA,   With respect... you are only three    people.  This project will benefit    thousands... hundreds of thousands.,26   INT. COTTAGE - DAY,COTTAGE,INT.,,1993-02-16,Deep Space Nine
113,MULLIBOK,   I made myself unconcerned with all    of that forty years ago when I ran    away from a Cardassian labor camp on    your precious Bajor.,26   INT. COTTAGE - DAY,COTTAGE,INT.,,1993-02-16,Deep Space Nine
114,KIRA,"   What we're trying to create now is    what you weren't allowed to have    then.  It can be your Bajor, too.",26   INT. COTTAGE - DAY,COTTAGE,INT.,,1993-02-16,Deep Space Nine
115,MULLIBOK,   This is where I live.  This is my    home.,26   INT. COTTAGE - DAY,COTTAGE,INT.,,1993-02-16,Deep Space Nine
116,KIRA,"   You'll have a home on Bajor... and    people who'll welcome you and your    friends.  Life'll be different, yes.     But it'll be fine... really.",26   INT. COTTAGE - DAY,COTTAGE,INT.,,1993-02-16,Deep Space Nine
117,MULLIBOK,   No it won't.  I told you; my life is    here.  I'll die if I leave.       I'd rather die here.,26   INT. COTTAGE - DAY,COTTAGE,INT.,,1993-02-16,Deep Space Nine
118,NOG,   Uncle Quark...,28   INT. QUARK'S,QUARK'S,INT.,,1993-02-16,Deep Space Nine
119,QUARK,       Last night... that dabo player who    dropped his drink... I saw you run    and get him another one without    charging him.  I've warned you about    picking up your father's habits.,28   INT. QUARK'S,QUARK'S,INT.,,1993-02-16,Deep Space Nine
120,NOG,"   It'll never happen again, Uncle.       Y'know, I was trying to find some    storage space for the shipment of    lokar beans that're due in tomorrow.     Is it okay if I stack them on top of    the yamok sauce?       If I can reach that high.",28   INT. QUARK'S,QUARK'S,INT.,,1993-02-16,Deep Space Nine
121,QUARK,   Please!  Don't talk to me about yamok    sauce.,28   INT. QUARK'S,QUARK'S,INT.,,1993-02-16,Deep Space Nine
122,NOG,   Do you want me to get rid of it?  I    can take it to the matter reclamation    unit.,28   INT. QUARK'S,QUARK'S,INT.,,1993-02-16,Deep Space Nine
123,QUARK,"   Anything... Just get it out of my    sight.       You're a good boy, Nog.",28   INT. QUARK'S,QUARK'S,INT.,,1993-02-16,Deep Space Nine
124,MULLIBOK,"   I stowed away on a Cardassian survey    vessel.  They made stops all through    the Bajoran system, looking for    possible mining sites.  When they    got here to Jeraddo, I overpowered    the crew and stole what I'd need to    start building my life here.",30   INT. COTTAGE - NIGHT,COTTAGE,INT.,,1993-02-16,Deep Space Nine
125,KIRA,   You overpowered the crew... by    yourself?,30   INT. COTTAGE - NIGHT,COTTAGE,INT.,,1993-02-16,Deep Space Nine
126,MULLIBOK,"       There were only six of them...       ... which was fortunate, because I'd    been weakened a bit by captivity and    starvation.       Anyway, here I was; the first person    ever to settle on this moon.  Trouble    was, I had no farm implements.  Once    again, starvation and I stared each    other in the face.       I'm not boring you... ?",30   INT. COTTAGE - NIGHT,COTTAGE,INT.,,1993-02-16,Deep Space Nine
127,KIRA,"   No, no, I want to hear who won.",30   INT. COTTAGE - NIGHT,COTTAGE,INT.,,1993-02-16,Deep Space Nine
128,MULLIBOK,"       Well, it was mind over matter.  Every    twenty-six hours I just tightened my    waist-belt another notch, so my belly    could never really be sure it was    shrinking.",30   INT. COTTAGE - NIGHT,COTTAGE,INT.,,1993-02-16,Deep Space Nine
129,KIRA,       Excuse me... ?,30   INT. COTTAGE - NIGHT,COTTAGE,INT.,,1993-02-16,Deep Space Nine
130,MULLIBOK,"   Now you asked me how I got started    here, and I'm trying very politely    to tell you, if you'll kindly let me    finish.",30   INT. COTTAGE - NIGHT,COTTAGE,INT.,,1993-02-16,Deep Space Nine
131,KIRA,   I assume you found some food before    you ran out of belt notches.,30   INT. COTTAGE - NIGHT,COTTAGE,INT.,,1993-02-16,Deep Space Nine
132,MULLIBOK,   Are you telling this story or am I?,30   INT. COTTAGE - NIGHT,COTTAGE,INT.,,1993-02-16,Deep Space Nine
133,KIRA,       By all means...,30   INT. COTTAGE - NIGHT,COTTAGE,INT.,,1993-02-16,Deep Space Nine
134,MULLIBOK,"   Well, it was obvious I was going to    have to plant and harvest a crop.     So I did what anyone'd do who had an    entire world to build...",30   INT. COTTAGE - NIGHT,COTTAGE,INT.,,1993-02-16,Deep Space Nine
135,MULLIBOK,"   ... I rolled back and forth across    the ground til it surrendered.  Then    I went down on my hands and knees    and started to plow... Using my bare    fingernails, mind you... I plowed    every last furrow in that field    straight as a plumb line.",30   INT. COTTAGE - NIGHT,COTTAGE,INT.,,1993-02-16,Deep Space Nine
136,KIRA,   Now that's inventive.,30   INT. COTTAGE - NIGHT,COTTAGE,INT.,,1993-02-16,Deep Space Nine
137,MULLIBOK,"   And when I'd hit a patch of    mineralized clay, I'd just grind it    up in my teeth to enrich the soil.       Baltrim, let's taste a bit of your    wonderful wine here.",30   INT. COTTAGE - NIGHT,COTTAGE,INT.,,1993-02-16,Deep Space Nine
138,MULLIBOK,"       What I'm telling you, Major, is that    I tamed this place.  Me.",30   INT. COTTAGE - NIGHT,COTTAGE,INT.,,1993-02-16,Deep Space Nine
139,KIRA,       I believe you.,30   INT. COTTAGE - NIGHT,COTTAGE,INT.,,1993-02-16,Deep Space Nine
140,MULLIBOK,   You look like a bit of a fighter    yourself.,30   INT. COTTAGE - NIGHT,COTTAGE,INT.,,1993-02-16,Deep Space Nine
141,KIRA,"   On Bajor, we had to be.",30   INT. COTTAGE - NIGHT,COTTAGE,INT.,,1993-02-16,Deep Space Nine
142,MULLIBOK,   To get rid of the Cardassians.       Mindless butchers.,30   INT. COTTAGE - NIGHT,COTTAGE,INT.,,1993-02-16,Deep Space Nine
143,KIRA,   We paid them back.,30   INT. COTTAGE - NIGHT,COTTAGE,INT.,,1993-02-16,Deep Space Nine
144,MULLIBOK,       I bet you did... They probably never    knew what hit them.  I'm sorry I    missed the fun.,30   INT. COTTAGE - NIGHT,COTTAGE,INT.,,1993-02-16,Deep Space Nine
145,KIRA,   Fun?,30   INT. COTTAGE - NIGHT,COTTAGE,INT.,,1993-02-16,Deep Space Nine
146,MULLIBOK,   Like spearing kandippers in a bottle.,30   INT. COTTAGE - NIGHT,COTTAGE,INT.,,1993-02-16,Deep Space Nine
147,KIRA,       Wait a minute; are you serious?  You    know what the Cardassians were like;    the weapons they had.  We didn't    stand a chance against them.,30   INT. COTTAGE - NIGHT,COTTAGE,INT.,,1993-02-16,Deep Space Nine
148,MULLIBOK,"   Well then, how did you beat them?",30   INT. COTTAGE - NIGHT,COTTAGE,INT.,,1993-02-16,Deep Space Nine
149,KIRA,"   We beat them because...    (beat, she realizes     where he's taken her)   ... We hung on like fanatics.",30   INT. COTTAGE - NIGHT,COTTAGE,INT.,,1993-02-16,Deep Space Nine
150,MULLIBOK,       Hung on like fanatics.       I'll have to remember that.,30   INT. COTTAGE - NIGHT,COTTAGE,INT.,,1993-02-16,Deep Space Nine
151,KIRA,"   Listen to me, Mullibok...",31   EXT. OUTSIDE COTTAGE - NIGHT - FAVORING KILN AREA,OUTSIDE COTTAGE,EXT.,,1993-02-16,Deep Space Nine
152,MULLIBOK,"   You know, one of these days I've got    to finish this kiln... So I can temper    my baking pots... put colorful tops    on them.  That'd be nice, wouldn't    it?",31   EXT. OUTSIDE COTTAGE - NIGHT - FAVORING KILN AREA,OUTSIDE COTTAGE,EXT.,,1993-02-16,Deep Space Nine
153,KIRA,"   Look... I appreciate that you're    trying to hang on here... and I    sympathize... but you can't stay.     The minute they start tapping the    crust, it will release sulfer and    carbon compounds that will make the    air unbreathable.",31   EXT. OUTSIDE COTTAGE - NIGHT - FAVORING KILN AREA,OUTSIDE COTTAGE,EXT.,,1993-02-16,Deep Space Nine
154,MULLIBOK,"   The Cardassians probably told you    that you didn't stand a chance,    either.  Did you surrender?",31   EXT. OUTSIDE COTTAGE - NIGHT - FAVORING KILN AREA,OUTSIDE COTTAGE,EXT.,,1993-02-16,Deep Space Nine
155,KIRA,       No.,31   EXT. OUTSIDE COTTAGE - NIGHT - FAVORING KILN AREA,OUTSIDE COTTAGE,EXT.,,1993-02-16,Deep Space Nine
156,MULLIBOK,   Then why would you expect me to act    any different than you?       You tell them they can start cracking    this moon apart anytime they're ready.     I'll be here.,31   EXT. OUTSIDE COTTAGE - NIGHT - FAVORING KILN AREA,OUTSIDE COTTAGE,EXT.,,1993-02-16,Deep Space Nine
157,KIRA,       I'll tell them.,31   EXT. OUTSIDE COTTAGE - NIGHT - FAVORING KILN AREA,OUTSIDE COTTAGE,EXT.,,1993-02-16,Deep Space Nine
158,JAKE,   So that's a stem bolt.,34   INT. CARGO BAY,CARGO BAY,INT.,,1993-02-16,Deep Space Nine
159,NOG,   A self-sealing stem bolt.  There's a    difference.,34   INT. CARGO BAY,CARGO BAY,INT.,,1993-02-16,Deep Space Nine
160,JAKE,   You're sure about that... ?,34   INT. CARGO BAY,CARGO BAY,INT.,,1993-02-16,Deep Space Nine
161,NOG,       What's important is that it's top    grade merchandise.  You can't find a    better stem bolt in this sector.,34   INT. CARGO BAY,CARGO BAY,INT.,,1993-02-16,Deep Space Nine
162,JAKE,       And we have a hundred gross of them!,34   INT. CARGO BAY,CARGO BAY,INT.,,1993-02-16,Deep Space Nine
163,NOG,       That's a lot of stem bolts.,34   INT. CARGO BAY,CARGO BAY,INT.,,1993-02-16,Deep Space Nine
164,O'BRIEN ,"   Excuse me, gentlemen...",34   INT. CARGO BAY,CARGO BAY,INT.,,1993-02-16,Deep Space Nine
165,O'BRIEN,   Anyone know what this cargo is doing    here?,34   INT. CARGO BAY,CARGO BAY,INT.,,1993-02-16,Deep Space Nine
166,NOG,       Uh... it belongs to my Uncle Quark;    they're... stem bolts.,34   INT. CARGO BAY,CARGO BAY,INT.,,1993-02-16,Deep Space Nine
167,O'BRIEN,"   Well, do me a favor and tell your    uncle we're getting a bit weary of    him short-circuiting import    procedures.",34   INT. CARGO BAY,CARGO BAY,INT.,,1993-02-16,Deep Space Nine
168,NOG,"   I'll certainly do that, Sir...       It's just that my Uncle Quark really    needed some stem bolts...",34   INT. CARGO BAY,CARGO BAY,INT.,,1993-02-16,Deep Space Nine
169,O'BRIEN,   You mean self-sealing stem bolts.,34   INT. CARGO BAY,CARGO BAY,INT.,,1993-02-16,Deep Space Nine
170,NOG,       That's right!  That's it!  Self-   sealing stem bolts.,34   INT. CARGO BAY,CARGO BAY,INT.,,1993-02-16,Deep Space Nine
