,character,quote,scene,location,view,episode,date,series,file
378,DAX,"   Well, one thing's for certain...        You've stopped thinking about    Grilka.",57   INT. SURGERY - CONTINUOUS,SURGERY,INT.,Looking For par'Mach in All the Wrong Places,1996-07-25,Deep Space Nine,501.txt
379,BASHIR,   Is he... laughing?,58   INT. INFIRMARY,INFIRMARY,INT.,Looking For par'Mach in All the Wrong Places,1996-07-25,Deep Space Nine,501.txt
380,QUARK,   I didn't think he knew how.,58   INT. INFIRMARY,INFIRMARY,INT.,Looking For par'Mach in All the Wrong Places,1996-07-25,Deep Space Nine,501.txt
381,GRILKA,"   I will take my leave now, Quark.    Thank you for your... financial    advice.",58   INT. INFIRMARY,INFIRMARY,INT.,Looking For par'Mach in All the Wrong Places,1996-07-25,Deep Space Nine,501.txt
382,QUARK,   My pleasure. I hope it was worth    the trip.,58   INT. INFIRMARY,INFIRMARY,INT.,Looking For par'Mach in All the Wrong Places,1996-07-25,Deep Space Nine,501.txt
383,GRILKA,   The trip... had its own rewards.,58   INT. INFIRMARY,INFIRMARY,INT.,Looking For par'Mach in All the Wrong Places,1996-07-25,Deep Space Nine,501.txt
384,memory.QUARK,   Will I see you again?,58   INT. INFIRMARY,INFIRMARY,INT.,Looking For par'Mach in All the Wrong Places,1996-07-25,Deep Space Nine,501.txt
385,GRILKA,   I'll be back.,58   INT. INFIRMARY,INFIRMARY,INT.,Looking For par'Mach in All the Wrong Places,1996-07-25,Deep Space Nine,501.txt
386,QUARK,   Don't come back too soon. I need    time to heal.,58   INT. INFIRMARY,INFIRMARY,INT.,Looking For par'Mach in All the Wrong Places,1996-07-25,Deep Space Nine,501.txt
387,BASHIR,   There're days I really hate this    job.,58   INT. INFIRMARY,INFIRMARY,INT.,Looking For par'Mach in All the Wrong Places,1996-07-25,Deep Space Nine,501.txt
