,character,quote,scene,location,view,episode,date,series
447,DAX,"   Nice of you to keep track, Garak.",63   INT. DEFIANT - BRIDGE,DEFIANT,INT.,STAR TREK: DEEP SPACE NINE,1997-08-13,Deep Space Nine
448,BASHIR,   He can't help being negative --    it's his nature.,63   INT. DEFIANT - BRIDGE,DEFIANT,INT.,STAR TREK: DEEP SPACE NINE,1997-08-13,Deep Space Nine
449,GARAK,"   On the contrary, I always hope for    the best. Unfortunately,    experience has taught me to expect    the worst.",63   INT. DEFIANT - BRIDGE,DEFIANT,INT.,STAR TREK: DEEP SPACE NINE,1997-08-13,Deep Space Nine
450,O'BRIEN,"   I'm picking something up...    (a beat as he reads his     console)   Sir, it's a large Dominion fleet,   bearing zero-zero-four mark zero-   zero-nine.",63   INT. DEFIANT - BRIDGE,DEFIANT,INT.,STAR TREK: DEEP SPACE NINE,1997-08-13,Deep Space Nine
451,SISKO,   How large?,63   INT. DEFIANT - BRIDGE,DEFIANT,INT.,STAR TREK: DEEP SPACE NINE,1997-08-13,Deep Space Nine
452,O'BRIEN,   Twelve hundred and fifty four   ships.,63   INT. DEFIANT - BRIDGE,DEFIANT,INT.,STAR TREK: DEEP SPACE NINE,1997-08-13,Deep Space Nine
453,BASHIR,   They outnumber us two to one.,63   INT. DEFIANT - BRIDGE,DEFIANT,INT.,STAR TREK: DEEP SPACE NINE,1997-08-13,Deep Space Nine
454,GARAK,   Now who's being negative.,63   INT. DEFIANT - BRIDGE,DEFIANT,INT.,STAR TREK: DEEP SPACE NINE,1997-08-13,Deep Space Nine
455,SISKO,   Onscreen. Maximum magnification.,63   INT. DEFIANT - BRIDGE,DEFIANT,INT.,STAR TREK: DEEP SPACE NINE,1997-08-13,Deep Space Nine
456,SISKO,"   To all ships, this is Captain   Sisko. Assume attack formation   Delta-two.",63   INT. DEFIANT - BRIDGE,DEFIANT,INT.,STAR TREK: DEEP SPACE NINE,1997-08-13,Deep Space Nine
457,SISKO,"   There's an old saying, ""Fortune    favors the bold.""         Well, we're about to find out.",63   INT. DEFIANT - BRIDGE,DEFIANT,INT.,STAR TREK: DEEP SPACE NINE,1997-08-13,Deep Space Nine
